sentence,label_human,label_embed2discover,corpus_filename,start_pos,end_pos,file
"Verschiedenste Erträge (MinöSt, LSVA, Autovignette u. a.) decken über diverse Finanzgefässe (Bundeshaushalt, FinöV-Fonds) die unterschiedlichsten Kosten, vom Strassenbau und -unterhalt über Erweiterungsinvestitionen (früher: Eisenbahn-Grossprojekte) bis hin zur Subventionierung der Trassenpreise zur Verlagerung des Güterverkehrs auf die Schiene.",0,0,8/06_3077.txt,335,682,8/06_3077.txt
"Sie werden dabei sogar als biologisch abbaubar oder ökologisch angepriesen, oder die Konsumentinnen und Konsumenten werden unter anderem mit dem Hinweis auf die Hitzebeständigkeit ermuntert, solche Becher zu kaufen.",0,0,45/20_3085.txt,1215,1430,45/20_3085.txt
"Weiter wird er beauftragt, den Zusammenarbeitsvertrag mit der Billag auf den frühest- und nächstmöglichen Termin zu kündigen.",0,0,16/10_3316.txt,182,307,16/10_3316.txt
Der Gotthard-Strassentunnel soll ungefähr 2020 komplett saniert werden.,0,0,16/10_3650.txt,0,71,16/10_3650.txt
"Gemäss dem Umweltprogramm der Vereinten Nationen (Unep) werden Menschen, die gezwungen sind, ihre Heimat aufgrund einer starken (natürlichen oder von Menschen verursachten) Degradation der Umwelt, wodurch ihr Lebensumfeld völlig verändert und/oder ihre Lebensqualität erheblich aus dem Gleichgewicht gebracht wird, vorübergehen oder dauerhaft zu verlassen, als Umweltflüchtlinge definiert.",0,0,16/10_3036.txt,592,983,16/10_3036.txt
"Auf nationaler und internationaler Ebene arbeitet sie mit allen relevanten Akteuren zusammen, um Umweltschutz und Nachhaltigkeit zu fördern.",1,1,44/20_018.txt,3170,3310,44/20_018.txt
"41  Nun stellen aber die Ackerbaudienste der ETHZ fest,  dass in einem Abstand von 40 bis 45 m zur Strassenachse  gepflanztes Gemüse, Getreide und Obst verdirbt.",0,0,22/11852.txt,287,449,22/11852.txt
"Es soll in der Kompetenz eines jeden Bauern liegen, welche Massnahmen er bei Feuerbrandbefall bei seinen Bäumen ergreift.",0,0,16/10_3597.txt,516,637,16/10_3597.txt
"Ihnen muss deshalb eine befristete Zeitspanne eingeräumt werden, um die Hausaufgaben zu machen.",0,0,16/10_3696.txt,461,558,16/10_3696.txt
<13. Revision der Bundesbesohlüsse über Berufebildung.,0,0,40/1899_No_bill_id_100.txt,0,54,40/1899_No_bill_id_100.txt
Mit der Strategie Antibiotikaresistenzen Schweiz (StAR) hat der Bundesrat wichtige Schritte unternommen.,0,0,51/22_3256.txt,688,792,51/22_3256.txt
"Welche Ersatzmassnahmen sind geplant, um die Pferderasse der Freiberger zu erhalten, falls der Sparvorschlag angenommen wird?",0,0,16/10_3775.txt,1802,1927,16/10_3775.txt
"Wie unterscheiden sich die erhobenen Daten bezüglich Wildbestäuberpopulationen in landwirtschaftlich stark genutzten Gegenden, im Siedlungsraum, im Wald und in abgelegenen (Berg-)Gebieten?3. Welche Gefahren gehen für Wildbestäuber aus von einem einseitigen Trachtangebot, Zeitpunkt und Methoden der Ernte, synthetischen Pestiziden, vermehrt auftretenden Wetterextremen, der Sauerbrut oder Varroamilbe usw.?4.",1,1,25/13_3899.txt,374,782,25/13_3899.txt
"Es ist deshalb sehr wichtig, dass die Rekrutierung von Kadermitgliedern künftig ebenfalls unter dem Aspekt der Sprachkompetenz erfolgt und zu wenig qualifizierte Personen eine angemessene Sprachausbildung erhalten.",0,0,16/10_3301.txt,2206,2420,16/10_3301.txt
Doch gleichzeitig legt die VEP auch Folgendes fest:,0,0,37/18_3506.txt,809,860,37/18_3506.txt
"Diese Ungleichbehandlung hat zur Folge, dass die Genfer Taxi-Unternehmen von ihrem Heimmarkt ausgeschlossen werden.",0,0,16/10_3125.txt,937,1052,16/10_3125.txt
2. Welche Stelle der Bundesverwaltung ist für die Bekämpfung des Waldsterbens zuständig?,1,1,65/83_558.txt,878,966,65/83_558.txt
"Mit der Rieht und Nutzungsplanung, namentlich mit der klaren Trennung der Bauzonen von den Nichtbauzonen und mit der Ausscheidung von Landwirtschaftszonen sind die Planungsträger diesem Auf trag weitgehend nachgekommen.",0,1,70/90_780.txt,2812,3031,70/90_780.txt
Zwischen 1982 und 1991 wurden in Europa 25 000 Quadratkilometer neue Nationalparkflächen ausgeschieden.,1,1,77/98_3661.txt,183,286,77/98_3661.txt
Die auf Ende 2010 angekündigte Erhöhung der Beanstandungswerte ist gleichbedeutend mit einer Herabsetzung der Qualitätsanforderungen für Schweizer Milch und wird mit einer Anpassung des Schweizer Rechtes an EU-Recht begründet.,0,0,16/10_3169.txt,344,570,16/10_3169.txt
"Aber: Nicht alle Unternehmen sind in der Lage, ihre Kosten kurzfristig zu optimieren.",0,0,16/10_3696.txt,375,460,16/10_3696.txt
"Es sind verschiedene Varianten einer solchen Vermögensbildung denkbar: etwa über eine Versicherung von Katastrophenrisiken, die Bildung eines Solidarpaktes, die Schaffung einer Stiftung oder eines Fonds, aber auch kombinierte Lösungen.",0,0,5/04_3324.txt,1020,1255,5/04_3324.txt
"Trotzdem lebt noch ein grosser Teil der Schweizer Bevölkerung nach einem traditionellen Familienmodell, wonach sich die Frau um Haushalt und Kinder kümmert.",0,0,16/10_1028.txt,572,730,16/10_1028.txt
"Gemeinden sowie den gesamtschweizerischen Organisationen, die sich dem Naturschutz, dem Heimatschutz, der Denkmalpflege oder verwandten, rein ideellen Zielen widmen und mindestens seit zehn Jahren bestehen, steht zur Verfolgung dieser Ziele das Beschwerderecht zu, soweit ....Abs.",1,1,3/02_436.txt,1488,1768,3/02_436.txt
"Mitunterzeichner: Baumann, Bühlmann, Carobbio, Caspar Hutter, Diener, Eggenberger, von Feiten, Göll, Grendelmeier, Maeder, Meier Samuel, Steiger, Thür, Weder Hansjürg, Zbin den, Ziegler Jean (16)",0,0,72/93_458.txt,3693,3888,72/93_458.txt
"Bisphenol A (eine Substanz, die in den zur Verpackung von Lebensmitteln verwendeten Kunststoffen allgegenwärtig ist) gilt als Auslöser für Brust- und Prostatakrebs, Fettleibigkeit, neurologische Verhaltensstörungen, Entwicklungsstörungen sowie Beeinträchtigungen der Fortpflanzungsfähigkeit.",0,0,20/11_4045.txt,317,608,20/11_4045.txt
"Der Aufenthaltsstatus vorläufig aufgenommen im Asylgesetz ist einzuschränken oder allenfalls aufzuheben.2. Anstelle dieses Status soll eine ordentliche, auf ein Jahr befristete Aufenthaltsbewilligung erteilt",0,0,16/10_3065.txt,134,343,16/10_3065.txt
"Der Aufenthaltsstatus vorläufig aufgenommen im Asylgesetz ist einzuschränken oder allenfalls aufzuheben.2. Anstelle dieses Status soll eine ordentliche, auf ein Jahr befristete Aufenthaltsbewilligung erteilt",0,0,16/10_3065.txt,134,343,16/10_3065.txt
Das Schweizerische Freilichtmuseum Ballenberg ist als einzigartiges Zentrum für die Vermittlung der ländlichen Kultur in der Schweiz mit nationaler und internationaler Ausstrahlung aus der Schweizer Museumslandschaft nicht mehr wegzudenken.,0,1,27/14_3284.txt,0,240,27/14_3284.txt
"Um die der Eidgenossenschaft entstandenen und entstehenden Kosten unter Ausschluss eines Anscheins von gefährdeter Unabhängigkeit der staatlichen Amtshilfebehörde gleichwohl auf die UBS überwälzen zu können, wird daher der Bundesrat beauftragt, die dazu erforderliche gesetzliche Grundlage zu schaffen oder eine bestehende auf diesen Sachverhalt auszuweiten.",0,0,16/10_3026.txt,1425,1783,16/10_3026.txt
"Handlungsbedarf des Bundes zur Verflüssigung des Verkehrs;- Prüfung des verstärkten Einsatzes von technischen Massnahmen (z. B. bessere und auf die Verkehrsflüsse abgestimmte Ampelsteuerungen, Grünphasen, Verkehrstelematik-Mittel usw.);- Aufstellung einer Zeitplanung zur Einführung solcher technischen Massnahmen;- Koordinationsbedarf bei Strassenbauvorhaben der Kantone und Gemeinden durch den Bundesrat hinsichtlich umweltschädlicher Auswirkungen von Verkehrshindernissen aller Art;- Priorisierung von Projekten wie z. B. die Benutzung von Pannenstreifen auf den Autobahnen zur Verflüssigung des Verkehrs.",0,0,16/10_3417.txt,81,689,16/10_3417.txt
"Der vorliegende Fall weist auf Lücken im Sprengstoffgesetz hin, die geprüft und adäquat gefüllt werden müssen.",0,0,16/10_3614.txt,1112,1222,16/10_3614.txt
"Die Revitalisierung und die Errichtung von Pufferzonen sind in diesem Zusammenhang zentral, aber äusserst heikel.",1,1,53/22_4490.txt,1440,1553,53/22_4490.txt
Nur so kann ein akzeptabler und verträglicher Wolfsbestand neben dem Tourismus sowie der Land- und Alpwirtschaft gewährleistet werden.,1,1,50/21_493.txt,2116,2250,50/21_493.txt
Am 12. Juni 2010 ereignete sich in Reckingen im Wallis ein Carunfall.,0,0,16/10_3518.txt,479,548,16/10_3518.txt
Dies erfolgte gemäss,0,0,9/06_3557.txt,227,247,9/06_3557.txt
Wie beurteilt der Bundesrat die rechtliche Situation einer generellen regionalen Risikoselektion bei einer Versicherung?,0,0,6/04_5241.txt,469,589,6/04_5241.txt
"Der Bundesrat ist aufgefordert, die nötigen Grundlagen zu schaffen, um eine Testphase für den Einzelverkauf von Antibiotika zu ermöglichen.",0,0,35/17_3942.txt,1521,1660,35/17_3942.txt
"Dieses Abkommen sieht verschiedene Fristen vor für die Erklärung, wo die betreffende Person ihren Militärdienst leisten will.",0,0,16/10_3464.txt,1994,2119,16/10_3464.txt
Rund 400 Projekte für die Windkraftnutzung sind für eine KEV-Unterstützung vorgesehen.,0,0,16/10_3534.txt,399,485,16/10_3534.txt
"Aufgrund der damit verbundenen Missbrauchsgefahr sieht der Gesetzgeber in Artikel 16 Absatz 3 des Postgesetzes vor, dass die Tarife der Post für abonnierte Zeitungen den in grösseren Agglomerationen üblichen Preisen entsprechen müssen.",0,0,28/14_4181.txt,297,532,28/14_4181.txt
"Der Bundesrat wird ersucht, im Rahmen der Erarbeitung des Hochschulrahmengesetzes, das für die Zeit nach Auslaufen des Universitätsförderungsgesetzes am 31.12. 2007 in Aussicht gestellt wurde, sicherzustellen, dass das Instrument der projektgebundenen Beiträge für alle Hochschulen (kantonale Universitäten, ETH, Fachhochschulen) eingeführt wird.",0,0,4/03_3182.txt,0,346,4/03_3182.txt
Der Schweizerische Nationalfonds (SNF) bezeichnet sich als wichtigste Schweizer Institution in der Förderung der wissenschaftlichen Forschung.,0,0,16/10_3575.txt,1273,1415,16/10_3575.txt
Die Arbeiten an einer Totalrevision der Bundesverfassung sind nach wie vor im Gang.,0,0,70/90_692.txt,1858,1941,70/90_692.txt
"Trotzdem hält das Bundesamt für Landwirtschaft in Zusammenarbeit mit den kantonalen Pflanzenschutzdiensten und der Forschungsanstalt Wädenswil an seiner Strategie Verhindern, Tilgen und Eindämmen fest.",1,1,11/08_3040.txt,577,780,11/08_3040.txt
Der nach vollen Tagen oder Wochen zu bemessende Dauerarrest dauert mindestens eine Woche und höchstens vier Wochen.,0,0,16/10_3062.txt,1190,1305,16/10_3062.txt
Diese Pflanzen bereiten den Kantonen und Gemeinden wie auch landwirtschaftlichen Betrieben grosse Probleme.,1,1,29/15_3289.txt,275,382,29/15_3289.txt
Die Lawinenniedergänge von Ende Februar tangierten auch unverbaute Bauzonen und besiedelte Gebiete.,0,1,78/99_3057.txt,676,775,78/99_3057.txt
Es handelt sich um eine Weiterführung und Umsetzung der Zielsetzungen nach dem 7. Landwirtschaftsbericht.-,0,1,74/95_3277.txt,1768,1874,74/95_3277.txt
"Von forstwirtschaftlicher Seite wird die Forderung erhoben, die Luft verschmutzung zur Gewährleistung des Schutzes der Wälder auf den Stand der Jahre 1950 bis 1960 zurückzuführen.",1,1,66/85_959.txt,426,605,66/85_959.txt
Die Gesetzgebung schütze das Wohlergehen der einzelnen Tiere unabhängig von deren Anzahl.,0,1,48/21_044.txt,2268,2357,48/21_044.txt
Im März 2010 hat der US-Senat den Foreign Account Tax Compliance Act verabschiedet.,0,0,16/10_3560.txt,613,696,16/10_3560.txt
Klimaerwärmung und die Ressourcenverknappung der fossilen Energieträger sprechen für einen haushälterischen Umgang mit den Energieträgern.,0,1,9/06_3595.txt,422,560,9/06_3595.txt
nichtsdestotrotz scheint das Gesetz bereits das Interesse anderer Staaten geweckt zu haben.,0,0,16/10_3263.txt,1482,1573,16/10_3263.txt
Bei einer Kollision zwischen den Zielen Schutzbedürfnis und Verfahrensbeschleunigung gebührt dem Schutzbedürfnis der Minderjährigen jedenfalls der Vorrang.,0,0,74/95_3344.txt,1804,1959,74/95_3344.txt
Sie dient auch massgeblich als materielle Grundlage für die persönliche Freiheit.,0,0,16/10_3651.txt,1105,1186,16/10_3651.txt
Die tief in der Bevölkerung verankerte Ablehnung von Drogen wird damit geschwächt.,0,0,16/10_3664.txt,192,274,16/10_3664.txt
Die Verordnung über Fernmeldedienste legt die minimale Übertragungsrate von 600/100 Kilobit/Sekunde fest.,0,0,16/10_3742.txt,1104,1209,16/10_3742.txt
"Je scheuer eine Wildtierart ist und je mehr Menschen in einem Gebiet unterwegs sind, desto kleiner wird der Lebensraum der betreffenden Tiere.",1,1,3/02_3720.txt,910,1052,3/02_3720.txt
"Die Parteien schlagen eine Bundespräsidentin bzw. einen Bundespräsidenten vor, dabei besteht die Möglichkeit der Wiederwahl.",0,0,16/10_3110.txt,213,337,16/10_3110.txt
Im Rahmen der Motion 17.3942 Tornare Einzelverkauf von Medikamenten: Wagen wir den Versuch! wurde eine Machbarkeitsstudie mit Antibiotika durchgeführt.,0,0,54/23_3289.txt,424,577,54/23_3289.txt
"Die Motion schlägt deshalb vor, neu auch alle Lotteriespielautomaten wie Tactilo, Touchlot usw. dem Spielbankengesetz zu unterstellen.",0,0,16/10_3426.txt,926,1060,16/10_3426.txt
"Zweck dieser Normen soll es sein, biologischen und physischen Völkermord zu verhüten und die Menschenrechte sowie die kulturelle Vielfalt in der Schweiz, in Europa und in der Welt zu schützen und zu fördern.",1,0,12/08_3789.txt,2204,2411,12/08_3789.txt
Bis Ende 2005 sollen diese Embryonen weiterhin zur Fortpflanzung und bis Ende 2008 mit Einwilligung der betroffenen Paare zu Forschungszwecken verwendet werden.,0,0,2/02_083.txt,7743,7903,2/02_083.txt
In der Folge ist eine zusätzliche zweijährige Planungsphase in Form einer Variantenüberprüfung und -evaluation durchgeführt worden.,0,0,20/11_3966.txt,140,271,20/11_3966.txt
"Der Bundesrat wird beauftragt, einen Bericht zu erstellen über den Einsatz von internationalen Verbindungspersonen im Rahmen der Sicherheit der Schweiz.",0,0,16/10_3112.txt,0,152,16/10_3112.txt
"Bei den Antibiotika habe der Verdrängungswettbewerb dazu geführt, dass deren Produktion fast ausschliesslich am Tropf von China und Indien hänge, sagen Prof. H. Schweim, ehemaliger Präsident des Bundesinstitutes für Arzneimittel und Medizinprodukte und Prof. F. Sörgel, Institut für biomedizinische und pharmazeutische Forschung Nürnberg.",0,0,37/18_3871.txt,113,451,37/18_3871.txt
"Der Bundesrat wird deshalb beauftragt, die schwere Steuerhinterziehung dem Steuerbetrug gleichzusetzen.",0,0,16/10_3082.txt,1052,1155,16/10_3082.txt
Dazu meine Fragen an den Bundesrat:,0,0,16/10_3581.txt,1357,1392,16/10_3581.txt
"Die Kultur ermöglicht eine harmonische Entwicklung des Menschen, fördert den nationalen Zusammenhalt in einem multikulturellen Land und ermöglicht eine bessere Integration anderer Kulturen.",0,0,16/10_3056.txt,260,449,16/10_3056.txt
Ich frage den Bundesrat deshalb an:1.,0,0,16/10_1040.txt,832,869,16/10_1040.txt
Ich frage den Bundesrat deshalb an:1.,0,0,16/10_1040.txt,832,869,16/10_1040.txt
"Im Kanton Basel-Stadt wird darüber nachgedacht, wie die Institutionen dazu angehalten werden könnten, mehr respektive genügend Ausbildungsplätze anzubieten.",0,0,16/10_3544.txt,306,462,16/10_3544.txt
"Warum lässt er zu, dass ein Bundesamt bereits einen Massnahmenkatalog zuhanden von Medien und damit der Öffentlichkeit durchlässt, bevor er selber über diese Massnahmen befunden hat?2.",0,0,16/10_3448.txt,526,710,16/10_3448.txt
Der Einsatz von biologischen Waffen ist beispielsweise aufgrund des Krieges in der Ukraine nicht auszuschliessen und hätte potenziell negative Auswirkungen.,0,0,53/22_4381.txt,223,379,53/22_4381.txt
Abgesehen vom ökologischen Unsinn dieses Einkaufstourismus schwächt diese Aufforderung die Existenz vieler Läden im grenznahen Raum.,0,0,16/10_3781.txt,823,955,16/10_3781.txt
Die Schweizer Pilzproduzenten sind also seit Jahrzehnten offenen Grenzen und somit dem freien Wettbewerb ausgesetzt.,0,0,16/10_3388.txt,1430,1546,16/10_3388.txt
Und auf Bahnzugängen sowie in Unterführungen ist zu Zeiten des Stossverkehrs unangenehm viel Rauch in der Luft.,0,0,16/10_1031.txt,936,1047,16/10_1031.txt
"Der Bundesrat wird beauftragt, einen Bericht vorzulegen, in dem er untersucht, inwieweit eine nationale Strategie für eine bessere Erschliessung der Tourismusregionen durch den öffentlichen Verkehr angezeigt ist.",0,0,45/20_3328.txt,1080,1292,45/20_3328.txt
"Hat er Kenntnis davon, wie sich diese Mittel im Boden und in der Pflanze verhalten (die Abbauzeit ist sehr lange)?",0,0,16/10_1041.txt,1490,1604,16/10_1041.txt
"Hat er Kenntnis davon, wie sich diese Mittel im Boden und in der Pflanze verhalten (die Abbauzeit ist sehr lange)?",0,0,16/10_1041.txt,1490,1604,16/10_1041.txt
Botschaft vom 3. Juli 2001 zum Bundesgesetz über Zertifizierungsdienste im Bereich der elektronischen Signatur (ZertES),0,0,1/01_044.txt,0,119,1/01_044.txt
Die Bundesanwaltschaft wird in ihrer Öffentlichkeitsarbeit von der Kommunikationsfirma Hirzel Neef Schmid Konsulenten beraten.,0,0,16/10_3564.txt,0,126,16/10_3564.txt
"Einziger Streitpunkt war die Frage, ob die biometrischen Daten zentral gespeichert und aufbewahrt werden sollen.",0,0,13/09_085.txt,317,429,13/09_085.txt
Dasselbe Phänomen zeigt sich auf den landwirtschaftlich genutzten Wiesen und Feldern.,0,1,16/10_3328.txt,1094,1179,16/10_3328.txt
Bei der Umsetzung der Gewässerraumvorschriften soll sowohl innerhalb als auch ausserhalb des Siedlungsgebietes die haushälterische Nutzung des Bodens im Vordergrund stehen.,1,1,22/12_321.txt,382,554,22/12_321.txt
Die Entscheidungsinstanzen haben dazu sorgfältige und verlässliche Detailabklärungen zu veranlassen.,0,0,17/10_4017.txt,1225,1325,17/10_4017.txt
sowohl die Konsumentinnen und Konsumenten als auch die im Lebensmittelsektor beschäftigten Personen müssten besser über den Zusammenhang zwischen Ernährungsverhalten und Klimaerwärmung informiert werden.,0,0,16/10_3416.txt,2125,2328,16/10_3416.txt
SR 512.21) und insbesondere Artikel 88 Absatz 2,0,0,16/10_1081.txt,445,492,16/10_1081.txt
"Leider gibt es nur noch wenige davon, 90 Prozent der Schweizer Auen sind bereits verschwunden.",1,1,77/98_3595.txt,252,346,77/98_3595.txt
"Dieser Verlag fährt über seine Website www.all4shooters.com eine politische Kampagne gegen die Umsetzung der EU-Waffenrichtlinie.- Sorgt der Bundesrat für politische Neutralität der Ruag und ihrer Beteiligungen?- Wird er die Ruag anweisen, der indirekten Medienförderung ein Ende zu bereiten und die Beteiligung an der Visier Medien Holding AG zu verkaufen?",0,0,38/18_5393.txt,129,486,38/18_5393.txt
"Der Bundesrat wird beauftragt, die volkswirtschaftlichen Risiken, die von gewissen Grossbanken ausgehen, mit gesetzlichen Massnahmen rasch und wirksam zu begrenzen.",0,0,16/10_3352.txt,0,164,16/10_3352.txt
Die Gesamtenergiestatistik unterscheidet beim Erdölverbrauch nach Brennstoffen und Treibstoffen.,0,0,16/10_3181.txt,162,258,16/10_3181.txt
"Der Bundesrat wird beauftragt, einen Gesetzentwurf vorzulegen, wonach1. Personenschäden nur noch von medizinischen Experten begutachtet werden dürfen, die einerseits die Patienten nicht behandeln und die andererseits dazu besonders befähigt sind, wobei der Bundesrat die detaillierten Voraussetzungen an die besondere Befähigung umschreibt;2. zur Festlegung der natürlichen Kausalität unfallanalytische und biomechanische Erkenntnisse mitberücksichtigt werden müssen;3. eine einheitliche Behandlung der Kausalitätsbeurteilung im Sozialversicherungs- und Haftpflichtrecht sichergestellt wird.",0,0,9/06_3375.txt,1461,2052,9/06_3375.txt
Mit der Konvergenz von Radio und Fernsehen gibt es im administrativen Bereich erhebliche Kosteneinsparmöglichkeiten.,0,0,16/10_3611.txt,923,1039,16/10_3611.txt
Angesichts von Verzichtsplänen (z. B. bei Swissinfo) muss,0,0,16/10_3411.txt,1246,1303,16/10_3411.txt
"528/85.451 I Sager «Widerstandsrecht» (5. Juni 1985) Teilt der Bundesrat die Auffassung, 1. dass die in Zeitereignissen, Meinungsäusserungen und sogar in Sendungen von Radio und Fernsehen zu beobachtende, direkte und indirekte Thematisierung des vom Naturrecht abgeleiteten «Rechtes auf Widerstand in der Demokratie» im Hinblick auf innenpolitisch kontroverse Probleme nicht nur eine Denaturierung dieses Naturrechtes darstellt, son dern unmittelbar auch unsere Rechtsordnung in Frage stellt und damit allenfalls gegen nationale Interessen Verstössen könnte?",0,0,66/85_451.txt,0,559,66/85_451.txt
"Mit einem solchen Vorgehen könnte die Bandbreite möglicher Standorte vergrössert und der Druck auf die weiteren Gebiete, die in Betracht kommen, verringert werden.",0,0,16/10_3722.txt,1412,1575,16/10_3722.txt
Der Eingriff in die unberührte sensible Natur im Berggebiet (vor allem im alpinen Raum) durch Freiflächensolaranlagen ist enorm.,1,1,51/22_3035.txt,4002,4130,51/22_3035.txt
Neuere Studien und Untersuchungen belegen die vielfachen Nachteile der Kunstschneeproduktionsmaschinen auf das Gleichgewicht der Natur.,1,1,85/No_bill_id_6209.txt,74,209,85/No_bill_id_6209.txt
"Obwohl das Flugfeld Locarno-Magadino in unmittelbarer Nähe zum international und national bedeutenden Naturschutzgebiet und Vogelreservat der Bolle di Magadino liegt, sieht die Revision des Sachplans Infrastruktur Luftfahrt (SIL) vor, die Piste um 170 Meter zu verlängern, dies zusammen mit weiteren Ausbauten.",1,1,27/14_3456.txt,0,310,27/14_3456.txt
Dafür sind die erforderlichen gesetzlichen Grundlagen zu schaffen.,0,0,16/10_3397.txt,218,284,16/10_3397.txt
Wie funktioniert hierzu die Zusammenarbeit mit den Kantonen?,0,0,16/10_3147.txt,555,615,16/10_3147.txt
"Angesichts dieser Praxis, die von den Gewerkschaften als Lohndumping betrachtet wird, bitte ich den Bundesrat um die Beantwortung folgender Fragen:-",0,0,16/10_1104.txt,464,612,16/10_1104.txt
"1. Wird der oben genannte Wegweiser Empfehlungen an die Gemeinden und Kantone zur Abschaffung, schrittweisen Reduktion oder Reform der für die Biodiversität schädlichen Subventionen enthalten, mit dem Ziel, die unerwünschten Auswirkungen auf ein Minimum zu beschränken oder zu vermeiden?",1,0,51/22_1033.txt,935,1222,51/22_1033.txt
"Ich bitte den Bundesrat, folgende Fragen zu beantworten:1. lm Landschaftskonzept Schweiz hat der Bundesrat 1997 klar festgelegt, dass die Rote Liste der gefährdeten Vogelarten jährlich um 1 Prozent abnehmen soll.a.",1,1,6/04_3486.txt,1059,1273,6/04_3486.txt
Der Tiefseebergbau hat offensichtlich Auswirkungen auf diese Biodiversität.,1,1,54/23_3106.txt,993,1068,54/23_3106.txt
"Sie befindet sich in der nichtöffentlichen Phase der verwaltungsinternen Bearbeitung (vgl. Bundesgesetz über das Öffentlichkeitsprinzip der Verwaltung, insbesondere Art.",0,0,16/10_3423.txt,991,1160,16/10_3423.txt
Die Bedürfnisse der Anlegerinnen und Anleger werden besser zur Kenntnis genommen.,0,0,16/10_3397.txt,2214,2295,16/10_3397.txt
"Rund 1500 Schweizer Hobbyjägerinnen und Hobbyjäger pro Jahr reisen um den Globus, um seltene Tiere zu erlegen und deren Trophäen mit nach Hause zu nehmen.",0,1,45/20_3796.txt,1168,1322,45/20_3796.txt
"Mit dem absoluten Schutz des Waldes verliert das landwirtschaftliche Kulturland durch die Ausdehnung des Waldes, durch die Ersatzaufforstungen, durch Anlagen der Waldwirtschaft, die nicht im Wald gebaut werden dürfen, und durch die fehlende Interessenabwägung wichtige Produktionsflächen, aber auch ökologische Ausgleichsflächen.",1,1,16/10_3489.txt,1192,1521,16/10_3489.txt
"Wo ist ein Ausbildungszentrum des EDA geplant, und wie werden bereits vorhandene Infrastrukturen berücksichtigt?3. Wie ist die Planung und Koordination zwischen dem EDA und dem VBS, allenfalls mit weiteren Departementen sichergestellt?",0,0,16/10_3378.txt,196,431,16/10_3378.txt
Ein effektiver Ersatz der Fruchtfolgeflächen gemäss Artikel 36a Absatz 3 GSchG ist zu gewährleisten.d.,1,1,25/13_307.txt,529,631,25/13_307.txt
"Das Konzept der Sorgfaltspflicht (Due Diligence) muss unbedingt in die Leitsätze aufgenommen werden, denn damit kann dem Risiko von Menschenrechtsverletzungen nicht nur während einzelner Transaktionen vorgebeugt werden, sondern während der ganzen Lebensdauer eines Projektes oder einer wirtschaftlichen Tätigkeit.",0,0,16/10_3414.txt,1964,2277,16/10_3414.txt
"Die Botschaft zum Konsolidierungsprogramm, welche der Bundesrat dem Parlament vorgelegt hat, sieht einerseits vor, das Nationalgestüt zu schliessen oder zu privatisieren.",0,0,16/10_3767.txt,1740,1910,16/10_3767.txt
"Am 8. Oktober 2004 hat das Parlament das Bundesgesetz über die Transplantation von Organen, Geweben und Zellen verabschiedet.",0,0,10/07_3233.txt,115,240,10/07_3233.txt
Die neue Strategie für die Nahrungsmittelversorgung in Krisenzeiten sieht die folgenden Hauptmassnahmen,0,0,75/96_3495.txt,1880,1983,75/96_3495.txt
"Um Eutererkrankungen vorzubeugen, werden aber beim sogenannten Trockenstellen von (Hochleistungs-)Milchkühen Antibiotika direkt in die Zitzenkanäle appliziert.",0,0,77/98_3010.txt,82,241,77/98_3010.txt
"Im Fokus steht dabei die kontinentale Bedeutung der Wassersysteme, welche im Himalaya ihre Quellen haben und für Millionen von Menschen am Unterlauf die Lebensgrundlage darstellen.",1,1,25/13_3938.txt,903,1083,25/13_3938.txt
Im Jahre 2009 wurden rund 9 Milliarden Franken an Strassen- und Autosteuern eingenommen.,0,0,16/10_3432.txt,832,920,16/10_3432.txt
"Wir bitten den Bundesrat, in dem neuen Verfassungs  artikel, der gegenwärtig ausgearbeitet wird, Bestimmungen  zum Schutz der Mieter gegen übersetzte Mietzinse und  missbräuchliche Erhöhungen sowie gegen ungerechtfertigte  Kündigungen in Gemeinden, wo Wohnungsnot besteht,  vorzusehen.",0,0,18/10685.txt,588,874,18/10685.txt
Kompetenzgerangel und Gartendenken sind zum nationalen Risikofaktor geworden.,0,0,14/09_4132.txt,750,827,14/09_4132.txt
