sentence,label_human,label_embed2discover,corpus_filename,start_pos,end_pos,file
Wie sieht die aktuelle Praxis,0,0,16/10_1101.txt,1208,1237,16/10_1101.txt
Zum Teil aber sind solche Härten unnötig oder widersprechen gar der Zielset zung.,0,0,69/90_422.txt,357,438,69/90_422.txt
"Daher stelle ich dem Bundesrat die folgenden Fragen:-Hält er es immer noch für angebracht, eine Erhöhung des bilateralen Handelsvolumens mit der VR China zu fördern?-Hat er einen Plan, um unsere Abhängigkeit von der VR China zu reduzieren, indem unsere Landesversorgung diversifiziert wird?-Hat er einen Plan, um unsere Institutionen und strategischen Wirtschaftssektoren vor eventuellen kriegerischen Absichten Pekings zu schützen?- Hat er, allgemeiner gefragt, vor, seine China-Strategie zu überarbeiten und die Konsequenzen der absehbaren Verschlechterungen der Beziehungen zwischen der VR China und den westlichen Demokratien darin einfliessen zu lassen?",0,0,52/22_3984.txt,1614,2272,52/22_3984.txt
"direkte Förderung der kommunalen WKK-Nah- und Fernwärmepolitik, insbesondere auch kombinierte Lösungen mit fossilen und biogenen Brennstoffen.",0,0,12/08_3284.txt,1333,1475,12/08_3284.txt
"Zudem kann sich der Bundesrat aus der Verantwortung stehlen, indem er unangenehme Entscheide diesen neuen Aufgabenträgern überlässt oder zuschiebt, wie im Falle der Auslieferung von Bankdaten geschehen.",0,0,16/10_3290.txt,882,1084,16/10_3290.txt
Das Globalbudget für die Rüstungsausgaben 2010 wird Ende Jahr mit Bestimmtheit nicht ausgeschöpft sein.,0,0,16/10_3730.txt,0,103,16/10_3730.txt
Fast die Hälfte der in der Schweiz konsumierten Fleischprodukte wird importiert.,0,0,16/10_3416.txt,771,851,16/10_3416.txt
Er hat sich am Mittwoch für einen Gegenvorschlag zur Konzernverantwortungsinitiative ohne Haftung ausgesprochen.,0,0,31/16_077.txt,39610,39722,31/16_077.txt
"Mit diesen zusätzlichen Mitteln, die dem Kauf zusätzlicher Fertigungslinien und dem Ausbau der Technik und der Informatikinfrastruktur dienen, dürfte der immer noch sehr hohen Nachfrage nach neuen Pässen genügt werden können.",0,0,5/04_049.txt,2240,2465,5/04_049.txt
"Im Moment sind die Kantone daran, die Umsetzungsgesetzgebung auszuarbeiten.",0,0,16/10_3550.txt,1114,1189,16/10_3550.txt
"Gibt es eine Studie zu den Nachteilen einer Umstellung der Nummern 117, 118 und 144?",0,0,16/10_3281.txt,967,1051,16/10_3281.txt
Damit können neu auch Hafenanlagen für den Güterumschlag im kombinierten Verkehr vom Rahmenkredit profitieren.,0,0,32/16_3792.txt,166,276,32/16_3792.txt
"Noch immer sei ein Krippenplatz für einige Eltern unerschwinglich, kritisierte Emanuel Amoos (SP/VS).Eine bessere Vereinbarkeit von Familie und Beruf wäre ein wichtiger Standortfaktor, sagte Thomas Brunner (GLP/SG).",0,0,52/22_403.txt,7700,7915,52/22_403.txt
"Der einheitliche biometrische Aufenthaltstitel muss, auf einem Datenchip gespeichert, ein Gesichtsbild sowie zwei Fingerabdruckbilder der Inhaberin oder des Inhabers enthalten.",0,0,13/09_085.txt,2917,3093,13/09_085.txt
"Beides sind Hürden, die unnötig sind und keinen spezifischen Zweck erfüllen oder Mehrwert bieten.",0,0,49/21_4422.txt,1609,1706,49/21_4422.txt
"Die ressourcenstarken Kantone, welche ab 2008 zusammen rund zwei Milliarden Franken bereitstellen und effektiv bezahlen müssen, erhalten keinen Härteausgleich.",0,0,16/10_3134.txt,942,1101,16/10_3134.txt
"Diese Massnahmen könnten in einer Praxisänderung bestehen oder, wenn notwendig, sogar in einer Änderung des Waldgesetzes.",0,0,16/10_3722.txt,2537,2658,16/10_3722.txt
"Sie arbeitete in der OSZE-Assistenzgruppe für Tschetschenien, war Botschafterin in Bosnien-Herzegowina, Chefin der Politischen Abteilung IV (Menschenrechte und Humanitäre Angelegenheiten) und übernahm 2002 bis 2006 die Uno-Beobachtermission in Georgien.",0,0,16/10_1074.txt,181,434,16/10_1074.txt
"Wieso aber sollte der Weizenproduzent die übrigen 8 Prozent zu europäischen Preisen erzeugen, die ein FHAL mit der EU mit sich bringen würde?",0,0,16/10_3736.txt,1254,1395,16/10_3736.txt
"Er ist nicht nur Lebensraum für Tiere und Pflanzen, sondern auch wertvoller, nachwachsender Rohstofflieferant für viele KMU, also ein Wirtschaftswald, und das seit vielen Generationen.",1,1,49/21_3883.txt,44,228,49/21_3883.txt
Es ist genug Geld für die Strassen da.,0,0,32/16_3238.txt,2220,2258,32/16_3238.txt
Dieser aber ist eines der wichtigsten Wasservogelgebiete Europas und dessen Teilgebiet Fanell ein international bedeutendes Wasser- und Zugvogelreservat des Bundes.,1,1,12/08_3226.txt,302,468,12/08_3226.txt
"Und denkt er nicht, dass die Forderung vermessen ist, dass Schweizer Holz denselben Kriterien wie FSC-zertifiziertes Holz entsprechen muss?4.",0,0,16/10_3032.txt,1085,1226,16/10_3032.txt
"Welche Rolle können und sollen Frauen in der Armee spielen, und welche Massnahmen werden ergriffen, damit dafür ausreichend Frauen gewonnen werden können?",0,0,14/09_3586.txt,2172,2326,14/09_3586.txt
Das heute eingesetzte System zur Erfassung biometrischer Daten soll ab 2020 ersetzt werden.,0,0,31/16_063.txt,9074,9165,31/16_063.txt
"Diese Motion hat daher zum Zweck, diesen semantischen Fehler zu korrigieren, der die Cannabispflanze nicht als Pflanze mit verschiedenen Verwendungszwecken (medizinische Zwecke oder Genusszwecke), sondern nur als Betäubungsmittel erfasst.",0,0,45/20_3483.txt,632,870,45/20_3483.txt
"Dabei ist auch eine Reserveüberführung in Taggeldversicherungslösungen zu ermöglichen, die nach den Bestimmungen des Versicherungsvertragsgesetzes (VVG) abgeschlossen werden, wenn diese Verträge einen gleichwertigen oder sehr ähnlichen Schutz, wie es das KVG vorschreibt, aufweisen.",0,0,16/10_3788.txt,1837,2119,16/10_3788.txt
Deshalb verstehen viele verheiratete Frauen sich selbst als alleinerziehende Mütter ihres Nachwuchses.,0,0,16/10_3219.txt,749,851,16/10_3219.txt
"Der Bundesrat erhält den Auftrag, die landwirtschaftliche Ge setzgebung zu ergänzen und bezüglich der flächenbezogenen Direktzahlungen anzupassen, damit vor allem jene Landwirt schaftsbetriebe gefördert werden, welche vertraglich ihre ge samte Produktion auf naturnahe umweltschonende Landbau methoden umstellen.",0,0,69/89_830.txt,97,409,69/89_830.txt
Die Mietpreise in der Schweiz steigen.,0,0,52/22_3480.txt,0,38,52/22_3480.txt
"Wie bewertet er die Aktivitäten ausländischer Hedge-Fonds, der beteiligten Banken und ihrer Manager in der Schweiz?",0,0,16/10_3337.txt,776,891,16/10_3337.txt
Sie ist auch eine der wesentlichen Treiberinnen des weltweiten Verlustes an Biodiversität.,1,1,38/18_4376.txt,127,217,38/18_4376.txt
"Straftäterinnen und Straftäter ihre biometrischen Daten abliefern, heute aber sind alle suspekt, sogar Kinder.",0,0,14/09_3382.txt,1220,1330,14/09_3382.txt
"Darum bitte ich den Bundesrat, folgende Frage zu beantworten:",0,0,16/10_1058.txt,1155,1216,16/10_1058.txt
"Wie lange dauert es noch, bis das BAG endlich ein verlässliches Monitoring in Echtzeit (Informationen pro Quartal beispielsweise) gewährleisten kann?4.",0,0,16/10_3678.txt,1564,1715,16/10_3678.txt
Artikel 82 Absatz 3 der Bundesverfassung scheint also auch in Zukunft seine Relevanz zu behalten.,0,0,16/10_3384.txt,2254,2351,16/10_3384.txt
"Die Saläre für Spezialisten mit Praxis- und Führungserfahrung liegen unter den marktüblichen Abgeltungen für vergleichbare Funktionen in der Privatwirtschaft, aber auch deutlich unter denjenigen der Schweizerischen Nationalbank.",0,0,16/10_3752.txt,1139,1367,16/10_3752.txt
Dabei sollten nicht nur rechnerische oder geografische Grössen eine Rolle spielen.,0,0,19/11_3037.txt,956,1038,19/11_3037.txt
"Der Bundesrat wird daher gebeten, folgende Fragen zu beantworten:",0,0,16/10_3091.txt,446,511,16/10_3091.txt
"Eine Minderheit (Fehr Jacqueline, Carobbio Guscetti, Hess Lorenz, Rossini, Schenker Silvia, Steiert, van Singer, Weibel) beantragt, die Motion abzulehnen.",0,0,22/12_3342.txt,455,609,22/12_3342.txt
"Hat er Kenntnis davon, wie sich diese Mittel im Boden und in der Pflanze verhalten (die Abbauzeit ist sehr lange)?",0,0,16/10_1041.txt,1490,1604,16/10_1041.txt
"Hat er Kenntnis davon, wie sich diese Mittel im Boden und in der Pflanze verhalten (die Abbauzeit ist sehr lange)?",0,0,16/10_1041.txt,1490,1604,16/10_1041.txt
"Wie erklärt er seine Aussage, wonach die Verhandlungsposition der Schweiz sehr schlecht sei, obwohl diverse rechtliche und wirtschaftliche Gutachten, die der Verhandlungsdelegation bekannt waren, der Schweiz eine gute Ausgangslage einräumen?2. Aus welchen Überlegungen hat er zugelassen, dass mit dem neuen Vertrag die Schweiz durch Deutschland Diskriminierungen erfährt?",0,0,1/01_3279.txt,531,902,1/01_3279.txt
"Weitere Beiträge werden für die Ausscheidung von Waldreservaten, das Sturmholzprogramm und den Wiederaufbau eingesetzt.",1,1,0/00_013.txt,9083,9202,0/00_013.txt
"SDA-MeldungDebatte im Ständerat, 14.06.2017System zur Erfassung biometrischer Daten kann ersetzt werden",0,0,31/16_063.txt,2042,2145,31/16_063.txt
"Um die ILO im multilateralen Umfeld aufzuwerten, wird der Bundesrat beauftragt, sowohl bei der ILO als auch bei der WTO die nötigen Massnahmen zu evaluieren und vorzuschlagen, damit die ILO den Beobachterstatus bei der WTO erhält.",0,0,16/10_3637.txt,0,230,16/10_3637.txt
"David stellte weiter fest, dass der bilaterale Weg den Vorteil habe, dass die Schweiz Binnenmarktrecht sektorenbezogen übernehmen könne.",0,0,16/10_111.txt,741,877,16/10_111.txt
"SDA-MeldungDebatte im Nationalrat, 07.03.2018Parlament genehmigt Finanzierung für Schengen-Fonds",0,0,34/17_061.txt,1016,1113,34/17_061.txt
"Diese Gebäude sind ungenutzte Ressourcen, und viele der landwirtschaftlichen Bauten sind aktuell vom Einstürzen bedroht.",0,1,40/19_3392.txt,1258,1378,40/19_3392.txt
"In Beantwortung einer parlamentarischen Anfrage der SP-Fraktion vom 20. April 2010 erläuterte der Staatsrat des Kantons Tessin, dass mit Ausnahme von Lugano, Stabio und Bioggio sämtliche Gemeinden zur Finanzierung der Dienstleistungen für die Sammlung und Entsorgung der Siedlungsabfälle Verursacherabgaben erheben und dass die vom unterzeichnenden Staatsrat den Gemeinden gesetzte Frist für die Anpassung der Reglemente an das Verursacherprinzip am 1. Januar 2008 abgelaufen ist.",0,0,16/10_1076.txt,556,1038,16/10_1076.txt
"In Beantwortung einer parlamentarischen Anfrage der SP-Fraktion vom 20. April 2010 erläuterte der Staatsrat des Kantons Tessin, dass mit Ausnahme von Lugano, Stabio und Bioggio sämtliche Gemeinden zur Finanzierung der Dienstleistungen für die Sammlung und Entsorgung der Siedlungsabfälle Verursacherabgaben erheben und dass die vom unterzeichnenden Staatsrat den Gemeinden gesetzte Frist für die Anpassung der Reglemente an das Verursacherprinzip am 1. Januar 2008 abgelaufen ist.",0,0,16/10_1076.txt,556,1038,16/10_1076.txt
Sie unterstützt die Anstrengungen zum Erhalt der Medienvielfalt und für ein qualitätsvolles Informationsangebot.,0,0,52/22_417.txt,3304,3416,52/22_417.txt
"Eine Beihilfe zur Eingliederung, die der berechtigten Person erlaubt, ein Projekt auszuarbeiten und zu präsentieren, wie sie sich weiterbilden könnte, wie sie ein kleines Unternehmen gründen könnte u.a.",0,0,77/98_3192.txt,2549,2751,77/98_3192.txt
Die Anspruchberechtigung für Hornbeiträge soll an die Erfüllung des folgenden Tierwohlstandards geknüpft sein: Kriterien des Programms RAUS mit regelmässigem Auslauf im Freien im Winter und Weidgang bzw. Alpung im Sommer.,1,1,37/18_400.txt,903,1124,37/18_400.txt
Sie sind vielmehr Arbeitsmittel.,0,0,16/10_3164.txt,944,976,16/10_3164.txt
"Die Vertragspartner gewähren sich gegenseitig keine Amts- und Rechtshilfe, wenn die Gesuche auf ganz oder teilweise illegal beschafften Bankkundendaten aus dem anderen Vertragsstaat beruhen.3. Vertragspartner bringen einander in ihrem Land auftauchende illegal beschaffte Bankkundendaten umgehend, umfassend zur Kenntnis, und zwar durch Zustellung entsprechender Kopien.4.",0,0,16/10_3189.txt,284,656,16/10_3189.txt
"Kommissionssprecherin Esther Friedli (V, SG) und Kommissionssprecher Fabio Regazzi (M-E, TI) wiesen darauf hin, dass die Schweiz eines der weltweit strengsten Tierschutzgesetze hat.",0,0,48/21_044.txt,5121,5303,48/21_044.txt
"Es geht einerseits um das Übereinkommen der Unesco von 2001 zum Schutz des Unterwasser-Kulturerbes, das auf alle Gewässer anwendbar und seit 2009 in Kraft ist.",1,1,36/18_083.txt,665,824,36/18_083.txt
Für Forschungsarbeiten zu drängenden gesellschaftlichen Fragen enthalten naturwissenschaftliche Sammlungen essenzielle Informationen.,0,0,41/19_3593.txt,1018,1151,41/19_3593.txt
Ich bitte deswegen um die Beantwortung folgender Fragen:1.,0,0,24/13_1068.txt,546,604,24/13_1068.txt
"Ist er bereit, die Anforderungen an EVU konkreter zu formulieren?3.",0,0,16/10_3288.txt,774,841,16/10_3288.txt
"Der Bundesrat wird beauftragt folgende Fragen zu beantworten1. Werden pflanzliche Lebensmittel importiert, bei denen in Produktion, Lagerhaltung, Transport oder Verarbeitung Pestizide eingesetzt wurden, die in der Schweiz verboten oder nicht zugelassen sind?2.",0,0,49/21_4386.txt,0,260,49/21_4386.txt
"Programme wie dasjenige der Association Joker im Kanton Waadt, die für einkommensschwache Personen zu einem sehr niedrigen Preis Computer installiert und für einen Internetanschluss sorgt, könnten auch auf nationaler Ebene entwickelt werden.",0,0,16/10_3750.txt,2435,2676,16/10_3750.txt
"Verschiedene Unklarheiten im Gesetz, aber auch unnötig starke Einschränkungen führen dazu, dass die Forschung in diesem Bereich zunehmend ins Ausland verlagert wird.",0,0,16/10_3362.txt,812,977,16/10_3362.txt
Es braucht eine Lagebeurteilung durch den Bundesrat.,0,0,16/10_3042.txt,1204,1256,16/10_3042.txt
"Dabei sind es gerade die komplementärmedizinisch tätigen Human- und Tiermediziner, welche zurückhaltend Antibiotika verschreiben und über Alternativen zu Antibiotika verfügen.",0,0,31/15_5557.txt,172,347,31/15_5557.txt
"Der Bundesrat wird beauftragt, zu prüfen, wie die Getreidezüchtung für die biologische Landwirtschaft entsprechend der Förderung der Züchtung für die konventionelle Landwirtschaft finanziell unterstützt werden kann.",0,0,12/08_3584.txt,837,1052,12/08_3584.txt
"Besteht das Risiko eines Kollapses der Ökosysteme, falls das Insektensterben weiter voranschreitet?",1,1,49/21_4317.txt,2099,2198,49/21_4317.txt
"Ausserdem hat die Bundespräsidentin und damalige Vorsteherin des Volkswirtschaftsdepartements Doris Leuthard während der gesamten Abstimmungskampagne zur Avig-Revision versprochen, der Bundesrat werde Solidarität gegenüber den betroffenen Regionen beweisen.",0,0,16/10_3715.txt,591,848,16/10_3715.txt
Sie stehen der maschinellen Bewirtschaftung der Landwirtschaft im Weg und werden als störende Landschaftselemente eliminiert.,1,1,34/17_3687.txt,597,722,34/17_3687.txt
Bestehen tatsächlich Minderaufwendungen aufgrund des Dublin-Abkommens?,0,0,16/10_3557.txt,1235,1305,16/10_3557.txt
Weiter weist ein Bericht der ständigen Waldbeobachtung auf die schädlichen Auswirkungen von Stickstoffeinträgen (insbesondere Ammoniak) auf die Gesundheit der Wälder hin.,1,1,52/22_3627.txt,612,782,52/22_3627.txt
Für ein vergleichbares Verfahren werden in Deutschland 5200 bis 129 000 Euro und in Österreich etwa 50 000 Euro in Rechnung gestellt.,0,0,32/16_3573.txt,1176,1309,32/16_3573.txt
Der Rückgang um 1125 Gesuche wird vom BFM unter anderem auf die seit Mai 2009 anhaltende Unterbrechung der Migrationsroute über das zentrale Mittelmeer von Libyen nach Italien zurückgeführt.,0,0,16/10_3547.txt,2513,2703,16/10_3547.txt
Schliesslich fügte der Ständerat Ausnahmen bei der Erfassung und Lieferung von biometrischen Daten in die Vorlage ein.,0,0,44/20_025.txt,7445,7563,44/20_025.txt
"Gleichzeitig erreichen die älteren Stockwerkeigentumsbauten heute ein Alter, welches die Sanierung der Gebäudehüllen und der Gebäudetechnik bedingt.",0,0,25/13_3552.txt,391,539,25/13_3552.txt
Er erstellt einen entsprechenden Bericht.,0,0,16/10_3703.txt,482,523,16/10_3703.txt
"abisEr stellt sicher, dass der Bedarf der Bevölkerung vorwiegend durch eine qualitativ hochwertige, nachhaltige und diversifizierte einheimische Produktion gedeckt wird....",0,0,12/08_457.txt,523,695,12/08_457.txt
"Ziel der Vorlage ist es, negative Auswirkungen der Produktion von Treib- und Brennstoffen aus pflanzlichen Rohstoffen - zum Beispiel Zuckerrohr, Zuckerrüben, Mais, Raps oder Soja - möglichst zu vermeiden.",0,0,15/09_499.txt,6855,7059,15/09_499.txt
"Wenn nichts unternommen wird, werden die Auswirkungen auf die Fauna dramatische Ausmasse annehmen.- Ist sich der Bundesrat dieses Problems bewusst?-",1,1,20/11_5003.txt,49,197,20/11_5003.txt
"Wie gelangt er dazu, die offenbar seit Jahren bekannte Unterfinanzierung von Leistungen nachträglich einzig und allein den Rentenbeziehenden anzulasten?5.",0,0,16/10_3433.txt,939,1093,16/10_3433.txt
"Mit der zunehmenden Globalisierung der Probleme ist es wichtig, dass unsere Regierung in multilateralen Foren noch stärker präsent ist.",0,0,16/10_3108.txt,487,622,16/10_3108.txt
Nach offiziellen Zahlen verursachen staatliche Regulierungen in den Unternehmen der Schweizer Wirtschaft Kosten von rund 10 Milliarden Schweizerfranken jährlich.,0,0,29/15_3120.txt,1126,1287,29/15_3120.txt
Zu welchem Zeitpunkt wurde er durch den Kanton Schaffhausen über seine Studie informiert?,0,0,16/10_3406.txt,1172,1261,16/10_3406.txt
"Diese ökonomischen Studien deuten an, dass ein enormes wirtschaftliches Potenzial in der Entwicklung und Nutzung von OSS liegt.",0,0,27/14_3563.txt,479,606,27/14_3563.txt
"Mit der Schliessung der AP-Filiale macht die Monopolisierung auf dem Schweizer Zeitungsmarkt einen weiteren, grossen Schritt.",0,0,16/10_3042.txt,819,944,16/10_3042.txt
"Dies ist ein neues Phänomen, weil die einheimischen Muscheln nicht bis in die Tiefen der Fassungen vordringen.",1,1,46/20_4079.txt,865,975,46/20_4079.txt
"Technisch ist die Gewichtserhöhung ohne Sicherheitseinbussen problemlos realisierbar, und auch die zulässigen Achslasten müssen nicht überschritten werden.",0,0,16/10_3437.txt,1583,1738,16/10_3437.txt
"Technisch ist die Gewichtserhöhung ohne Sicherheitseinbussen problemlos realisierbar, und auch die zulässigen Achslasten müssen nicht überschritten werden.",0,0,16/10_3437.txt,1583,1738,16/10_3437.txt
"Der Bericht soll aufzeigen, wie sich eine Ausdehnung dieser Besteuerung auf alle einkommenssteuerpflichtigen Arbeitnehmerinnen und Arbeitnehmer sowie alle Rentnerinnen und Rentner auswirken würde.",0,0,16/10_3445.txt,505,701,16/10_3445.txt
"Dabei sollte festgehalten werden, wie viele dieser Anzeigen verwaltungsrechtliche und wie viele strafrechtliche Verfahren auslösen.3.",0,0,16/10_1010.txt,681,814,16/10_1010.txt
Diese Voraussetzungen müssen aber objektiv gerechtfertigt und verhältnismässig sein.,0,0,16/10_1058.txt,753,837,16/10_1058.txt
Die Vernichtung dieser hochwertigen Proteine ist zu beenden.,0,1,49/21_4073.txt,1096,1156,49/21_4073.txt
"Aus diesem Anlass und als Reaktion auf zwei Postulate hat der Bund einen Bericht verfasst, der im März 2010 veröffentlicht wurde.",0,0,16/10_3530.txt,327,456,16/10_3530.txt
"Die Auflistung der importierten Vorleistungen (lp 22.4522) zeigt, dass in vielen Bereichen (wie Gemüsesaat, -pflanzgut, Getreidesaatgut Mais und Roggen, Ackerbohnen, Küken) die Importe immens sind - teilweise 100 Prozent betragen und der bisherige netto SVG daher täuscht.",0,0,55/23_7102.txt,204,476,55/23_7102.txt
"Ich frage den Bundesrat:1. Besteht für die Schweiz ein Reputationsrisiko, wenn hier ansässige Firmen mit dubiosen Geschäftspartnern und Briefkastenfirmen in einem offensichtlichen Korruptionsumfeld aktiv sind?2.",0,0,22/12_3138.txt,1643,1854,22/12_3138.txt
"Grosse Teile der landwirtschaftlichen Nutzfläche sind von zweifelhaften Massnahmen zur sogenannten Bodenverbes serung betroffen, die einzig der Ertragssteigerung und der grossflächigen maschinellen Bewirtschaftung verpflichtet sind.",1,1,87/No_bill_id_7897.txt,197,429,87/No_bill_id_7897.txt
"Die Antibiotikaresistenz ist zu einem bedeutenden Problem für die öffentliche Gesundheit geworden, sowohl in der Humanmedizin als auch in der Veterinärmedizin.",0,0,22/12_3444.txt,688,847,22/12_3444.txt
Ich frage den Bundesrat an:,0,0,66/86_124.txt,480,507,66/86_124.txt
Besonders betroffen wird letztlich die für den Schweizer Wald zentrale Waldbewirtschaftung.,1,1,20/11_3968.txt,746,837,20/11_3968.txt
"Der Verwaltungskostenanteil von Pro Litteris betrug 2008 unglaubliche 24,3 Prozent des Gesamtvolumens aller Urheberrechtsvergütungen!",0,0,16/10_3612.txt,373,506,16/10_3612.txt
Die Ziele und Anforderungen des revidierten Protokolls stehen im Einklang mit dem schweizerischen Umweltrecht - insbesondere durch die Revision 2018 der Luftreinhalte-Verordnung - sowie mit dem Luftreinhaltekonzept von 2009 und der Agrarpolitik 2014-2017.,1,1,36/18_073.txt,4101,4356,36/18_073.txt
"den Gotthard-Strassentunnel um eine zweite Röhre (mit zwei Spuren, von denen eine - ebenso wie die dann frei werdende zweite Spur der ersten Röhre - ausschliesslich als Pannenstreifen oder als provisorische Fahrbahn im Fall von Bauarbeiten dienen soll)",0,0,16/10_301.txt,200,452,16/10_301.txt
Zur aktuellen Preiserhöhung der SBB stellen sich Fragen:1.,0,0,16/10_3784.txt,1303,1361,16/10_3784.txt
"In Artikel 141 Absatz 2 des Parlamentsgesetzes (SR 171.10) wird eine Nachhaltigkeitsdiskussion gefordert, soweit substanzielle Angaben möglich sind.",0,0,16/10_3072.txt,756,904,16/10_3072.txt
"Wichtige Aspekte sind: Erträge, Lebensmittelsicherheit, Qualität, Gesundheit und Hygiene (z. B. Reduktion von mikrobiologischen Verunreinigungen und Mykotoxinen), Energieverbrauch und weitere Umweltaspekte (z. B. Emissionen von Treibhausgasen).2.",0,0,35/17_4323.txt,1073,1319,35/17_4323.txt
"Der Weltbiodiversitätsrat (IPBES) zeigt in diversen Berichten auf, dass die Biodiversität und die Fähigkeit der Ökosysteme, Leistungen für den Menschen zu erbringen, in rasantem Tempo abnimmt.",1,1,52/22_3840.txt,1039,1231,52/22_3840.txt
Mit einer Ausdehnung des unter das Opferhilfegesetz fallenden Personenkreises und einer Anpassung der Verjährungsfrist für Schadenersatz und Genugtuung im OR kann diese Gesetzeslücke geschlossen werden.,0,0,9/06_473.txt,1752,1954,9/06_473.txt
Trotzdem werden die gesetzlichen Bestimmungen in zahlreichen Spitälern immer noch nicht eingehalten.,0,0,20/11_4125.txt,730,830,20/11_4125.txt
"Aus wettbewerbsrechtlichen Gründen ist es den hiesigen Netzbetreibern, die ja meist auch Stromerzeuger sind, nicht erlaubt, direkt ins europäische Stromnetz zu investieren.",0,0,16/10_3265.txt,1069,1241,16/10_3265.txt
60a (neu)Abs. 1Beim Wechsel des Versicherers überträgt der bisherige Versicherer die anteiligen Reserven und die durch den wechselnden Versicherten nicht beanspruchten anteiligen Rückstellungen auf den neuen Versicherer.,0,0,78/99_306.txt,217,437,78/99_306.txt
"Die schon erwähnten Unsicherheiten und die Tatsache, dass sich die Behörden der jeweiligen Staaten die Verantwortung zuschieben, drohen das Projekt zunichte zu machen.",0,0,16/10_3089.txt,3014,3181,16/10_3089.txt
"Das gibt stossende Unterschiede, die eigentlich nicht sein dürften.- Ist folgende Interpretation korrekt?",0,0,16/10_1116.txt,296,401,16/10_1116.txt
Anreize zur Förderung der beruflichen Aus- und Weiterbildung.,0,0,12/08_4024.txt,1981,2042,12/08_4024.txt
"Dass hier grosse Herausforderungen zu meistern sind, zeigen die Schwierigkeiten bei der Besetzung der milizpolitischen Ämter in vielen Gemeinden und bei diversen lokalen Parteisektionen.",0,0,32/16_3780.txt,282,468,32/16_3780.txt
"Der Transfer dieses Kostenblockes von rund 750 Millionen Franken von der Invalidenversicherung in die KV muss als entscheidender Schritt für die Sanierung der IV ausgestaltet werden, namentlich zum direkten Schuldenabbau im neuen IV-Fonds.",0,0,16/10_3204.txt,1544,1783,16/10_3204.txt
"Wäre es unter diesem Gesichtspunkt nicht angebracht, durch das BAG eine Information zu betreiben, in welcher erklärt wird, wie die Kostensteigerungen zustande kommen sowie deren direkten Einfluss auf die Berechnung der Prämien?",0,0,16/10_3184.txt,538,765,16/10_3184.txt
"Würde es vor diesem Hintergrund nicht Sinn machen, die Euro-6-Norm unter Einbeziehung von CO2-Zielwerten zu überarbeiten und eine Gesamtlösung anzustreben?4.",0,0,16/10_1089.txt,1454,1611,16/10_1089.txt
Deshalb soll der Umgang mit neuen Medien in den verschiedenen Bildungsinstituten gelehrt werden.,0,0,16/10_3256.txt,206,302,16/10_3256.txt
Dies hat die Lohnstrukturerhebung von 2008 gezeigt.,0,0,16/10_3151.txt,853,904,16/10_3151.txt
Der Zivildienst steht zur Diskussion.,0,0,16/10_3412.txt,229,266,16/10_3412.txt
"Parlament, Öffentlichkeit sowie Versicherungsträgern und der Aufsichtsbehörde stehen nun bessere Entscheidgrundlagen zur Verfügung.",0,0,16/10_3205.txt,912,1043,16/10_3205.txt
"Deshalb hat die Kommission entschieden, diese erst an ihrer Sitzung vom 3./4. April 2023 aufzunehmen und somit diverse Mitberichte von anderen Kommissionen abzuwarten.",0,0,51/22_058.txt,3564,3731,51/22_058.txt
"(Policy paper on forests, preservation of impact forest areas, p. 19).Die schweizerische Forstwirtschaft in Sekundärwäldern ist vorbildlich und verdient Nachahmung in Ländern, die heute in einer Situation sind, in der auch wir Schweizer uns vor bald hundert Jahren befunden haben.",1,1,76/97_3498.txt,1169,1449,76/97_3498.txt
Und generell muss der Unfug bedingter Strafen bei schwersten Verbrechen aufhören.,0,0,16/10_3131.txt,2095,2176,16/10_3131.txt
Seit Inkrafttreten des Behindertengleichstellungsgesetzes (BehiG) wird in unserer Rechtsordnung endlich der Anspruch von Menschen mit Behinderungen auf grösstmögliche Selbstständigkeit anerkannt.,0,0,16/10_1101.txt,0,195,16/10_1101.txt
