sentence,label_human,label_embed2discover,corpus_filename,start_pos,end_pos,file
Dazu tragen im naturwissenschaftlich-technischen Bereich die beiden ETH massgeblich bei.,0,0,12/08_3376.txt,85,173,12/08_3376.txt
Diese Idee scheint prüfenswert.,0,0,16/10_3544.txt,589,620,16/10_3544.txt
Die Langzeitwirkungen von organischen Mikroverunreinigungen und Nanopartikeln auf Gewässerökosysteme und Menschen sind eine grosse Herausforderung für den Gewässer- und Gesundheitsschutz.,1,1,14/09_3870.txt,0,187,14/09_3870.txt
Trotzdem ist die Entwicklung neuer Antibiotika zum Erliegen gekommen.,0,0,46/20_4529.txt,180,249,46/20_4529.txt
"Dieser Fonds bildet somit einen indirekten Gegenentwurf zur Lehrstelleninitiative des Schweizerischen Gewerkschaftsbundes, die einen von allen Betrieben getragenen Fonds zur Schaffung von Lehrstellen verlangt.",0,0,0/00_072.txt,8807,9016,0/00_072.txt
Schutz der Viehzucht im Berg­ gebiet.,1,1,18/10115.txt,7156,7193,18/10115.txt
Es soll eine proaktive Strategie für den Schutz und das integrierte Management der neuen Gletschervorfelder von einer gewissen nationalen Bedeutung erarbeitet,1,1,46/20_4662.txt,2382,2540,46/20_4662.txt
Der Gipfel des Chasseron und seine Umgebung bilden ein einzigartiges und vorderhand noch gut erhaltenes landschaftliches Ensemble der Jurakette.,0,1,38/18_4355.txt,566,710,38/18_4355.txt
"Nun ist die Bundesverwaltung bei Neustrukturierungen verpflichtet, den aktuellen Lohn der Kader für zwei Jahre zu garantieren, wenn die neuen Stellen einer tieferen Lohnklasse angehören als die alten.",0,0,16/10_1102.txt,243,443,16/10_1102.txt
Mehrere ehemalige JPO gehören heute zum Kader der Deza.,0,0,26/13_5574.txt,369,424,26/13_5574.txt
- In welchem Verhältnis stehen die Förderung des Bundes von Zucht und Absatz im Bereich tierische Produkte und jene im Bereich pflanzliche Produkte zueinander (absolute und relative Zahlen)?,0,0,50/21_7498.txt,172,362,50/21_7498.txt
"Gleichstellungsgesetz: Wenige Tage vor Behandlung des Gleichstellungsgesetzes durch den Nationalrat veröffentlichte das Eidgenössische Büro für die Gleichstellung von Frau und Mann über diverse Medien neue Auswertungen zur angeblichen Lohndiskriminierung zwischen Mann und Frau, deren statistische Basis nicht repräsentativ war.",0,0,37/18_3940.txt,871,1199,37/18_3940.txt
So gibt beispielsweise die wachsende Antibiotika-Resistenz Anlass zu Besorgnis.,0,0,46/20_4529.txt,100,179,46/20_4529.txt
"Kürzlich hat das Bundesamt für Statistik in Zusammenarbeit mit dem Bundesamt für Umwelt, Wald und Landschaft (BUWAL) den Umweltbericht 1997 veröffentlicht.",1,1,75/97_1167.txt,0,155,75/97_1167.txt
Die SBB lassen es hier klar an sozialer Verantwortung und an Verantwortung für die Umwelt fehlen.,0,0,16/10_1044.txt,1493,1590,16/10_1044.txt
"Zudem wird die Freiheit der Bürger, ob sie ihre persönlichen Ausweisdokumente mit einem biometrischen Chip ausrüsten lassen wollen oder nicht, völlig unnötig eingeschränkt.",0,0,15/09_440.txt,1258,1430,15/09_440.txt
Massnahmen zur Unterstützung der Wasserkraft.,0,1,31/16_035.txt,27131,27176,31/16_035.txt
"Hält nun ein Schweizer Bürger US-Wertschriften, so fällt bei dessen Tod eine US-Erbschaftssteuer bis zu einem Satz von 45 Prozent an.",0,0,16/10_3647.txt,890,1023,16/10_3647.txt
Sprecher: Carobbio,0,0,65/83_439.txt,1685,1703,65/83_439.txt
"Der Bundesrat wird beauftragt, bauliche Massnahmen zur Einhaltung des Immissionsgrenzwertes infolge Fluglärm während der ersten Nachtstunde (22 bis 23 Uhr) in der Lärmschutzgesetzgebung dahingehend zu erweitern, dass in zeitlich wenig belasteten Gebieten eine raumplanerisch sinnvolle bauliche Entwicklung rund um die Landesflughäfen ermöglicht wird.",0,0,16/10_3720.txt,1715,2065,16/10_3720.txt
"Dies ist zum Beispiel schon dann der Fall, wenn ein einfaches Wohnhaus oder ein kleines, vom Eigentümer be pflanztes Grundstück vorhanden ist.",0,0,70/91_3248.txt,286,428,70/91_3248.txt
Die Kantone werden heute nur zum Teil vom Bund entschädigt.,0,0,16/10_3066.txt,1018,1077,16/10_3066.txt
"Ist er weiter bereit, eventuell einen Aktionsplan umzusetzen, mit dem Ziel, die Umweltbelastung durch Biozide langfristig zu reduzieren, analog dem Aktionsplan Pflanzenschutzmittel?",1,1,37/18_3827.txt,725,906,37/18_3827.txt
Zudem darf die volkswirtschaftliche Bedeutung der Freiwilligenarbeit nicht unterschätzt werden.,0,0,16/10_3231.txt,442,537,16/10_3231.txt
"Der Bundespräsident soll ein Koordinations- und Weisungsrecht in Verfahrensfragen gegenüber seinen Kollegen erhalten, das er jedoch nur zur Umsetzung einer strategischen Regierungspolitik wahrnimmt.",0,0,16/10_3109.txt,232,430,16/10_3109.txt
"Bei der Revision solle sich die Schweiz am Bundesgerichtsentscheid vom 4. November 2009 (BGE 136 II 1) orientieren, der besagt, dass eheliche Gewalt oder die stark gefährdete soziale Wiedereingliederung im Herkunftsland allein als wichtige persönliche Gründe gelten.",0,0,16/10_3515.txt,1032,1298,16/10_3515.txt
Schliesslich gehört zur souveränen Einflussnahme ein aktives Kommunikationsmanagement.,0,0,16/10_111.txt,8065,8151,16/10_111.txt
"Es scheint so, als ob der Bundesrat vor der Medienbranche bereits kapituliert hat.",0,0,16/10_3761.txt,358,440,16/10_3761.txt
"Wenn nicht, was gedenkt der Bundesrat zu unternehmen, um in Zukunft besser informiert zu sein?5. Plant der Bundesrat, den Zubringer zur Autobahn Ballaigues-Orbe auf vier Spuren auszubauen, sobald in Frankreich die vierspurige Autobahn zwischen Pontarlier und Vallorbe in Betrieb genommen worden ist?",0,0,16/10_3272.txt,1291,1590,16/10_3272.txt
sollten.1. Hat das Abkommen zwischen der Schweiz und der EU über den freien Personenverkehr bei diesem Bundesgerichtsentscheid eine Rolle gespielt?2.,0,0,16/10_3247.txt,730,879,16/10_3247.txt
Für eine pflanzliche Ernährung wird eine fünfmal kleinere Ackerfläche benötigt als für die aktuelle Durchschnittsernährung.,0,0,31/15_493.txt,840,963,31/15_493.txt
Etwa die Hälfte der vom Bund reklamierten CO2-Reduktionen dürfte sich im exklusiven Besitz der Stiftung Klimarappen befinden und wird zur Erfüllung ihres Vertrags mit dem Bund angerechnet.,0,0,16/10_3645.txt,428,616,16/10_3645.txt
Wie wird die Bevölkerung informiert?,0,0,88/No_bill_id_8691.txt,895,931,88/No_bill_id_8691.txt
"NHG erfüllen und ihrer Erhaltung, Förderung und Pflege als Lebensräume mehr Aufmerksamkeit geschenkt werden muss?",1,1,6/05_1107.txt,2307,2420,6/05_1107.txt
"Das Parlament muss deshalb mithelfen, die Sache voranzutreiben, und Gesetzesänderungen beschliessen, die es der Schweiz ermöglichen, das Rahmenübereinkommen der WHO möglichst bald zu ratifizieren.",0,0,9/06_420.txt,3607,3803,9/06_420.txt
"Nachdem er eine offizielle Garantie der türkischen Justizbehörde erhalten hatte, dass keine Anklage mehr gegen ihn vorliegt, ist er im Juli 2009 für ein paar Wochen in die Türkei zurückgekehrt, um seine alte, kranke Mutter zu besuchen.",0,0,16/10_3252.txt,483,718,16/10_3252.txt
"Sie stellt eine unverzichtbare Kraft dar, ist ein spürbares Zeichen für den nationalen Zusammenhalt und wird von vielen ausländischen, insbesondere italienischen Touristinnen und Touristen sehr geschätzt.",0,0,16/10_1131.txt,577,781,16/10_1131.txt
amüssen zur Stärkung der Meinungs- und Angebotsvielfalt beitragen;,0,0,33/16_410.txt,268,334,33/16_410.txt
"Bei allem Bekenntnis für die übergreifende Verantwortung zur Erhaltung unseres Ökosystems Alpen drängt sich im Interesse der Sache und der Bergbevölkerung gebieterisch auf, dass rechtzeitig Gegensteuer gegeben wird.",1,1,73/94_3368.txt,1105,1320,73/94_3368.txt
Die SRG SSR ist heute gemäss,0,0,16/10_3539.txt,284,312,16/10_3539.txt
Es handle sich um ein wichtiges Lärmschutzprojekt.,0,0,36/18_066.txt,3934,3984,36/18_066.txt
"Die Umsetzung des Projekts in Lodygowice erscheint noch angezeigter, wenn man bedenkt, dass es sowohl auf schweizerischer wie auf polnischer Seite schon weit fortgeschritten ist.",0,0,16/10_3089.txt,2506,2684,16/10_3089.txt
Das umweltschonende und wirtschaftliche Potenzial ist daher beachtenswert.,1,1,46/20_473.txt,2138,2212,46/20_473.txt
Gemäss dem von OdA Santé 2009 veröffentlichten nationalen Bericht zum Personalbedarf in den Gesundheitsberufen zeigt die heutige Datenbasis der Personalstatistiken Lücken und Mängel.,0,0,16/10_3603.txt,594,776,16/10_3603.txt
4. Ist dieser Umstand mit unserem Landesrecht vereinbar?,0,0,16/10_3052.txt,705,761,16/10_3052.txt
"Es gibt doch in der Schweiz Privatunternehmen, welche über die notwendige Einrichtung und Technologie verfügen, um mit der Entwicklung Schritt zu halten, und bei denen es gewissermassen zu ihrem Wesen gehört, diese Art von Leistung zu erbringen, um fortbestehen zu können.- Würde es der Bundesrat daher nicht vorziehen, wenn der Bund die technologische Aufdatierung des biometrischen Passes, die Herstellung und die damit verbundenen technischen Produktionsanpassungen unter seiner strengen Aufsicht der Schweizer Industrie übergäbe?",0,0,6/04_3442.txt,1980,2513,6/04_3442.txt
"Der Bundesrat wird beauftragt, einen Bericht zu erstellen, der die Wirksamkeit, Effizienz und Relevanz der verschiedenen für die Landwirtschaft geltenden Vorschriften (z. B. in den Bereichen Tier- und Umweltschutz, Natur- und Heimatschutz, Raumplanung) überprüft.",1,1,16/10_3156.txt,0,263,16/10_3156.txt
"Der Bundesrat wird beauftragt, eine unabhängige Expertengruppe einzuberufen, welche folgende Fragen beantworten soll:",0,0,16/10_3398.txt,0,117,16/10_3398.txt
"Vermehrt werden wichtige Dokumente des Bundes nur noch in Englisch verfasst, mit Zusammenfassungen in den Landessprachen, so beispielsweise der Swiss Antibiotika Resistance Report.",0,0,48/20_6075.txt,0,180,48/20_6075.txt
"Die Resultate des vierten, am 10. Juni 2020 publizierten Landesforstinventars (LFI 4) belegen indessen, dass der Anteil nicht bewirtschafteter Wälder zunimmt und der Wald die vom Staat und von der Gesellschaft erwarteten Leistungen immer weniger erbringen kann.",1,1,45/20_3745.txt,1802,2063,45/20_3745.txt
"Ausgewiesen wird dieser Fehlbetrag in der Statistik für den ausserordentlichen Haushalt, dem sogenannten Amortisationskonto.",0,0,51/22_020.txt,9619,9743,51/22_020.txt
"Ebenso bedenklich ist aber die Tatsache, dass sich Leute hinter diesem Persönlichkeitsschutz verstecken und die Allgemeinheit um ihre Zahlung prellen können.",0,0,25/13_3482.txt,1377,1534,25/13_3482.txt
"Erachtet der Bundesrat es als ausreichend haltbar gemacht, wenn rohes Fleisch bloss mit Gewürzen versehen ist?4.",0,0,16/10_3816.txt,1499,1611,16/10_3816.txt
"Viele Unternehmen versenden aus Effizienzgründen und um den Bedürfnissen der Geschäftspartner zu entsprechen, ihre Rechnungen elektronisch - oft ohne digitale Signatur.",0,0,30/15_4209.txt,0,168,30/15_4209.txt
die Verwendung einer qualifizierten elektronischen Signatur verzichtet wird und auch Online-Bestellungen sowie weitere formfrei mögliche Vertragsabschlüsse dem Verfahren unterstellt werden.,0,0,40/19_3448.txt,1606,1795,40/19_3448.txt
"3. Bereitstellen angemessener finanzieller Mittel für For schungsprojekte im Bereich ökologischer und biologischer Landbaumethoden an Hochschulen, Forschungsanstalten sowie im Rahmen der Forschungstätigkeit anerkannter pri vater Organisationen.",0,0,87/No_bill_id_8083.txt,531,775,87/No_bill_id_8083.txt
Der Verkauf von Antibiotika muss zurückgehen.2.,0,0,41/19_3860.txt,1452,1499,41/19_3860.txt
Gemäss dem Bericht vom November 2009 über die Verkehrsverlagerung kann mit den bisher in Kraft getretenen Massnahmen weder das Zwischenziel (höchstens eine Million alpenquerende Fahrten im Jahr 2011) noch das Endziel (spätestens zwei Jahre nach Inbetriebnahme des Eisenbahn-Basistunnels am Gotthard höchstens 650 000 Fahrten pro Jahr) erreicht werden.,0,0,16/10_3010.txt,439,790,16/10_3010.txt
"Der Bundesrat wird beauftragt, ein nationales Kompetenzzentrum zur Erforschung neuer Antibiotika als Abwehrmassnahme gegen drohende Antibiotikaresistenz zu schaffen.",0,0,41/19_3858.txt,0,165,41/19_3858.txt
"Der Bundesrat wird beauftragt, Massnahmen zur Integration angemessener Kenntnisse über komplementärmedizinische Verfahren in die Ausbildung von Ärzten, Chiropraktikern, Zahnärzten und Apothekern zu unterbreiten.",0,0,16/10_3009.txt,0,211,16/10_3009.txt
Wie bei der Sonnenenergie hätte die Nutzung der Holzenergie der Wälder keine oder nur geringe Auswirkungen auf das Bau- und Agrarland und würde das Landschaftsbild nicht verändern.,1,1,51/22_302.txt,3282,3462,51/22_302.txt
"Ersparnis bei der Verwaltung:Die Kumulation der Zuständigkeiten, insbesondere zwischen den kantonalen Umweltämtern und dem Bundesamt für Umwelt, Wald und Landschaft (Buwal), ist unnötig.",0,1,0/00_3273.txt,911,1097,0/00_3273.txt
"Alle Rednerinnen und Redner lobten die Qualität des Schweizer Bildungswesens und betonten, wie wichtig es sei, dessen Finanzierung sicherzustellen.",0,0,16/10_109.txt,447,594,16/10_109.txt
"Währenddem die Anzahl Organspenden in der Schweiz in den letzten zehn Jahren rückläufig ist, ist die Zahl der gespendeten Organe in Österreich im internationalen Vergleich hoch.",0,0,16/10_3701.txt,436,613,16/10_3701.txt
"Aufgrund diverser Erkenntnisse, unter anderem in der NCD-Strategie und in der Strategie Muskuloskelettale Erkrankungen der Rheumaliga Schweiz, aus welcher in diesem Vorstoss zitiert wird, bitte ich den Bundesrat folgende Fragen zu beantworten:1.",0,0,45/20_3058.txt,1450,1697,45/20_3058.txt
"in den Gebieten mit Emissionskontrolle (Emission Control Areas, ECA) ist der Schwefelgehalt seit 2015 auf 0,1 Prozent begrenzt.",0,1,35/17_4236.txt,573,700,35/17_4236.txt
"Die EU hat im Rahmen der dritten Führerscheinrichtlinie die Möglichkeit geschaffen, die Gültigkeitsdauer der Führerausweise zu beschränken.",0,0,16/10_3371.txt,2651,2790,16/10_3371.txt
180 der Bundesverfassung),0,0,16/10_3100.txt,45,70,16/10_3100.txt
Eine gentechnikfreie Produktion setzt gentechnikfreies Saatgut voraus.,0,0,17/10_4152.txt,1795,1865,17/10_4152.txt
"Der Bundesrat wird eingeladen, gesetzliche Vorschriften für die Einrichtung von Kontrollinstanzen durch die Kantone zur Bekämpfung von Schwarzarbeit und illegaler Beschäftigung zu erlassen.",0,0,76/97_3476.txt,0,189,76/97_3476.txt
"Was es braucht, ist ein kluges Management des sensiblen Lebensraumes Alpen, keine romantisierende Verklärung von einzelnen Tierarten.",1,1,16/10_3098.txt,1244,1377,16/10_3098.txt
"Davon betroffen sind beispielsweise Personen mit einem BMI über 30 und Personen, die sich - auch nur vorübergehend - einer psychologischen Behandlung unterzogen haben.",0,0,34/17_3718.txt,315,482,34/17_3718.txt
"Die Befürworter der ständerätlichen Version aus den Reihen der Grünen und der SVP machten geltend, es gehe darum, dem gemeinsamen Sorgerecht in der Praxis zum Durchbruch zu verhelfen.",0,0,24/13_101.txt,8312,8495,24/13_101.txt
Eine der wirksamsten Massnahmen gegen den Wolf ist und bleibt die physische Präsenz des Menschen.,1,1,49/21_4371.txt,1060,1157,49/21_4371.txt
Lebenslange Virusträger sollten erkannt und aus dem Tierbestand entfernt werden.,1,1,3/02_3518.txt,2292,2372,3/02_3518.txt
"Wir exportieren heute Güter im Wert von 1,4 Milliarden Franken.",0,0,16/10_3609.txt,156,219,16/10_3609.txt
"Wir exportieren heute Güter im Wert von 1,4 Milliarden Franken.",0,0,16/10_3609.txt,156,219,16/10_3609.txt
"Die Vertragsstaaten des Übereinkommens werden auf nationaler Ebene und durch internationale Zusammenarbeit zu Massnahmen angehalten, günstige Rahmenbedingungen für die Praxis und Überlieferung des immateriellen Kulturerbes zu schaffen.",0,1,10/07_076.txt,2720,2955,10/07_076.txt
"Dies ermöglicht diskriminierungsfreie Wettbewerbsbedingungen für alle Marktteilnehmer, fördert den Wettbewerb, steigert die Angebotsvielfalt und ergibt Mehrwert für alle Benutzer.",0,0,14/09_3333.txt,1707,1886,14/09_3333.txt
"Privatpersonen sind die Einzigen, denen es möglich ist, TV zu schauen oder Radio zu hören.",0,0,16/10_3164.txt,182,272,16/10_3164.txt
"Privatpersonen sind die Einzigen, denen es möglich ist, TV zu schauen oder Radio zu hören.",0,0,16/10_3164.txt,182,272,16/10_3164.txt
Deren Meinung muss somit in jedem Fall bei der Beurteilung der Zumutbarkeit einer Wegweisung mit einbezogen werden.,0,0,16/10_3321.txt,1023,1138,16/10_3321.txt
Deren Meinung muss somit in jedem Fall bei der Beurteilung der Zumutbarkeit einer Wegweisung mit einbezogen werden.,0,0,16/10_3321.txt,1023,1138,16/10_3321.txt
"Somit stellt sich dabei auch die Frage, ob die Eltern oder gesetzlichen Vertreter der Jugendlichen ab 14 bis 18 Jahren überhaupt willens und in der Lage wären, für das motorisierte Tun ihrer Sprösslinge die vollumfängliche Verantwortung in jeder Hinsicht zu übernehmen.",0,0,3/02_3115.txt,4296,4565,3/02_3115.txt
"Ist er bereit, sich dafür einzusetzen, dass auch die Kantone als Träger der FH ihre Verantwortung für die finanzielle Unterstützung der Forschung an den FH verstärkt wahrnehmen?4.",0,0,16/10_3726.txt,1142,1321,16/10_3726.txt
"Weil die Kommunikationspolitik mit der Regierungsstrategie in engem Zusammenhang steht, wäre zudem zu prüfen, ob die Kommunikation voll dem Bundespräsidenten unterstehen soll.",0,0,16/10_3109.txt,1220,1395,16/10_3109.txt
"Ist der Bundesrat bereit, die problematischen Anreize und Subventionen für diese Branche angemessen zu analysieren und zu beurteilen?5. Welche biodiversitätsschädigenden Subventionen und Anreize für den Tourismus können relativ rasch reduziert oder vermieden oder so verändert werden, dass sie positive Auswirkungen haben, zum Beispiel, indem Programme oder Verordnungen angepasst werden?6. Welche Subventionen und Anreize erfordern",1,0,46/20_4471.txt,1580,2012,46/20_4471.txt
Diese Begründungen sind - wie Studien des Bafu belegen - nur ein Teil der Wahrheit.,0,0,16/10_3188.txt,528,611,16/10_3188.txt
"Um eine flächendeckende Information zu erreichen, sind diverse Migrantenorganisationen oder -medien trotz bescheidenen Mitteln in die Verbreitungslücke gesprungen.",0,0,45/20_3580.txt,716,879,45/20_3580.txt
"Der Bundesrat wird aufgefordert, den Präsidenten des Finma-Verwaltungsrates regelmässig zu einer Aussprache einzuladen.",0,0,16/10_3630.txt,226,345,16/10_3630.txt
"Der Bundesrat wird eingeladen, gestützt auf Artikel 24octles der Bundesverfassung zwei Gesetzesentwürfe vorzulegen: Gesetz über Fortpflanzungsmedizin Gesetz über Gentechnologie.",0,0,71/92_3372.txt,101,278,71/92_3372.txt
"Moore haben wichtige ökologische Funktionen, und die Auswirkungen ihrer Zerstörung auf die Umwelt sind gross.",1,1,25/13_3150.txt,1129,1238,25/13_3150.txt
"Die Einfuhr von Obst aus dem Ausland wird dazu führen, dass Früchte in den Regalen unserer Verkaufsstellen angeboten werden, die aus Betrieben stammen, in denen sie mit Antibiotika behandelt wurden.",0,0,10/07_3511.txt,672,870,10/07_3511.txt
"In einigen Institutionen und Kantonen mangelt es an Ausbildungsmöglichkeiten, in anderen ist die Nachfrage nach Bildungsplätzen für den Bildungsgang Pflege HF zu gering, um den Bedarf zu decken.",0,0,16/10_3503.txt,551,745,16/10_3503.txt
"Wie sieht die Situation für das WEF aus, das im Januar 2011 in Davos stattfindet?",0,0,16/10_1092.txt,152,233,16/10_1092.txt
Zwischen 2006 und 2008 hat die Schweiz viermal eine härtere Position gegenüber Israel eingenommen als die meisten Staaten der EU (siehe Interpellation 08.3086).,0,0,16/10_3424.txt,1078,1238,16/10_3424.txt
"Bei gegebenem Zusammenhang, welche Ationen plant der Bund, um den Durchschnittskonsum von Alkohol in der Schweizer Bevölkerung zu senken?",0,0,73/94_3389.txt,4586,4723,73/94_3389.txt
Der Bericht soll den aktuellen Stand der personellen Mittel an Verbindungspersonen aufzeigen sowie deren Arbeitsweise und die Einbindung in die politische Entscheidfindung erläutern.,0,0,16/10_3112.txt,153,335,16/10_3112.txt
"Die herrschende Tendenz, mehr Wald unter Schutz zu stellen, schadet der Wirtschaft und unterstützt die Erreichung klimapolitischer Ziele nicht.",1,1,16/10_3124.txt,2158,2301,16/10_3124.txt
"Der Bundesrat stimmt dem Ziel der Volksinitiative grundsätzlich zu, insoweit sie die Eindämmung der Gesundheitskosten anvisiert.",0,0,78/99_072.txt,2064,2192,78/99_072.txt
"Der Grundbedarf der Frauen ist höher - nicht weil sie dies so wollen, sondern weil dies der (Un-)Logik des Marktes entspricht.",0,0,55/23_3429.txt,2062,2188,55/23_3429.txt
über die weitere Zusammenarbeit der Schweiz mit der Bundesrepublik Deutschland bei der Hochtemperaturreaktor-Entwicklung.,0,0,66/85_054.txt,152,273,66/85_054.txt
Diese Verfassungswidrigkeit muss im Rahmen der nächsten Legislaturplanung korrigiert werden.,0,0,16/10_3075.txt,987,1079,16/10_3075.txt
"Der Bundesrat wird aufgefordert, ohne Verzug eine Revision von Artikel 24SCIICS Absatz 5 der Bundesverfassung an die Hand zu nehmen.",0,0,72/93_3004.txt,149,281,72/93_3004.txt
"Im Lichte der momentan angespannten Situation auf dem Nahrungsmittelmarkt ist der Bundesratsentscheid zur Umsetzung der Parlamentarischen Initiative 19.475 und damit dem Entzug und die Einschränkungen auftausenden Hektaren von bestem Kulturland zur Förderung der Biodiversität im Ackerbau, zu korrigieren.",1,1,52/22_3610.txt,996,1301,52/22_3610.txt
"Zur Verbesserung der strategischen Regierungspolitik ist einerseits eine Entlastung des Bundesrates notwendig, andererseits soll der Bundespräsident aber auch zusätzliche Kompetenzen erhalten.",0,0,16/10_3109.txt,666,858,16/10_3109.txt
"Buchstabe a den departementsübergreifenden Interessen genügend Rechnung tragen;c. aufzuzeigen, welche Informatik, gestützt auf die Ausnahmeregelung gemäss Artikel 2 Absatz 3 BinfV, in der Bundesverwaltung parallel betrieben wird.",0,0,16/10_3640.txt,1878,2107,16/10_3640.txt
"Angesichts der Tatsache, dass die WHO bei ihrer Definition von Pandemie die Anzahl der Infektionen und der Todesfälle nicht mehr berücksichtigt, muss die Schweiz diese Faktoren beachten, damit sie ihre Vorgehensweise entsprechend anpassen kann.",0,0,16/10_3519.txt,3088,3332,16/10_3519.txt
Einfluss auf die politische Informationsverbreitung und -vielfalt an sich?3. Erachtet,0,0,4/03_3527.txt,501,586,4/03_3527.txt
2. Sind bereits komplette Stabsübungen durchgeführt worden?,0,0,11/08_3151.txt,1330,1389,11/08_3151.txt
"4. Ist es möglich, auf legalem Weg zuverlässig solche zu erhalten?5. Sind Pässe mit biometrischen Daten in Afghanistan",0,0,54/23_3121.txt,465,583,54/23_3121.txt
Die Statistiken sollen auf der Grundlage von Daten des Bundesamts für Statistik (BFS) erstellt worden sein.,0,0,16/10_1122.txt,351,458,16/10_1122.txt
"Das Bundesgericht hat in einem jüngeren Entscheid (Urteil 2C_560/2010 vom 18. Juni 2011) die Ansicht vertreten, die Missachtung der Tierschutzvorschriften könne nicht die Verweigerung sämtlicher Beiträge rechtfertigen, sondern nur derjenigen, bei denen ein direkter Zusammenhang zu den verletzten Bestimmungen bestehe.",0,0,20/11_470.txt,562,880,20/11_470.txt
"Während der gesetzlich bestimmten Vertragsdauer, die mindestens ein Jahr betragen sollte, sollen die Grundverträge nicht abgeändert werden",0,0,16/10_3813.txt,2114,2252,16/10_3813.txt
"Die Verhandlungen zur Erneuerung der Konzession sind bereits seit 1995 in Gang, sie wurden 2005 - also viel zu spät - wiederaufgenommen.",0,0,16/10_1044.txt,201,337,16/10_1044.txt
"Darin soll aufgezeigt werden, wie Strassenausbauten von Bund und Kantonen durch den Rückbau und die Entsiegelung bestehender Verkehrsflächen kompensiert werden können.",0,0,16/10_3529.txt,115,282,16/10_3529.txt
"Es ist alles in Bewegung zu setzen, um die Pressevielfalt zu erhalten.",0,0,25/13_3321.txt,2035,2105,25/13_3321.txt
"Weiter teilt das BFE mit, dass nur durch eine Anpassung der gesetzlichen Grundlagen das wirtschaftliche Potenzial des erneuerbaren Stroms weiter ausgeschöpft werden kann.",0,0,13/09_3190.txt,289,459,13/09_3190.txt
Nun liegen die beiden Programme vor.,0,0,16/10_3761.txt,1122,1158,16/10_3761.txt
"Künftig solle das Gelände offenbar noch mit Bäumen und Sträuchern bepflanzt werden, was jede Übersicht vollends verunmögliche.",0,0,78/99_1190.txt,967,1093,78/99_1190.txt
"Ist das nicht der Beweis dafür, dass die TTIP zu einer Absenkung eines Teils oder sogar aller vom Abkommen betroffenen europäischen Standards führen wird?",0,0,32/16_3449.txt,887,1041,32/16_3449.txt
"Demzufolge ist es notwendig, die Anforderungen so auszugestalten, dass die Sprachen gleich behandelt werden und Gerechtigkeit zwischen den Sprachregionen geschaffen werden kann.",0,0,16/10_3646.txt,729,906,16/10_3646.txt
Was bedeutet dies für den beanspruchten Schutz von Testdaten?3. Westliche Multis (und das Seco) beziehen sich auf Artikel 39.3 des Trips-Abkommens zum Schutz von Testdaten gegen unfair commercial use.,0,0,20/11_4079.txt,1199,1401,20/11_4079.txt
"Wertet der Bundesrat dies als vertretbar?3. In Zeiten, wo die Gebühreneinnahmen der SRG begrenzt wurden und die Werbeeinnahmen sinken, steigen die Kosten für die SRG bei den Sportrechten massiv.",0,0,41/19_4170.txt,1551,1745,41/19_4170.txt
Pflanzen und Tiere sollen dabei nach wie vor vom Patentschutz ausgeschlossen,1,1,77/98_3007.txt,1299,1375,77/98_3007.txt
Heute gilt eine Kindersitzpflicht für Kinder unter sieben Jahren.,0,0,16/10_3159.txt,281,346,16/10_3159.txt
Auf der Tertiärstufe (Pflegefachfrau/Pflegefachmann HF-FH) herrscht dasselbe Problem;,0,0,16/10_3513.txt,847,932,16/10_3513.txt
"Mit jedem Tag, an denen diese Gebiete keinem spezifischen Schutz unterstellt sind, geht ein grosses Potenzial an Natur und Landschaft verloren.",1,1,5/04_3026.txt,207,350,5/04_3026.txt
Hält der Bundesrat angesichts des beunruhigenden Biodiversitätsrückgangs in unserem Land eine solch grossflächige Abholzung für angebracht?7.,1,1,52/22_3951.txt,1806,1947,52/22_3951.txt
