bill,classification,submission_date,bill_title,bill_text,"Notes (added = title, text, date added)",Notes
18.4228,1,2018-12-13,Zugang zu Verhütung für alle garantieren,"Der Bundesrat wird beauftragt, einen Bericht vorzulegen, der aufzeigt, wie der Zugang zu Verhütung in der Schweiz für alle garantiert werden kann. Der Bericht soll bestehende Hürden identifizieren und konkrete Möglichkeiten und Massnahmen aufzeigen, wie diese Hürden mit Fokus auf vulnerable Gruppen beseitigt werden können. Besonders zu berücksichtigen sind von Armut betroffene und von der Sozialhilfe abhängige Personen, Jugendliche, Gruppen von Migrantinnen und Migranten wie Flüchtlinge und Menschen mit Behinderungen. //// Zugang zu Verhütung ist Bestandteil der reproduktiven Rechte. Verhütung ist sowohl für die persönliche Selbstbestimmung und Lebensgestaltung als auch für die öffentliche Gesundheit von Bedeutung, denn sie leistet einen wichtigen Beitrag zur Prävention ungewollter Schwangerschaften, von HIV/Aids und zur Förderung der sexuellen Gesundheit. Voraussetzung ist ein niederschwelliger Zugang, der sowohl Information und Beratung wie auch die Verfügbarkeit von Verhütungsmitteln umfasst, welche für die jeweilige Person akzeptabel und bezahlbar sind. Der Zugang zu Verhütung ist nicht für alle Bevölkerungsgruppen sichergestellt, weshalb die Schweiz in europäischen Rankings wie dem Contraception Atlas nur mittelmässige Noten erhält. Während die Verhütung in der Schweiz als Privatsache gilt, wird sie in Ländern wie Deutschland, Frankreich und Belgien für Jugendliche und Menschen in schwierigen finanziellen Verhältnissen vergütet. Für Jugendliche leisten sie damit einen bedeutenden Präventionsbeitrag in einer wichtigen Übergangsphase zum Erwachsenenleben.
Hindernisse im Zugang zu Verhütung bestehen in der Schweiz auch für bestimmte Gruppen von Migrantinnen und Migranten, insbesondere für Flüchtlinge. Dies zeigt beispielsweise die Situationsanalyse ""Sexuelle und reproduktive Gesundheitsversorgung von Frauen und ihren Säuglingen in Asylunterkünften"" der Berner Fachhochschule. Die Studie, die vom BAG unterstützt wurde, stellt fest, dass der Zugang zu sicheren Verhütungsmitteln für asylsuchende Frauen erschwert ist. Gratis abgegeben werden Kondome, deren Anwendung jedoch vom Mann abhängt. Frauenspezifische Verhütung ist dagegen kostenpflichtig.",new,NA
23.7051,NA,2023-03-01,Stille Revolution in der Armeeseelsorge,"<p>Indem die Armee diskret, um nicht zu sagen heimlich, besondere Funktionsabzeichen für muslimische und jüdische Seelsorgerinnen und Seelsorger einführt, gibt sie den Grundsatz auf, dass die Seelsorge, auf die alle Angehörigen der Armee unabhängig von ihrem Glauben Anspruch haben, durch christliche Seelsorgerinnen und Seelsorger erfolgt.</p><p>- Verankert die Armee damit nicht eine Form der offiziellen Anerkennung der betreffenden Religionen, die dem Föderalismus zuwiderläuft?</p><p>- Fördert sie damit nicht die Ausbreitung des Islam in der Schweiz?</p>",NA,NA
23.3437,1/4,2023-03-21,"Unterstützungsprogramm für die Ukraine. Rechtsgrundlage und 5 Milliarden Franken für humanitäre Hilfe, den Schutz der Zivilbevölkerung, die Friedensförderung und den Wiederaufbau","<p>Der Bundesrat wird beauftragt, dem Parlament ein Unterstützungsprogramm für die Ukraine zu unterbreiten, das folgende Elemente enthält:</p><p>1. Rechtsgrundlage für die Unterstützung der Ukraine. Darin sind die Rahmenbedingungen des Unterstützungsprogramms festzulegen;</p><p>2. Unterstützungsprogramm im Umfang von mindestens fünf Milliarden Franken für die nächsten fünf bis zehn Jahre;</p><p>3. Verpflichtung, dass die Mittel in der Ukraine namentlich für humanitäre Hilfe, den Schutz der Zivilbevölkerung, die Friedensförderung und den Wiederaufbau der Infrastruktur eingesetzt werden.</p><p></p><p>Eine Minderheit der Kommission (Portmann, Aebi Andreas, Büchel Roland, Estermann, Gössi, Grüter, Nidegger, Schneider-Schneiter, Tuena, Wasserfallen Christian, Wehrli) beantragt, die Motion abzulehnen.</p><p>Russlands brutaler und völkerrechtswidriger Angriffskrieg dauert an. Die Ukraine ist auf Unterstützung in erheblichem Umfang angewiesen, etwa für humanitäre Hilfe, den Schutz der Zivilbevölkerung, die Minenräumung, die Friedensförderung oder die Stärkung der zivilen Infrastruktur. Es ist bereits heute absehbar, dass die Ukraine riesige Beträge allein für die humanitäre Hilfe und den Wiederaufbau der Infrastruktur benötigen wird.</p><p>Die Schweiz leistet heute, auch unter Einbezug des neusten Hilfspakets des Bundesrates, weniger Hilfe an die Ukraine als andere vergleichbare Staaten. Norwegen hat der Ukraine beispielsweise ein Hilfspaket von rund 7,5 Milliarden Euro für die nächsten fünf Jahre zugesagt. Eine Erhöhung der Hilfe der Schweiz ist jedoch aufgrund der unhaltbaren humanitären Lage unabdingbar und liegt auch im aussenpolitischen Interesse der Schweiz.</p><p>Mit der vorliegenden Motion wird der Bundesrat daher aufgefordert, ein Unterstützungsprogramm zur kurz- und mittelfristigen Unterstützung der Ukraine vorzulegen. Dazu sollen die notwendigen gesetzlichen Grundlagen geschaffen werden, die eine Unterstützung der Ukraine ermöglichen und die Rahmenbedingungen der Unterstützung festlegen.</p><p>Das Unterstützungsprogramm soll sich an folgenden Eckpunkte orientieren: Mindestens fünf Milliarden Franken, verteilt über die nächsten fünf bis zehn Jahre. Dieses mehrjährige Engagement soll der Ukraine mehr Sicherheit in Bezug auf die Deckung ihres Bedarfs in den kommenden Jahren geben. Es sollen insbesondere Projekte der humanitären Hilfe, des Schutzes der Zivilbevölkerung, der Friedensförderung und des Wiederaufbaus der Infrastruktur unterstützt werden und es soll dem Bundesrat obliegen, jährlich die Zuweisung des Betrages für das nächste Jahr zu beantragen, wobei er sich nach der Entwicklung des Konflikts und dem Bedarf zu richten hat. Die Ausgaben sollen die bestehenden Verpflichtungen und Kreditlinien im Bereich der internationalen Zusammenarbeit und der humanitären Hilfe ergänzen.</p>",NA,Changed from 4 to 1/4
23.7077,NA,2023-03-01,"Wo steht der Bund bezüglich der Umsetzung der versprochenen Massnahmen zu \""Subventionen mit biodiversitätsschädigender Wirkung\"" im Verkehrsbereich?","<p>Das Bundesamt für Strassen (ASTRA) und das Bundesamt für Verkehr (BAV) haben im August 2021 sieben Massnahmen beschlossen, um die Biodiversität im Verkehrsbereich besser zu schützen und zu fördern - vier davon mit einer Umsetzungsfrist bis Ende 2021 bzw. 2022.</p><p>- Wurden diese Massnahmen inzwischen umgesetzt?</p><p>Wenn ja, mit welchem Erfolg?</p><p>Wenn nein, warum nicht?</p><p>- Was ist der Stand bei den Massnahmen mit einer Frist bis 2023?</p>",NA,NA
23.7,7,2023-02-27,Interchange Fees für Zahlungen mit Debitkarten deckeln,"<p>Die neuen Debitkarten von VISA und Mastercard verursachen den Unternehmen, die dieses Zahlungsmittel akzeptieren (Geschäfte, Restaurants, Hotels, Dienstleistungsunternehmen usw.), höhere Entgelte als die heutige Maestro-Karte. Es wäre wünschenswert, wie die Europäische Union diese Interbankenentgelte (Interchange Fees) zu deckeln, um den KMU etwas Luft zu verschaffen.</p><p>Ist der Bundesrat bereit, eine annehmbare Obergrenze für solche Entgelte einzuführen?</p>",NA,"NEW DT,"
23.328,8,2023-03-16,Für das Recht jedes Mitglieds der Versichertengemeinschaft auf Mitsprache bei wichtigen Änderungen im Bereich der Sozialversicherungen,"<p>Der Bundesrat wird beauftragt, eine Gesetzesänderung vorzuschlagen, die es allen Versicherten ermöglicht, bei grossen Änderungen im Bereich der Sozialversicherungen (AHV, IV, UV) mitzureden.</p><p>Die Schweiz hat sich für ein System der sozialen Sicherheit entschieden, das auf Versicherungen beruht, in die alle Arbeitnehmerinnen und Arbeitnehmer unabhängig von ihrer Nationalität einzahlen.</p><p>Es gilt, die Demokratie des Systems zu gewährleisten und allen Versicherten die Möglichkeit zu geben, bei wichtigen Änderungen der Versicherungen, denen sie angeschlossen sind, mitzureden.</p><p>Heute bleibt diese Möglichkeit 520 000 Frauen und 710 000 Männern verwehrt. </p><p>Diese Versicherten machen 57 Prozent der Hilfsarbeitskräfte, 44 Prozent der Maschinenbedienerinnen und -bediener und 28 Prozent des Personals in Dienstleistungsberufen und der Verkäuferinnen und Verkäufer aus. Sie sind in den belastendsten Berufen überrepräsentiert. </p><p>Sie zählen daher zu jenen Personen, die am stärksten von Änderungen bei den obligatorischen Sozialversicherungen betroffen sind.</p>",NA,Change from 9 to 8
23.7057,NA,2023-03-01,A22 unter den Boden - Gewässer- und Siedlungsraum freispielen,"<p>1. Inwiefern ist eine Sanierung der teilweise auf der Ergolz verlaufenden A22 Liestal-Lausen mit der Gewässerschutzgesetzgebung vereinbar?</p><p>2. Welche weiteren Lärmschutzmassnahmen sind neben den im Abschnitt Lausen angekündigten Massnahmen geplant?</p><p>3. Welche Überlegungen liegen von Seiten des Bundes bereits vor, um den wertvollen Natur- und Siedlungsraum von der teilweise auf der Ergolz verlaufenden Fahrspur zu befreien?</p>",NA,NA
23.3407,9,2023-03-17,Gleich lange Spiesse beim Grenzschutz!,"<p>Der Bundesrat wird beauftragt, eine Angleichung der Zolltarife für pflanzliche Proteine vorzunehmen. Konkret soll bei Proteinisolaten bei der Einfuhr in die Schweiz nicht der \""Proteingehalt\"" ausschlaggebend für den Zolltarif sein, da dies eine Benachteiligung gegenüber der Einfuhr tierischer Rohstoffe darstellt, wo diese Frage nicht gestellt wird.</p><p>Neben einer innovativen Land- und Ernährungswirtschaft im Inland hat die Schweiz als Innovationsstandort und Sitz vielversprechender Startups und Kleinunternehmen eine wichtige Rolle im globalen Ernährungssystem. Dies ist eine besondere Chance für die Schweiz, sich im globalen Markt als attraktiver Wirtschaftsstandort und Pionier für eine auf Nachhaltigkeit ausgerichtete Agrar- und Lebensmittelindustrie zu positionieren. Es ist also nicht nur die Vermeidung der hohen privaten und öffentlichen Kosten steigender Gesundheits- und Umweltrisiken, sondern es sind auch die grossen wirtschaftlichen Chancen eines zunehmend auf Nachhaltigkeit ausgerichteten Marktes, welche die Förderung umweltschonender, pflanzlicher Alternativen zu einer lohnenden Investition machen. Dies ist einem wissenschaftlichen Paper von Felsenfest et. al. zu entnehmen, das sich mit den Chancen und Potenzialen einer auf Nachhaltigkeit ausgerichteten Ernährungszukunft befasst.</p><p>Die aktuelle Situation zeigt denn auch: über die Schweizer Grenzen hinaus bekannte Firmen und Startups beweisen: wir können Innovation! Die Chance, auf dem vielversprechenden Markt pflanzlicher Alternativprodukte zu einem der Leader zu avancieren, ist gegeben. Ein Hindernis für viele Produzierende ist jedoch die Beschaffung der Rohstoffe. Idealerweise könnte man bereits heute voll auf Schweizer Proteinisolate zurückgreifen, doch bis dem so ist, müssen beispielsweise Erbsenproteinisolate mit höheren Zolltarifen aus dem benachbarten Ausland importiert werden als tierische Rohstoffe. Um hier eine Gleichbehandlung sicherzustellen und innovativen Produzierenden in der Schweiz keine Nachteile einzuräumen, soll mit dieser Motion diese Ungleichbehandlung beseitigt werden.</p>",NA,NA
22.3739,2,2022-06-16,Strukturen der Schweizer Musikwirtschaft stärken,"Der Bundesrat wird beauftragt, die nötigen Verordnungsanpassungen vorzunehmen oder der Bundesversammlung Entwürfe zu gesetzlichen Anpassungen vorzulegen, welche die gezielte Strukturförderung der schweizerischen Musikwirtschaft ermöglichen. // Die Musikwirtschaft der Schweiz ist breit aufgestellt, sehr vielfältig und hat sich in den letzten Jahren zu einem dynamischen Wachstumsmarkt entwickelt. Dies schlägt sich in erfreulichem Erfolg nieder: Einerseits verschaffen sich immer mehr Schweizer Künstlerinnen und Künstler international Gehör und andererseits hat der Anteil des einheimischen Musikschaffens gegenüber der internationalen Konkurrenz deutlich an Marktanteilen gewonnen. Ein wichtiger Treiber dieser positiven Entwicklung sind zahlreiche kleine und mittlere Unternehmen und Organisationen (Labels, Managements, Vermittlungen, Booking-Agenturen und Musikverlage), welche die Musikerinnen und Musiker und Veranstalterinnen und Veranstalter mit professionellem Knowhow unterstützen. Sie sind damit wesentlich am kulturellen und wirtschaftlichen Erfolg der Schweizer Musik beteiligt.
Das unternehmerische Risiko dieser Kreise ist gross. Eine vom Bund getragene Strukturförderung könnte helfen, die Rahmenbedingungen zu optimieren und damit die Chancen des nationalen Musikschaffens im In- und Ausland signifikant zu verbessern.
Diese Punkte wurden bereits im Postulat Wermuth 20.3685 betont. Der Bundesrat wollte dieses Postulat mit Verweis auf die bestehenden Fördergefässe im Kulturbereich und auf dem Standpunkt, die Strukturförderung sei in der Musik nicht dringender als anderswo nicht annehmen. Seither sind wegen der aktuellen Krisen viele bestehende Strukturen weiter weggebrochen und die existenzielle Gefährdung der Schweizerischen Musikwirtschaft hat sich akzentuiert. Es ist deshalb dringender Handlungsbedarf in Form von Strukturförderung angezeigt. Mit einer gezielten Strukturförderung könnte Professionalisierung der Branche vorangetrieben die Wettbewerbsfähigkeit gestärkt, die Wertschöpfung der Branche erhöht die Arbeitsplätze sowie wertvolle Aus- und Weiterbildung gesichert werden. Dies würde auch der Abwanderung von erfolgreichen Künstlerinnen und Künstlern zu ausländischen Unternehmen entgegenwirken.",added,NA
22.3886,6,2022-08-16,Praxistaugliche Umsetzung des Schleppschlauchobligatoriums,"Der Bundesrat wird beauftragt dahingehend aktiv zu werden, dass die Vollzugshilfe zur Umsetzung des Obligatoriums von emissionsmindernden Ausbringverfahren von Gülle ergänzt wird. Namentlich sind emissionsmindernde Ausbringverfahren nicht zwingend einzusetzen: (I) In Hochstammbaumgärten (auch QI) mit mehr als 25 Hochstämmen je Hektare, (II) bei Parzellen, welche auf Grund der bestehenden Ausnahmen weniger als 80 Prozent emissionsarm begüllbare Flächen aufweisen und (III) Teilflächen von weniger als 50 Aren mit einer Minimalbreite von 12 Metern.
//
Seit dem Entscheid des Bundesrates emissionsmindernde Gülletechnik als Pflicht einzuführen, hat der Bund gemeinsam mit den Kantonen die Umsetzung des Obligatoriums erarbeitet. Nun zeigen sich dabei diverse Schwierigkeiten in der Praxis, welche angegangen werden müssen.
(I) Hochstammbäume sind wichtig für die Biodiversität, jedoch sind sie auch Hindernisse für die Bewirtschaftung der darunterliegenden Fläche. Während Q2 Bäume explizit vom Obligatorium ausgenommen sind, braucht es bei Q1 Bäumen jeweils einzelne Ausnahmegesuche, da es nicht auf den Karten abgebildet wird.
(II) In kupiertem Gelände sind oftmals zwei Systeme notwendig. Damit nicht wegen Kleinstflächen auf den einzelnen Parzellen ein langer Anfahrtsweg mit unterschiedlichen Systemen notwendig ist, sind Parzellen, welche weniger als 80 Prozent emissionsarm begüllbare Flächen aufweisen, von der Pflicht auszunehmen.
(III) Gemäss Vollzugshilfe sind Teilstücke grösser als 25 Aren pflichtig, diese Untergrenze ist jedoch zu tief angesetzt. Als zusammenhängende Flächen zählen Teilstücke mit einem 2,5m breiten Durchgang, was bei einer durchschnittlichen Breite eines Schleppschlauches von 12 Metern nicht praktikabel ist. So müsste während der Ausbringung von einem Fass den Prozess aufwändig unterbrochen werden und die Seitenarme eingeklappt werden. Für eine praxistaugliche Umsetzung sollte die Teilfläche mindestens 50 Aren gross sein und die minimale Breite der Teilfläche 12 Metern entsprechen.
Mit der Einreichung der Motion hat die Kommission das Anliegen der Petition 22.2005 ""Eberli Paul. Abschaffung der obligatorischen Schleppschlauchpflicht"" teilweise aufgenommen.",NA,added
23.3341,NA,2023-03-17,Prioritätenliste für die Interessenabwägung bei Projekten von übergeordneter Bedeutung,"<p>Der Bundesrat wird beauftragt, die Ziele in Artikel 1 im Raumplanungsrecht und gegebenenfalls in weiteren Erlassen dahingehend anzupassen, dass Entwicklungs- und Infrastrukturprojekten von übergeordneter Bedeutung gesetzlich priorisiert werden, um den Zubau oder Umbau von ausreichend Wohnraum zu fördern. Dabei soll der Bundesrat die Kantone und die Gemeinden miteinbeziehen, respektive gemeinsam mit ihnen eine Priorisierung erarbeiten.</p><p>Es ist Aufgabe von Bund, Kantonen und Gemeinden mit unserem Boden nachhaltig und sorgsam umzugehen. Dafür müssen wirtschaftliche, gesellschaftliche und ökologische Bedürfnisse mitberücksichtigt werden. Doch eine zunehmend dynamische Entwicklung erschwert ein fokussiertes Abwägen und Gewichten dieser Elemente. Es resultieren Einsprachen, komplexe Bauvorschriften oder langwierige Planungs- und Bewilligungsverfahren, was wiederum dazu führt, dass grössere Um- oder Neubauprojekte nicht oder nur sehr langsam realisiert werden können. Mitunter ist der Grund, weshalb die Wohnungsknappheit in der Schweiz stetig zunimmt.</p><p>Vor diesem Hintergrund scheint es eine gesetzliche Priorisierung notwendig, um den Zu- und Umbau von ausreichend Wohnraum zu fördern. Deswegen soll der Bundesrat gemeinsam mit den Kantonen und Gemeinden eine gesetzliche Priorisierung erarbeiten, auf welcher die Interessensartikulation und -abwägung in den ordentlichen Planungs- und Bewilligungsverfahren klarer und schneller erfolgen kann. Unter Gewährleistung von Planungs- und Rechtssicherheit wird so eine Beschleunigung der Verfahren und der Bewältigung der drängenden Herausforderungen erreicht. Gleichzeitig lässt sich damit auf allen Ebenen ein Verschleiss von personellen und finanziellen Ressourcen der öffentlichen Hand und auch von privaten Akteuren verhindern. </p><p>Die Priorisierung bei der Interessensabwägung trägt dazu bei, die übergeordneten Ziele in einer dynamischen, wettbewerbsfähigen Schweiz zügiger zu realisieren. Aus heutiger Perspektive wären bei der Interessenabwägung innerhalb der RPG-Verfahren u.a. folgende Prioritäten denkbar: </p><p>grössere Energie- bzw. Stromproduktion, Wohnungsbau und -zubau (Verdichtung), Klimaschutz, städtische Planung, Mobilität, Ressourcen (Wasser) etc. </p><p>Interessen von übergeordneter Bedeutung in der Raumplanung zu priorisieren, leistet einen wesentlichen Beitrag, relevante Projekte nicht zu blockieren bzw. nicht zu verhindern. Die Umsetzung notwendiger Projekte ist aufgrund der aktuellen Gesetzgebung zur Gestaltung von Räumen und Landschaften in der Schweiz gegenwärtig nicht gewährleistet.</p>",NA,NA
23.3116,1/7,2023-03-13,Weniger Plastik – mehr Kompost,"<p>Methanisierung und Kompostierung sind gute Methoden zur Wiederverwertung von pflanzlichen Abfällen für unsere Wirtschaft und unseren Planeten, da sie der Landwirtschaft natürlichen Dünger liefern. Um hochwertige Produkte zu gewinnen, ist es jedoch wichtig, dass die gesetzlichen Anforderungen eingehalten werden. Die Chemikalien-Risikoreduktions-Verordnung sieht daher vor, dass bei Kompost und Gärgut Fremdstoffe (Metall, Glas, Altpapier, Karton usw.) höchstens 0,4 Prozent des Gewichts der Trockensubstanz betragen dürfen und dass der Gehalt an Alufolie und Kunststoffen höchstens 0,1 Prozent des Gewichts der Trockensubstanz betragen darf. Die Richtlinien von Bio Suisse sehen für Kunststoffe ab dem 1. Januar 2021 einen Höchstwert von 0,1 und ab dem 1. Januar 2024 von 0,05 Prozent vor.</p><p>In der Schweiz gibt es kein gesetzliches Verbot für den Verkauf von Einweg-Plastiksäcken. Zudem können Einweg-Plastiksäcke kostenlos bezogen werden, wenn sie als Verpackung für lose Waren (Obst, Gemüse, Gebäck usw.) verwendet werden. Der von den Gemeinden gesammelte Kompost entspricht oft nicht den Standards von Bio Suisse, in den meisten Fällen wegen zu vieler Einweg-Plastiksäcke.</p><p>Vor dem Hintergrund dieser Situation wird der Bundesart gebeten, folgende Fragen zu beantworten:</p><p>1. Wie beurteilt der Bundesrat die wirtschaftlichen und ökologischen Auswirkungen der Branchenvereinbarung zur Verringerung des Verbrauchs von Einweg-Plastiksäcken?</p><p>2. Hat diese Vereinbarung insgesamt zu einem Anstieg oder Rückgang der Verpackungsproduktion geführt?</p><p>3. Die Bestimmungen des Bundes werden immer strenger, was den Anteil von Plastik im Kompost angeht. Viele Gemeinden werden jedoch Schwierigkeiten haben, diese einzuhalten. Kann der Bundesrat mit einem Verbot von kostenlosen Plastiksäcken für Obst und Gemüse in Supermärkten die Ursache des Problems angehen? Zum Beispiel, indem sie durch biologisch abbaubare Beutel oder Papiertaschen ersetzt werden? Oder indem sie kostenpflichtig werden?</p><p>4. Erwägt der Bundesrat die Einführung von Sensibilisierungsprogrammen für Konsumentinnen und Konsumenten, um den Verbrauch von Plastiksäcken zu reduzieren?</p>",NA,Changed from 7 to 1/7
22.3022,2,2022-02-22,Förderung von Schweizer Wein stärken,"Der Bundesrat wird beauftragt, die Mittel zur Förderung von Schweizer Weinen auf 9 Millionen Franken pro Jahr zu erhöhen, sofern sie Nachhaltigkeits- und Qualitätskriterien erfüllen. // Der Bund unterstützt die gemeinsamen absatzfördernden Marketingmassnahmen der verschiedenen Landwirtschaftsbranchen gemäss Artikel 12 des Landwirtschaftsgesetzes finanziell. Er beteiligt sich zu 50 Prozent an den entsprechenden Kosten.
Das Bundesamt für Landwirtschaft (BLW) unterstützt die Absatzförderung der Schweizer Weinbranche derzeit mit 2,8 Millionen Franken. In den Jahren 2020 und 2021 wurde zusätzlich Nothilfe in der Höhe von 1 Million Franken gesprochen für konkrete Projekte in der Gastronomie oder bei den Grossverteilern. Dadurch konnte der Absatz von Schweizer Weinen bei Grossverteilern stark gesteigert werden. Trotz dieser äusserst positiven Ergebnisse beschloss das BLW, diese Finanzhilfe 2022 um 200 000 Franken zu reduzieren und sie ab 2023 ganz zu streichen.
Trotz des starken Konsumrückgangs 2020 schnitten die Schweizer Weine gut ab und konnten sogar Marktanteile gewinnen: Diese stiegen um 0,7 Prozentpunkte auf 37,7 Prozent.
Die Marktposition des Schweizer Weins muss durch eine Erhöhung der Mittel für die Absatzförderung langfristige gestärkt werden. Die Erfahrung mit der Nothilfe 2020-2021 hat bestätigt, dass die Absatzförderung von Schweizer Wein auf dem Inlandmarkt, insbesondere bei den Grossverteilern und in der Gastronomie, einer substanzielleren und stabileren Finanzierung bedarf.
Zudem ist wichtig, dass die Schweizer Weinbranche über gleich lange Spiesse verfügt wie die auf dem Schweizer Markt tätige europäische Konkurrenz, die staatliche Beihilfen und EU-Gelder von mehr als 10 Millionen Euro erhält.",added,NA
23.3102,NA,2023-03-09,Mobilität der Hochschulstudierenden. Klar unbefriedigende Ergebnisse,"<p>Im Rahmen des Bologna-Prozesses hat sich die Schweiz mehrfach verpflichtet, aktiv an der Schaffung des Europäischen Hochschulraums mitzuwirken. Als zentrales Instrument wurde die Mobilität der Studierenden ausgemacht; sie wird mit einem nationalen Mobilitätsprogramm (Swiss-European Mobility Programme, SEMP) gefördert. Trotz diesen Bemühungen zeigt die jüngste Studie von Movetia, dass das Ziel einer Mobilitätsquote von 20 Prozent von den meisten Hochschulen nicht erreicht wird.</p><p>Ich bitte den Bundesrat, die folgenden Fragen zu beantworten:</p><p>- Warum erreichen die Schweizer Hochschulen das Ziel einer Mobilitätsquote von 20 Prozent nicht?</p><p>- Welche Wege gibt es für die Hochschulen, um dieses Ziel zu erreichen?</p><p>- Warum werden die verschiedenen Instrumente von Erasmus+ auf nationaler Ebene nicht stärker gefördert, nach dem Vorbild des SEMP?</p><p>- Welche kurzfristigen Massnahmen sieht der Bundesrat vor, um die Anbindung der Schweizer Hochschulen an den Europäischen Hochschulraum sicherzustellen?</p>",NA,NA
23.7064,NA,2023-03-01,Ausbau Viertelstundentakt,"<p>Der Ausbau der S27 ist im Step 2035 nicht enthalten.</p><p>Warum wird das Untere Aaretal in der Planung des ÖV nicht als Wohnentwicklungsschwerpunkt taxiert, wie es der Kanton Aargau vorsieht, und der Viertelstundentakt im nächstmöglichen Entwicklungsschritt geplant?</p>",NA,NA
