bill,classification,submission_date,bill_title,bill_text,"Notes (added = title, text, date added)",Notes
23.3089,NA,2023-03-08,Wie steht es um die langfristige Finanzierung der Gesundheitskosten?,"Der Bundesrat wird beauftragt, einen Bericht zu erstellen, der Perspektiven zur Entwicklung der Gesundheitskosten und vor allem zu den verschiedenen Möglichkeiten ihrer zukünftigen Finanzierung aufzeigt. Dies mit dem prioritären Ziel, die genannte Finanzierung in der Zukunft gesellschaftlich tragbarer und solidarischer zu machen.
//
In den letzten Wochen haben verschiedene Akteurinnen und Akteure aus der Politik und dem Gesundheitswesen Alarm geschlagen angesichts der komplizierten Situation, in der sich das Schweizer Gesundheitssystem zurzeit befindet: Mangel an medizinischem und pflegerischem Personal, wiederholte Probleme bei der Arzneimittelversorgung, überfüllte Spitäler, überlastete Notfallstationen und die komplizierte finanzielle Situation der Spitäler, ganz zu schweigen von den steigenden Krankenkassenprämien aufgrund der fortdauernden Steigerung der Gesundheitskosten.
Unser Gesundheitssystem - obwohl es eines der besten der Welt ist und wir bereits mehr als 12 Prozent unseres BIP (11.8 Prozent im Jahr 2020) dafür ausgeben - ist am Ende seiner Kräfte.
Und auch die Prognosen zur Entwicklung der Gesundheitskosten sind nur wenig erbaulich: Es ist von einer jährlichen Zunahme von über einer Milliarde Franken die Rede und man schätzt, dass derjenige Teil des BIP, der für das Gesundheitswesen aufgewendet wird, bis zum Jahr 2050 15 Prozent erreichen könnte.
Üblicherweise ist lediglich von der Kostensenkung die Rede, doch dies ist illusorisch: Dass es Faktoren gibt, die einen kontinuierlichen Anstieg der Kosten verursachen, ist allzu bekannt. Zunächst einmal wächst unsere Bevölkerung, während sie gleichzeitig altert. Zur Rekordlanglebigkeit kommt noch eine rückläufige Geburtenrate hinzu. Dann werden die diagnostischen und therapeutischen Technologien immer ausgeklügelter und leistungsstärker, aber auch teurer. Für die Gesundheit, selbst in einem fortgeschrittenen Alter, ist kein Preis zu hoch. Neben den demografischen und technologiebezogenen Gründen liegt die dritte Ursache der Kostensteigerung im erhöhten Konsum von Pflegeleistungen, gemeinsam mit seinen beiden Gegenstücken, der Verfügbarkeit eines diversifizierten Pflegeangebots sowie den Erwartungen und Ansprüchen der Patientinnen und Patienten, die legitimerweise Wert auf den Erhalt ihrer Gesundheit legen; dies umso mehr, da sie finanziell viel zum System beisteuern.
Heute ist es selbstverständlich legitim, sich unermüdlich darum zu bemühen, den schnellen Anstieg der Gesundheitskosten einzudämmen, die Effizienz und Qualität der Leistungen zu verbessern und vor allem auch vermehrt auf Gesundheitsförderung und -prävention zu setzen.
Man kommt aber nicht umhin, parallel dazu die Finanzierung zu überdenken - diese ist eine Belastung, die bereits heute für breite Teile der Bevölkerung untragbar ist. Wie wird es erst in Zukunft aussehen?",NA,added
23.7081,7,2023-03-01,"Welcher Schutz vor Privatkameras, die den öffentlichen Raum permanent filmen?","<p>Gewisse Geräte ermöglichen es Privatpersonen, den öffentlichen Raum permanent zu filmen, zum Beispiel Kameranetze von Fahrzeugen (Tesla).</p><p>- Wie können die Bürgerinnen und Bürger verhindern, dass sie gegen ihren Willen von diesen Geräten gefilmt werden?</p><p>- Gedenkt der Bundesrat, Massnahmen zu ergreifen, um die Bevölkerung besser vor dieser Verletzung ihrer Privatsphäre zu schützen (wenn die Kameras permanent filmen), zum Beispiel, indem er die Verwendung solcher Geräte reguliert?</p>",NA,NA
23.7028,NA,2023-02-28,Mehr Sicherheit für die Bevölkerung in Mitholz - jetzt!,"<p>Die SIK-N will die Beratung des Geschäfts über die Räumung des Munitionslagers für ein Jahr sistieren und Varianten der Verfüllung, Verkapselung und Abdichtung detailliert prüfen.</p><p>Unter welchen Bedingungen wäre es möglich, die für den Sommer 2023 geplanten Risikominimierungs-Massnahmen, welche die Bevölkerung von Mitholz erheblich besser vor einer Explosion schützen würden, dennoch wie geplant durchführen zu lassen?</p>",NA,NA
23.3487,NA,2023-04-12,Fall Credit Suisse. Alle möglichen Massnahmen zur Sicherung der Arbeitsplätze in der Schweiz prüfen,"Der Bundesrat und die FINMA unternehmen alle möglichen Schritte, damit die Wettbewerbskommission (WEKO) die Durchführung einer vertieften Prüfung gemäss Art 33 KG (Prüfungsverfahren) einleitet.
//
Die Arbeitnehmenden der Credit Suisse aber auch diejenigen der UBS kamen in der ganzen Bankenkrise viel zu kurz. Über ihre schwierige Situation haben sich die beiden Banken aber auch der Bundesrat und FINMA kaum geäussert. Das muss sich ändern. Der Bundesrat muss deswegen alles tun, um auf eine sozialverträgliche Lösung hinzuarbeiten. Mag dies in der vorliegenden Situation nicht einfach sein, so bietet die vorliegende Motion einen Weg. Der Bundesrat oder die zuständigen Behörden sollen daraufhin wirken, dass im Rahmen der Übernahme der CS durch die UBS Massnahmen zum Schutz von Arbeitsplätzen abgewogen und wenn möglich auch umgesetzt werden. Dabei ist es wichtig, dass Massnahmen zum Schutz von Arbeitsplätzen durch vorherige Anhörung der Unternehmen, vor allem der Credit Suisse, und den diesbezüglichen Vertretungen der Arbeitnehmenden konzipiert werden.",NA,added
23.301,NA,2023-02-02,Die Chance der Realisierung des multifunktionalen Grimseltunnels erhalten,"Der Bundesrat erhält den verpflichtenden Auftrag, im Rahmen der Botschaft zum Stand der Ausbauprogramme Bahninfrastruktur und Perspektive 2050
- den multifunktionalen Grimseltunnel in die Ausbauprogramme aufzunehmen,
- die erforderlichen Kredite für die Projektierung einzustellen und
- den Projektierungsfortschritt des Bahntunnels mit demjenigen des Netzprojektes abzustimmen, damit der Realisierungsentscheid zur Verkabelungsvariante parallel mit dem Entscheid zum Bahnprojekt getroffen werden kann.
//
Das Projekt eines multifunktionalen Grimseltunnels ist per Ende 2022 baureif. Der neue Tunnel sieht einen einspurigen Bahntunnel zwischen lnnertkirchen und Oberwald vor. Mit dem Bau des Tunnels wird gleichzeitig die neue Grimsel-Höchstspannungsleitung unterirdisch verlegt (verkabelt). Der multifunktionale Grimseltunnel weist zahlreiche Vorzüge und Modellcharakter auf:
- Erstmalig werden Bahn und Hochspannungsleitungen über eine längere Strecke (22 km) gebündelt. Damit wird ein Auftrag des Bundesrates aus dem Jahr 2019 zur Bündelung von Infrastrukturen umgesetzt und das Projekt wird Vorbildcharakter haben für weitere Bündelungsprojekte.
- Durch die unterirdische Linienführung und Bündelung werden der Bodenverbrauch reduziert und Eingriffe ins Landschaftsbild sogar rückgängig gemacht, so wie es auch den Zielsetzungen der Perspektive Bahn 2050 entspricht.
- Dank den Synergien zwischen Verkabelung und Bahntunnel entsteht ein optimales Kosten-Nutzen-Verhältnis.
- Mit dem Bau des Grimseltunnels wird erstmals das Schmalspurnetz nördlich und südlich der Berner Alpen zusammengeschlossen und es entsteht ein neues, attraktives touristisches Produkt welches auch die Erreichbarkeit der am Streckennetz liegenden Ortschaften wesentlich verbessert und so regionalökonomische Impulse im zentralen Alpenraum auslösen kann.
- Die bautechnischen Risiken sind minim, da die Geologie an der Grimsel bestens bekannt ist.
Für die Verkabelung der Höchstspannungsleitung besteht eine zeitliche Dringlichkeit. Das entsprechende Sachplanverfahren wurde im Sommer 2022 durchgeführt. Seitens der betroffenen Stellen des Bundes, der Kantone und Gemeinden sowie der weiteren interessierten Akteure wird diese Verkabelung in Kombination mit dem gleichzeitigen Bau des Grimselbahntunnels klar favorisiert.",NA,added
22.3869,1,2022-06-23,Förderung von Forschung und Therapie für spezifische Frauenkrankheiten,"Der Bundesrat wird beauftragt, dafür zu sorgen,
- dass frauenspezifische Krankheiten und Beschwerden klarer identifiziert und gezielter erforscht werden;
- dass zusammen mit Fachgesellschaften Guidelines für Diagnose, Indikation und Therapie erstellt und durchgesetzt werden;
- dass die Förderung der Qualität der Behandlung frauenspezifischer Krankheiten als Ziel der Eidgenössischen Qualitätskommission definiert wird. // Zahlreiche Krankheiten wie Lipödem oder Endometriose treffen ausschliesslich oder grossmehrheitlich Frauen. Das dürfte mitunter ein Grund sein, dass diese Krankheiten wenig erforscht werden, oft nicht zeitgerecht diagnostiziert werden können und Therapien kaum oder spärlich zur Verfügung stehen. Im Weiteren leiden unzählige Frauen stark an Menstruationsbeschwerden. Auch in diesem Bereich liegt die Forschung mit Behandlungsmöglichkeiten im Hintertreffen.
Es ist unerlässlich, dass frauenspezifische Krankheiten als solche identifiziert und breiter erforscht werden. Dazu sollte der Bundesrat den Schweizerischen Nationalfonds (SNF) mit einem Forschungsprogramm mandatieren. Es braucht zudem verbindliche Guidelines für Medizinalpersonen für eine schnelle Diagnose und wirksame Therapien, womit die Fachgesellschaften sowie die Eidgenössische Qualitätskommission beauftragt werden müssen. Eine verbesserte Datenlage mit evidenzbasiertem Fachwissen führt zu einer gezielteren Behandlung der Krankheiten und Beschwerden, die frauenspezifisch sind oder hauptsächlich Frauen betreffen. Und zudem verhindert es Fehldiagnosen, die für betroffene Frauen zermürbend sind und unnötige Kosten verursachen.",added,NA
23.7087,NA,2023-03-01,Sondermüll und Verschleiss seltener Erden durch die Förderung von Batteriespeicher für die Erreichung von Netto-Null?,"<p>Batteriespeicher für zuhause mit einer Leistung von rund 10 kWh Stunde lassen sich mittlerweile für um die 10 000 Euro erwerben. Auffällig ist die Standzeit, welche mit 5-10 Jahre angegeben wird.</p><p>Heisst das, dass mittels netto-null vermehrt Sondermüll und Verschleiss seltener Erden angeheizt wird?</p>",NA,NA
22.3958,3,2022-09-21,Begrenzung der Entwicklungshilfe (APD) auf 2 Milliarden Franken jährlich,"Der Bundesrat wird beauftragt, die öffentliche Entwicklungshilfe (Aide publique au développement, APD) der Schweiz auf jährlich 2 Milliarden Franken und damit auf den Stand von 2006 zu begrenzen. // In den letzten 15 Jahren sind die Ausgaben für die Entwicklungshilfe um 1,5 Milliarden Franken angestiegen. Die Entwicklungshilfe stellt damit einer jener Ausgabenposten im Bundeshaushalt mit einer der grössten Wachstumsraten dar. Diese Entwicklung ist angesichts der angehäuften Corona-Schulden und den anstehenden finanziellen Herausforderungen im Sicherheits- und Energiebereich nicht haltbar. Darüber hinaus ist die Wirksamkeit finanzieller Zuwendungen an sogenannte ""Entwicklungsländer"" auch in der Wissenschaft stark umstritten.",added,NA
23.1003,NA,2023-03-07,Bearbeitungsdauer von IV-Beschwerden vor Bundesverwaltungsgericht,"<p>Bei IV Beschwerden ist das kantonale Gericht des Wohnortes der jeweilig betroffenen Person als gerichtliche Erstinstanz zuständig. Für Fälle von Menschen ohne Wohnsitz in der Schweiz ist das Bundesverwaltungsgericht als gerichtliche Erstinstanz zuständig. </p><p>Die Bearbeitungsdauer beträgt gemäss Jahresbericht 2020 durchschnittlich 147 Tage. </p><p>Ich bitte den Bundesrat um statistische Unterlagen und Erläuterungen zur Verfahrensdauer der gerichtlichen Erstinstanzen: </p><p>- Welches ist der Medianwert der Entscheidungsdauer des Bundesverwaltungsgerichtes für die Fällung eines IV-Rekurses? Wie hat sich dieser Medianwert in den letzten sieben Jahren entwickelt? </p><p>- Wie viel Zeit vergeht durchschnittlich bis zum Entscheid eines kantonalen Gerichtes? </p><p>- Wie viele Stunden werden für die Bearbeitung eines Falles beim Bundesverwaltungsgericht durchschnittlich aufgewendet? Wie viele Stunden dauert die Bearbeitung durchschnittlich bei einem Kantonsgericht? </p><p>- Falls es noch keinen Benchmark gibt respektive kein Quervergleich mit den Kantonen möglich ist: Was wäre notwendig, um einen Benchmark einzuführen? </p><p>Falls die Bearbeitung beim Bundesverwaltungsgericht durchschnittlich länger dauert respektive deutlich mehr Bearbeitungszeit beansprucht als in den Kantonen, stellen sich folgende Fragen: </p><p>- Was sind aus Sicht des Bundesrates die Gründe dafür? </p><p>- Welche Massnahmen müssten ergriffen werden, um eine Prozessverbesserung für eine effizientere Bearbeitung der Fälle zu erreichen? </p><p>- Sieht der Bundesrat Handlungsbedarf bei den personellen Ressourcen?</p>",NA,NA
23.7046,NA,2023-02-28,Rechtliche Annexion der besetzten palästinensischen Gebiete durch die neue israelische Regierung,"<p>Bereits im Koalitionsvertrag hat die neue Regierung Netanjahu Veränderungen in der Art der Kontrolle über die besetzten palästinensischen Gebiete vereinbart. Im Februar 2023 hat die Regierung nun den Übergang der Kontrolle über das Westjordanland von einer militärischen zu einer zivilen Behörde beschlossen.</p><p>- Wie reagiert der Bundesrat auf diesen Verstoss gegen die IV. Genfer Konvention?</p><p>- Ist er bereit, so bald als möglich ein Treffen der Hohen Vertragsparteien der IV. Genfer Konvention einzuberufen?</p>",NA,NA
23.339,NA,2023-03-17,Einführung eines Patientenfonds,"<p>Der Bundesrat wird beauftragt, die gesetzlichen Grundlagen für die Einführung eines Patientenfonds zu schaffen, damit Patientinnen und Patienten eine Entschädigung erhalten, wenn sie durch eine ärztliche Behandlung oder aufgrund eines Spitalaufenthaltes einen Schaden erlitten haben.</p><p>In seinem Bericht \""Patientenrechte und Patientenbeteiligung in der Schweiz\"", als Antwort auf die Postulate 12.3100 Kessler, 12.3124 Gilli und 12.3207 Steiert, hält der Bundesrat als möglichen Handlungsbereich die Einführung eines Entschädigungssystems für Behandlungsrisiken wie z.B. spitalerworbene Infektionen fest. Derzeit ist diese Empfehlung des Berichts im Schweizer Gesundheitssystem nicht umgesetzt, was immer wieder zu Härtefällen führt. </p><p>Laut Bundesrat müssen die Instrumente in eine Kultur der Sicherheit und des Lernens aus Fehlern eingebettet sein, die auch die Situation der Patientinnen und Patienten berücksichtigt. Ausserdem ist eine möglichst vollständige Transparenz seitens Leistungserbringern bei vermuteten medizinischen Fehlern ein sehr wichtiges Anliegen der Patientinnen und Patienten. Diese Transparenz wird im aktuellen System, das rein auf die Haftpflichtfrage stützt, nicht gefördert.</p><p>Viele andere Länder kennen ein solches System mit unterschiedlichen Modellen, das eine positive Fehlerkultur in der Medizin ermöglicht. Entsprechend den Vorschlägen des Bundesrates in dem oben genannten Bericht wird eine Entschädigung subsidiär zur Haftung für den entstandenen Schaden gewährt, wenn ein Schaden nicht auf einen Fehler zurückzuführen ist oder sich der Nachweis eines Fehlers bzw. des Kausalzusammenhangs als unmöglich erweist. Einen Fehler zu belegen ist z. B. bei mangelnder Dokumentation nicht möglich, weil gemäss bundesgerichtlicher Rechtsprechung in diesen Fällen davon ausgegangen wird, dass die üblichen Untersuchungen durchgeführt und normal ausgefallen sind. Der Bundesrat soll ein geeignetes Modell für die Finanzierung und die Organisationsform vorschlagen, wobei er auch die Form der Beteiligung der Akteure festlegt. Zu prüfen wäre auch, ob der Fonds als Überbrückungshilfe genutzt werden könnte, bis eine allfällige Haftungsfrage geklärt ist.</p>",NA,NA
23.7037,NA,2023-02-28,Hohe Löhne der Bundesangestellten,"<p>Gemäss einer Studie des Instituts für Schweizer Wirtschaftspolitik der Universität Luzern verdienen auch Bundesangestellte in hohen Lohnklassen deutlich besser als vergleichbare Arbeitnehmer in der Privatwirtschaft.</p><p>Wie rechtfertigt der Bundesrat die Tatsache, dass nicht nur die niedrigen Löhne der Bundesangestellten, sondern auch die hohen Löhne deutlich höher sind als in der Privatwirtschaft?</p>",NA,NA
23.421,4,2023-03-17,Rohstoffsektor mittels unabhängiger Aufsicht stärken,"Es soll ein gesetzlicher Rahmen geschaffen werden, der die Sorgfalts- und Offenlegungspflichten für den Rohstoffsektor definiert. Zur Durchsetzung dieser Pflichten soll eine Rohstoffmarktaufsichtsbehörde eingesetzt werden. Damit soll folgendes sichergestellt werden:
- Richtlinien für bessere Transparenz
- Bekämpfung von Korruption und anderen Formen illegitimer Finanzflüsse
- Kein Handel mit illegalen Rohstoffen, illegal erworbenen Rohstoffen oder Rohstoffen aus Ländern mit von der Schweiz belegten Handelssanktionen getätigt wird- Sorgfaltspflichten für Geschäftstätigkeiten mit politisch exponierten Personen (PEP)
- Erkennen von relevanten Risiken durch Beobachtung der Geschäftstätigkeit // Der Rohstoffsektor ist in den vergangenen Jahren deutlich gewachsen. Die in der Schweiz ansässigen Unternehmen haben während der vergangenen Krisenjahre von den volatilen Märkten profitiert. Ihre Gewinne haben sich teilweise um das mehrere hundertfache vergrössert. Aktuellen Schätzungen zu Folge verantwortet der Rohstoffsektor 8 Prozent des Bruttoinlandproduktes. Die Bedeutung dieser Branche ist vergleichbar mit dem Bankensektor (9 Prozent des BIP).
Die Bedeutung dieses Wirtschaftssektors, verbunden mit dem erhöhten Korruptionsrisiko und finanzieller Abhängigkeit (wie dargelegt im Bericht des Bundesrates zu 13.3365 ""Schweizer Geldwäschereidispositiv in Bezug auf den Rohstoffsektor"") birgt ein nicht mehr zu vernachlässigendes Risiko für die Schweiz.
Das Fehlverhalten einzelner Firmen kann zu Reputationsschäden des ganzen Sektors und der Schweiz als globalem Wirtschaftsstandort führen. Deshalb sind gesetzliche Grundlagen für den Rohstoffsektor zu verabschieden und eine Aufsichtsbehörde analog der Finma zu etablieren, die die Durchsetzung der gesetzlichen Anforderungen sicherstellt. Eine entsprechende Behörde kann durch Beobachtung relevante Risiken erkennen, Regulierungen frühzeitig planen und die nötigen Informationen zur Verfügung stellen. Sie kann den regulierten Unternehmen zusätzlich Sorgfaltspflichten auferlegen für Geschäftstätigkeiten mit politisch exponierten Personen (PEP) oder PEP-nahestehenden Personen, Transparenzvorschriften erlassen und dafür sorgen, dass kein Handel mit illegalen Rohstoffen, illegal erworbenen Rohstoffen oder Rohstoffen aus Ländern mit internationalen Handelssanktionen betrieben wird.",NA,added
23.3394,NA,2023-03-17,"Aktionsplan \""Mehr Qualität als Quantität\"" in der Pflege","<p>Der Bundesrat wird beauftragt, im Rahmen seiner Zuständigkeiten und allenfalls gemeinsam mit weiteren Akteuren und Partnern (Kantone, Leistungserbringern, Versicherern usw.) die Ausarbeitung und die Umsetzung eines Massnahmenprogramms zur Qualität der Pflege in Angriff zu nehmen. Zudem soll er dem Parlament mindestens alle zwei Jahre Bericht über den Fortschritt erstatten. Der Schwerpunkt des Programms ist auf die Sicherstellung der Qualität der ärztlichen Verschreibungen zu legen, mit dem Ziel, überflüssige oder qualitativ unzureichende Eingriffe und Fehler zu vermeiden.</p><p>Jede Schweizerin und jeder Schweizer bezahlt 12 von 100 Franken an die Finanzierung der Kosten des Gesundheitswesens. Damit bezahlen sie weltweit am zweitmeisten an das Gesundheitssystem. Die Bevölkerung verdient deshalb eine Medizin von bestmöglicher Qualität. </p><p>Unnötige und qualitativ unzureichende Eingriffe treiben nicht nur die Kosten in die Höhe, sondern bergen auch für die Gesundheit der betroffenen Personen eine Reihe von Risiken und Unwägbarkeiten. Seit Jahren weisen unzählige Studien und Expertenberichte auf die Problematik der überflüssigen und wirkungslosen oder gar kontraproduktiven Eingriffe hin - folgenlos.</p><p>Frühere und aktuelle Studien machen deutlich, dass Personen mit einer Zusatzversicherung mehr Operationen über sich ergehen lassen müssen als Personen ohne Zusatzversicherung. In Pflegeheimen werden entgegen den üblichen Richtlinien Neuroleptika im Überfluss verabreicht. In der Kardiologie kommt in zahlreichen Fällen ohne zugelassene Indikation das TAVI-Verfahren (Transcatheter Aortic Valve Implantation) zur Anwendung, was einem Verstoss gegen die Krankenpflege-Leistungsverordnung (KLV) gleichkommt. Darüber hinaus gibt es eine ausserordentlich hohe Anzahl von Eingriffen, die offensichtlich auf einen inflationären Einsatz von Stents hindeuten. </p><p>Letztlich sind es die Patientinnen und Patienten und - aus finanzieller Sicht - die Prämienzahlerinnen und Prämienzahler und die Steuerpflichtigen die unter dieser Situation leiden, in der die Ärztinnen und Ärzte unter Druck gesetzt werden - oft gegen ihren Willen -, auf Kosten der medizinischen Ethik ein Maximum zu erwirtschaften.</p><p>Mit den neuen Bestimmungen über die Qualitätsentwicklung im Bundesgesetz über die Krankenversicherung (KVG Art. 58 ff.) darf sich nicht wiederholen, was mit dem KVG und der dazugehörigen Verordnung geschehen ist: Während über 20 Jahren blieben die darin enthaltenen klaren Handlungsanweisungen toter Buchstabe... Nun müssen dringend Taten folgen! Im Zusammenhang mit der demografischen Alterung und dem damit verbundenen Anstieg des Anteils vulnerabler Personen wirken sich unnötige und minderwertige Leistungen immer heftiger aus, und zwar sowohl bei den betroffenen Patientinnen und Patienten und ihren Angehörigen als auch bei den Versicherern, den Prämienzahlerinnen und Prämienzahlern und den Steuerpflichtigen.</p>",NA,NA
23.3016,NA,2023-02-16,Von Gewalt betroffene Minderjährige und junge Erwachsene. Welche Lösungen gibt es in den einzelnen Regionen?,"<p>Der Bundesrat wird beauftragt, im Bereich der Schutzplätze für von Gewalt betroffene Minderjährige und junge Erwachsene in Zusammenarbeit mit den Kantonen eingehend zu analysieren, in welchen Regionen welche Angebote bestehen, und die Zielgruppe differenziert festzulegen.</p><p></p><p>Eine Minderheit der Kommission (Umbricht Pieren, Gafner, Gutjahr, Haab, Herzog Verena, Keller Peter, Nantermod, Tuena, Wasserfallen Christian) beantragt, das Postulat abzulehnen.</p>",NA,NA
23.3155,NA,2023-03-15,Energiestrategie 2050. Sind die Kosten für die Anpassung des Netzes tragbar oder sehen sich Familien und KMU demnächst mit enormen Mehrkosten konfrontiert?,"<p>Die Architektur des heutigen Schweizer Übertragungs- und Verteilnetzes ist auf eine zentralisierte Stromproduktion (grosse Kernkraftwerke und Wasserkraftanlagen) und auf den Stromaustausch mit dem Ausland (grenzüberschreitende Leitungen) ausgelegt.</p><p>Auf der Grundlage der Energiestrategie des Bundes, die von einer starken Zunahme der dezentralisierten Produktion mittels Windkraftparks und insbesondere Photovoltaikanlagen ausgeht, wird die Netzarchitektur bzw. die Netzdimensionierung im grossen Mass angepasst werden müssen.</p><p>Bei der heutigen Schätzung der Investitionen in die erneuerbaren Energien werden die Kosten und die Investitionen für die Anpassung der Stromübertragungs- und verteilnetze nicht thematisiert.</p><p>Ich bitte den Bundesrat um die Beantwortung der folgenden Fragen: </p><p>1. Wurde auf der Grundlage der in der heutigen Energiestrategie des Bundes vorgesehenen dezentralisierten Produktion ein neues Fachkonzept entwickelt?</p><p>2. Wie hoch werden die gesamten Investitionen und Kosten ausfallen für die Anpassung und die Änderung des Übertragungsnetzes (Höchst- und Hochspannung) und des Verteilnetzes (Mittel- und Niederspannung), einschliesslich der Transformatorenstationen?</p><p>3. Wie hoch wird der durchschnittliche Netztarif pro kWh künftig sein und wie hoch wird die Erhöhung in Prozent im Vergleich zum heute geltenden durchschnittlichen Tarif ausfallen?</p>",NA,NA
23.3012,8,2023-02-13,Mehrwertsteuerpflicht für Online-Plattformen bei elektronischen Dienstleistungen,"Der Bundesrat wird beauftragt, dem Parlament eine Änderung des Bundesgesetzes über die Mehrwertsteuer zu unterbreiten, sodass die Plattformbesteuerung auch bei elektronischen Dienstleistungen zur Anwendung kommt.
//
Mit der Botschaft zur Änderung des Mehrwertsteuergesetzes vom 24. September 2021 hat der Bundesrat dem Parlament die Plattformbesteuerung für den Versandhandel vorgeschlagen. Für Plattformen, die Dienstleistungen erbringen, ist hingegen bloss eine Auskunftspflicht vorgesehen. Bei der Beratung der Vorlage kam die WAK-S zu Schluss, dass die Plattformbesteuerung wohl auch auf elektronische Dienstleistungen ausgedehnt werden sollte, jedoch nicht ohne Konsultation der betroffenen Kreise. Bei elektronischen Dienstleistungen handelt es sich vor allem um den Download und das Streaming von Software, Apps, Filmen und Musik. Nicht der Anbieter oder die Anbieterin soll diese elektronischen Dienstleistungen versteuern, sondern die Plattform, über die sie erbracht werden. Diese soll deshalb mittels einer gesetzlichen Fiktion als Erbringerin der elektronischen Dienstleistungen bezeichnet werden. Dadurch kann die Anzahl potenziell steuerpflichtiger Personen reduziert werden, was den Vollzug erleichtert. Durch die umfassendere Besteuerung werden zudem mehrwertsteuerbedingte Wettbewerbsverzerrungen reduziert.",NA,added
