bill,classification,submission_date,bill_title,bill_text,"Notes (added = title, text, date added)",Notes
23.403,6,2023-02-21,Änderung des Kriegsmaterialgesetzes,"<p>Das Kriegsmaterialgesetz wird dahingehend angepasst, wonach bei Lieferungen an Staaten, die unseren Werten verpflichtet sind und über ein Exportkontrollregime verfügen, das dem unsern vergleichbar ist (KMV-Anhang 2-Länder), die Nichtwiederausfuhr-Erklärung ausnahmsweise dann auf 5 Jahre befristet werden kann, wenn sich das Bestimmungsland in der Nichtwiederausfuhr-Erklärung verpflichtet, das Kriegsmaterial nach Ablauf der Frist nur unter folgenden Bedingungen weiterzugeben:</p><p></p><p>- Das Bestimmungsland verletzt nicht in schwerwiegender Weise die Menschenrechte.</p><p>- Es besteht kein Risiko, dass das Kriegsmaterial gegen die Zivilbevölkerung eingesetzt wird.</p><p>- Das Bestimmungsland ist nicht in einen internen oder internationalen bewaffneten Konflikt verwickelt. Ausgenommen von dieser Einschränkung ist der Fall, wenn das Bestimmungsland von seinem völkerrechtlichen Selbstverteidigungsrecht Gebrauch macht, das dann vorliegt, wenn der Sicherheitsrat der Vereinten Nationen in einer Resolution die Handlungen der Gegenpartei als im Widerspruch zum völkerrechtlichen Gewaltverbot deklariert. Für den Fall, dass der Sicherheitsrat der Vereinten Nationen aufgrund eines Vetos nicht zu einer Entscheidung kommt, muss die Generalversammlung der Vereinten Nationen einen Verstoss gegen das völkerrechtliche Gewaltverbot nach Artikel 2 Absatz 4 der Charta der Vereinten Nationen mit einer Zweidrittelmehrheit festgestellt haben. Zusätzlich ausgeschlossen von dieser Einschränkung ist der Fall, wenn der UNO-Sicherheitsrat Massnahmen nach Art. 42 der UNO-Charta beschlossen hat, welche Luft-, See- oder Landstreitkräfte der Mitgliedstaaten einschliessen.</p><p></p><p>Nichtwiederausfuhr-Erklärungen, die mehr als fünf Jahre vor dem Inkrafttreten dieser Gesetzesänderung durch Länder des Anhangs 2 der Kriegsmaterialverordnung unterzeichnet worden sind, und welche die obenstehenden Bedingungen erfüllen, können vom Bundesrat auf Gesuch einer ausländischen Regierung für aufgehoben erklärt werden. Bei der Weitergabe an einen Drittstaat gelten die vorliegenden Bedingungen auch für den Drittstaat.</p>",NA,NA
23.3346,2,2023-03-17,Autobahn A1 auf sechs Spuren ausbauen,"<p align=\""both\"">Der Bundesrat wird beauftragt, die Autobahn A1 auf den Streckenabschnitten Bern-Zürich und Lausanne-Genf auf mindestens sechs Spuren auszubauen.</p><p>Mit 410 km ist die A1 die längste Autobahn der Schweiz. Sie macht rund einen Fünftel des gesamten Nationalstrassennetzes aus und verbindet die Schweizer Zentren Genf, Bern, Zürich und St. Gallen auf der Ost-West-Achse.</p><p>Die massive und ungebremste Zuwanderung hat dazu geführt, dass das Verkehrsaufkommen auf dieser wichtigen Achse heute um einiges grösser ist als früher. Einige Teilabschnitte wie zwischen Härkingen und Wiggertal wurden folgerichtig bereits auf sechs Spuren ausgebaut. Eine weitere Etappe zwischen Härkingen und Luterbach ist in Planung. Dennoch gehört die A1 heute zu den chronisch überlasteten Strecken des Landes, wie die täglichen Staumeldungen zwischen Baregg und Zürich, bei Lausanne oder zwischen Kirchberg und Bern belegen. </p><p>Die Nutzung dieser wichtigen Verkehrsachse wird in naher Zukunft weiter zunehmen. Es ist daher angebracht, dass der Bundesrat den generellen Ausbau der Autobahn A1 auf sechs Spuren forciert.</p>",NA,NA
23.7078,NA,2023-03-01,"Enthüllungen vom \""K-Tipp\"": Die SBB planen, umfangreich und verdeckt, Daten über Passanten zu sammeln. Was unternimmt der Bundesrat dagegen?","<p>Die SBB wollen in den Läden eine bessere \""Abschöpfung\"" der Kunden erreichen; dies mit dem Einsatz hochmoderner Kamerasysteme.</p><p>- Wer bewilligt solche Überwachungsaktionen?</p><p>- Ist es tatsächlich geplant, diese Aktivitäten \""unter Putz\"", also möglichst verdeckt, durchzuführen?</p><p>- Zurzeit werden in 27 Bahnhöfen Kamerasysteme eingesetzt, welche die Anonymisierung rückgängig machen können.</p><p>Wie wird sichergestellt, dass dies künftig, speziell bei kommerziellem Nutzungszweck, nicht mehr geschieht?</p>",NA,NA
23.3492,4,2023-04-12,Die Finma stärken,"<p>Der Bundesrat wird aufgefordert, die Finanzmarktaufsicht namentlich über systemrelevante Banken (SIB) entlang folgender Leitlinien deutlich zu stärken:</p><p>1. Die FINMA - und nicht die Banken - beauftragt und bezahlt die Prüfgesellschaften direkt mit aufsichtsrechtlichen Prüfungen, wie dies der IWF wiederholt gefordert hat (Financial Sector Assessment Program, Report No. 19/183). Die FINMA wendet \""audit-level\""-Praktiken an und führt selber Vor-Ort-Prüfungen durch, etwa zur Durchsetzung erhöhter Sorgfaltspflichten bei Geschäftsbeziehungen mit Rechts- und Reputationsrisiken. Prüfgesellschaften dürfen zur Vermeidung von Interessenkonflikten von den Beaufsichtigten keine Beratungsmandate annehmen.</p><p>2. Das Sanktionsinstrumentarium der FINMA wird ausgebaut, damit es wirksam, verhältnismässig und abschreckend ist. Mängel im Risikomanagement und der Sorgfaltspflicht müssen monetäre Konsequenzen haben. Die individuelle Verantwortungsübernahme der höchsten Kader der Finanzinstitute wird ausgebaut und geklärt. Die FINMA erhält die Befugnis, administrative Sanktionen wie Bussen, Bonikürzungen oder Rückforderungen gegen fehlbare Personen oder Institute sowie Entschädigungen an geschädigte Anlegerinnen und Anleger anzuordnen und über verhängte Sanktionen zu informieren.</p><p>3. Die Autonomie, institutionelle Selbstbestimmung und funktionelle Unabhängigkeit der FINMA von den politischen Behörden wird deutlich gestärkt - eine weitere IWF-Forderung. Namentlich wird die mit der Verordnung zum Finanzmarktaufsichtsgesetz (SR 956.11) eingerichtete Schattenaufsicht des Finanzdepartementes über die FINMA aufgehoben.</p><p>4. Die Handlungsfähigkeit der FINMA wird durch einen Ausbau der finanziellen und personellen Ressourcen erhöht und die Gebühren für SIB erhöht.</p><p>5. Die Rechenschaftspflicht der FINMA wird deutlich erhöht. Sie informiert gestützt auf die Grundsätze der Einfachheit, Transparenz und Nachvollziehbarkeit die Öffentlichkeit über die Eröffnung und Zwischenergebnisse von Aufsichtshandlungen und Verfahren, wie das für Schwesterbehörden in den USA, UK usw. selbstverständlich ist. Zudem wird die FINMA dem Bundesgesetz über das Öffentlichkeitsprinzip der Verwaltung (BGÖ) unterstellt.</p><p>6. Gestützt auf das Proportionalitätsprinzip wird die aufsichtsrechtlich bedingte administrative Belastung von kleineren Banken, die weder systemrelevant noch besonders risikobehaftet sind, deutlich gesenkt.</p>",NA,NA
22.494,1,2022-12-15,"Sofort ein Halbtaxabo für Rentnerinnen und Rentner, Jugendliche unter 25 Jahren und Arbeitslose!","Mit dieser parlamentarischen Initiative soll Artikel 81a Absatz 2 der Bundesverfassung so geändert werden, dass Nutzerinnen und Nutzer, die jünger als 25 sind, die das ordentliche Rentenalter erreicht haben oder die arbeitslos sind, ein Halbtax-Abo erhalten:
BV Artikel 81a Absatz 2: Die von den Nutzerinnen und Nutzern bezahlten Preise für den öffentlichen Verkehr stellen einen starken Anreiz dar. Personen, die das ordentliche Rentenalter erreicht haben, Personen, die das 25. Lebensjahr noch nicht vollendet haben, und Personen, die Arbeitslosenentschädigung beziehen, erhalten ein Halbtax-Abonnement. // Mit der parlamentarischen Initiative 22.411 ""Fördern wir die Gratisbenützung öffentlicher Verkehrsmittel auf Gemeinde- oder Kantonsebene"", die ich im vergangenen Juni eingereicht hatte, verlangte ich eine Änderung der Bundesverfassung, um Kantonen und Gemeinden zu ermöglichen, unentgeltliche Leistungen anzubieten. Die Mehrheit der Kommission für Verkehr und Fernmeldewesen (KVF) hat darauf hingewiesen, Vergünstigungen bestünden bereits oder seien für bestimmte Bevölkerungskategorien wie die jungen Leute in Planung. Diese Zielgruppe ist namentlich im Visier der vorliegenden parlamentarischen Initiative. Dank der Abgabe eines Halbtax-Abos kann diese Bevölkerungsgruppe Mobilitätsgewohnheiten verfestigen, die sowohl ökologisch als auch ökonomisch vorteilhaft sind. Diese Massnahme erlaubt es Rentnerinnen und Rentnern, kostengünstiger zu reisen, und hilft denjenigen, die es können, auf das Auto zu verzichten. Arbeitslose schliesslich, die sich oft unter Androhung von Sanktionen gezwungen sehen, eine Stelle anzunehmen, die sich nicht unbedingt in ihrer Wohngemeinde befindet, könnten ihre Reisekosten auf der Suche nach einer Stelle und ganz allgemein ihrer Lebenshaltungskosten in einer Zeit, in der sie über weniger Einkommen verfügen, dank der Abgabe eines Halbtax-Abonnements verringern.
Der Klimanotstand zwingt uns, im Bereich der Mobilität ambitionierte Massnahmen zu treffen, im Wissen darum, dass gegen 40 Prozent der gesamten Treibhausgasemissionen der Schweiz auf den Verkehrssektor und drei Viertel davon auf den motorisierten Individualverkehr zurückzuführen sind.
Die Kosten für die automatische Abgabe eines Halbtax-Abonnements an diese drei Bevölkerungsgruppen würden sich jährlich auf höchstens 420 Millionen belaufen und damit einem Fünfzehntel der Ausgaben für Eisenbahn- und Strassenverkehr entsprechen. Sie entsprechen auch ungefähr den Einnahmen aus dem Verkauf von Halbtax-Abonnements im Jahr 2022. Diese schlagen mit rund 500 Millionen zu Buche. Diese Schätzung berücksichtigt die Personen nicht, die bereits ein solches Abonnement besitzen und daher in den Berechnungen doppelt gezählt werden.",added,NA
23.3159,5,2023-03-15,Einbezug des Arbeitspensums bei der Vergabe von Prämienverbilligungen,"1. Wie beurteilt der Bundesrat die Berücksichtigung des Beschäftigungsgrads/von Steuerabzügen bei Prämienverbilligungen, insbesondere mit Blick auf Bedarfsgerechtigkeit und Anreizwirkungen auf dem Arbeitsmarkt? Welche Kantone haben eine entsprechende Regelung und wie sind die Erfahrungen?
2. Gibt es weitere Sozialleistungen, bei denen der Beschäftigungsgrad bei der Ermittlung der Anspruchsberechtigung in die Berechnung miteinbezogen wird oder werden könnte?
3. Sieht der Bundesrat eine Möglichkeit für einen Kriterienkatalog, der eine Umsetzung praktikabel macht (Berücksichtigung Betreuungssituationen und andere berechtigte Gründe einer selbst gewählten Pensumsreduktion)?
4. Wie hoch wäre das Einsparpotential, wenn Arbeitspensum oder hohe Steuerabzüge beim Vergabeentscheid von Prämienverbilligungen miteinbezogen würden?
5. Wie könnte nach Ansicht des Bundesrats ein Systemwechsel ausgestaltet werden? // Ziel von Prämienverbilligungen bei den Krankenkassen ist es, Versicherte in bescheidenen wirtschaftlichen Verhältnissen durch Bundes- und Kantonsbeiträge zu entlasten. Der Anspruch dafür ist auf Bundesebene geregelt.
Das KVG schreibt vor, dass die Kantone Versicherten in bescheidenen wirtschaftlichen Verhältnissen Verbilligungen für die KK-Prämien gewähren müssen. Die Kantone haben dabei weitgehende Kompetenzen, die Prämienverbilligung für ihre versicherte Bevölkerung zu regeln. Deshalb sind die Bedingungen für den Erhalt der Prämienverbilligung (Einkommens- und Vermögensgrenzen), die Höhe und die Art der Auszahlung der Prämienverbilligung (automatisch oder auf Antrag, Frist) je nach Wohnkanton verschieden.
Grundsätzlich jedoch wird dabei keine Rücksicht auf freiwilligen Arbeitsverzicht genommen. Es kommt deshalb vor, dass Personen mit mittlerem oder gar hohem Lohnniveau aufgrund einer freiwilligen Reduktion des Arbeitspensums oder steuerlich abziehbaren Investitionen in den Genuss von Prämienverbilligungen kommen.
In gewissen Kantonen wurde ein Einbezug der Stellenprozente bei der Vergabe von Prämienverbilligungen bereits diskutiert. In BS gibt es sogar bereits eine Regelung: Ein hypothetisches Einkommen wird angerechnet, wenn Haushaltsmitglieder in geringerem Umfang erwerbstätig sind, als allgemein zumutbar erscheint.
Bei einer Anpassung dieses Systems müsste berücksichtigt werden, ob ein Teilzeitpensum mit einer Betreuungssituation oder anderweitigen Gründen erklärt werden kann. Ist dem nicht der Fall, führen die Prämienverbilligungen zu negativen Erwerbsanreizen. Das ist gerade aufgrund des teilweise akuten Fachkräftemangels stossend und volkswirtschaftlich schädlich. Zudem werden dem System damit Mittel entzogen, welche für tatsächlich unterstützungsbedürftige Personen fehlt.",NA,added
23.418,8,2023-03-16,Nationalbankgewinne für den Schuldenabbau nutzen,"<p>Entsprechende gesetzliche Grundlagen sind so anzupassen, dass allfällige Gewinne der Nationalbank zuhanden des Bundes ausschliesslich für den Schuldenabbau eingesetzt werden dürfen. Ausnahmen sind im Gesetz zu regeln.</p><p>Nationalbankgewinne dürfen nicht als selbstverständlich angesehen werden. Deshalb sollen sie auch nicht mehr wie bis anhin direkt in den Bundeshaushalt fliessen, sondern sollen für den Schuldenabbau eingesetzt werden müssen. So wird verhindert, dass Budgets erstellt werden, die zu hoch veranschlagt sind, weil angenommen wird, die Nationalbankgewinne seien etwas Gottgegebenes. Mit der Umsetzung dieses Vorstosses verhindern wir böse Überraschungen und Defizite. Denn die Schweizerische Nationalbank hat 2022 einen Verlust von 132 Milliarden Franken gemacht und die Gewinnausschüttungen an den Bund und die Kantone ausgesetzt. Viele Akteure sind erschrocken. Auch 2023 dürften keine Gewinne ausgeschüttet werden. Wir dürfen also nicht mit diesem Geldsegen rechnen. Wenn er trotzdem kommt, soll er zum Schuldenabbau beitragen, was zukünftige Generationen entlastet und die Handlungsfreiheit der Schweiz stärkt für Krisen und Unvorhergesehenes.</p>",NA,NA
23.3118,NA,2023-03-13,Keine Berufs- und höheren Fachprüfungen auf Englisch im Berufsfeld der ICT. Eine Ungleichbehandlung durch den Bund?,"<p>Gemäss SBFI können nach Artikel 70 der Bundesverfassung Berufsprüfungen und Höhere Fachprüfungen im Berufsfeld ICT nicht in Englisch durchgeführt werden. Da aber in manchen Bereichen der Hochschulen sowie der Höheren Fachschulen Englisch als Unterrichts- und Prüfungssprache akzeptiert wird, führt dies zu einer Ungleichbehandlung der Berufs- und Höheren Fachprüfungen gegenüber den Hochschulen und Höheren Fachschulen. Und gerade weil im Berufsfeld der ICT Englisch die Berufssprache ist, werden durch diese Verweigerung dringend gebrauchte Fachkräfte verwehrt. Ich bitte deshalb den BR um die Beantwortung folgender Fragen:</p><p>1. Ist sich der BR dieser Ungleichbehandlung bewusst?</p><p>2. Wäre der BR bereit, die Möglichkeit der Durchführung von Berufs- und Höheren Fachprüfungen in englischer Sprache zu prüfen?</p><p>2a. Wenn ja, welche Massnahmen plant der BR, um sicherzustellen, dass bei den eidgenössischen Berufsprüfungen und Höheren Fachprüfungen im Berufsfeld der ICT die Verwendung von Englisch künftig ermöglicht wird?</p><p>3. Warum ist es möglich, dass an den Hochschulen und den Höheren Fachschulen Unterricht und Prüfungen in Englisch erfolgen können, aber nicht bei den eidgenössischen Berufsprüfungen und Höheren Fachprüfungen?</p><p>4. Was unternimmt die Regierung, um die Gleichbehandlung der Tertiärstufe A (Hochschulbildung) und B (Höhere Berufsbildung), in Bezug auf die Sprachlichkeit in der Ausbildung und Prüfung sicher zu stellen?</p><p>Gemäss Artikel 41 der Bundesverfassung (BV) haben alle Personen Anspruch auf Bildung. Die BV sieht eine Gleichbehandlung der Tertiärstufe A (Hochschulbildung) und B (Höhere Berufsbildung) vor. Beide Wege bilden Personen aus, die im Arbeitsleben tätig sind und dazu beitragen, dass die Schweiz wirtschaftlich und gesellschaftlich erfolgreich bleibt. Zudem sieht das Berufsbildungsgesetz (BBG) vor, dass die Höhere Berufsbildung eng mit der Hochschulbildung verbunden ist und sie zusammen ein integriertes Bildungssystem bilden. Das BBG sieht vor, das das Berufsbildungssystem den Einzelnen die Fähigkeit und die Bereitschaft vermittelt, beruflich flexibel zu sein und in der Arbeitswelt zu bestehen. Dafür ist gerade im Berufsfeld der ICT die Englische Unterrichts- und Prüfungssprache zwingend notwendig.</p><p>Trotzdem dürfen gemäss SBFI ganze Berufsprüfungen und Höhere Fachprüfungen im Berufsfeld ICT nicht in Englisch durchgeführt werden, da dies im Artikel 70 BV nicht explizit aufgeführt ist (Primat der Landessprachen). Das führt zu einer Ungleichbehandlung der Berufs- und Höheren Fachprüfungen gegenüber den Hochschulen: Auch im Hochschulgesetz ist die Zulassung von Englisch als Unterrichts- und Prüfungssprache nicht explizit festgeschrieben, es gibt jedoch bestimmte Fachbereiche auf Tertiärstufe A, u.a. die Informatik, in denen Englisch als Unterrichtssprache üblicherweise akzeptiert wird. An den Höheren Fachschulen wird in manchen Bereichen Englisch als Unterrichts- und Prüfungssprache ebenfalls akzeptiert. Gemäss Artikel 14 Absatz 1 MiVo-HF können die kantonalen Bewilligungsbehörden für die Höheren Fachschulen die Verwendung von Unterrichts- und Prüfungssprachen zulassen, die für die Ausübung des betreffenden Berufs erforderlich sind oder für eine internationale Ausrichtung des Studiengangs notwendig sind. Im BBG ist die Englische Unterrichts- und Prüfungssprache für die Höheren Fachschulen ebenfalls nicht explizit erwähnt. Demnach ist auch bei den Höheren Fachschulen eine Ungleichbehandlung gegenüber den Berufs- und Höheren Fachprüfungen festzustellen.</p><p>Gerade im Bereich ICT, wo die Berufssprache Englisch zentral ist und der Fachkräftemangel besonders akut ist, dürfte diese Ungleichbehandlung vielen ICT-Fachkräften den Zugang zu einem Abschluss verwehren. Dies wirkt sich negativ auf die Wertschöpfung der Schweiz aus.</p>",NA,NA
23.35,8,2023-04-24,Gesetzliche Grundlagen für die Leistungen der Psychologinnen und Psychologen in Weiterbildung,"Zur Klärung der Weiterbildung in der Krankenpflege-Leistungsverordnung (KLV) wird der Bundesrat beauftragt, die Rechtsgrundlage so anzupassen, dass z. B. Artikel 11b um einen Absatz 5 ergänzt wird, der wie folgt lauten könnte:
""Leistungen, die während der Dauer des Erwerbs der klinischen Erfahrung im Sinne von Artikel 50c Buchstabe b KVV erbracht werden, sind den Leistungen nach Absatz 1 gleichgestellt. Die Leistungen werden der Versicherung von der für die klinische Praxis verantwortlichen Betreuungsperson oder Institution in Rechnung gestellt.""

//

Jahrelang wurden die Leistungen von Assistenzärztinnen und -ärzten und von Assistenzpsychotherapeutinnen und -therapeuten im ambulanten Bereich von der für die klinische Praxis verantwortlichen Betreuungsperson in Rechnung gestellt. Seit der Einführung des Anordnungsmodells weigert sich Santésuisse mit Verweis auf die unklaren Rechtsgrundlagen, die Leistungen von Assistenzpsychotherapeutinnen und -therapeuten zu bezahlen.
Santésuisse stellt damit nicht nur die Abrechnung von Assistenzpsychotherapeutinnen und -therapeuten infrage, sondern das gesamte Weiterbildungssystem - auch jenes von Ärztinnen und Ärzten -, da der Grundsatz der Rechnungsstellung für beide Berufsgruppen gilt. Die Assistenzärztinnen und -ärzten wie auch die Assistenzpsychotherapeutinnen und -therapeuten sind unerlässlich für das Funktionieren des Schweizer Gesundheitswesens, das permanent unter Druck steht - insbesondere wegen Covid und der schweren und anhaltenden psychischen Störungen, welche die Pandemie bei zahlreichen Personen ausgelöst hat. Im psychiatrischen Ambulatorium beispielsweise stellen Assistenzpsychotherapeutinnen und -therapeuten die Hälfte der Belegschaft.
Die Ablehnung der Kostenübernahme hat auch unmittelbare Folgen: Obschon der Mangel an Psychotherapieplätzen für Kinder und Jugendliche und an manchen Orten auch für Erwachsene akut ist, wurde Assistenzpersonal entlassen, da es nicht bezahlt werden konnte. Schätzungen zufolge unterbrachen mehrere Tausend Patientinnen und Patienten deshalb ihre Therapien und nicht alle von ihnen konnten eine neue Lösung für die Fortsetzung ihrer Therapie finden. Dies wirkt sich auch auf die Spitalambulatorien aus.",NA,added
23.312,4,2023-03-13,Umweltverträglichkeit um Klimaschutz und Bodenverbrauchsschutz ergänzen,"<p>Der Bundesrat wird beauftragt, gesetzliche Grundlagen zu schaffen um die Klimaschutzziele und die Reduzierung des Bodenverbrauchs in der Umweltverträglichkeitsprüfung zu ergänzen und damit neu auch eine Klima- und Biodiversitätsverträglichkeitsprüfung zu machen. Dabei ist auf einen effizienten Vollzug (Bund, Kantone, Gemeinden) zu achten.</p><p>Der heutige Artikel 3 Absatz 1 UVPV (Verordnung über die Umweltverträglichkeitsprüfung) hält den Zweck der UVP und die im Rahmen der UVP zu prüfenden Umweltvorschriften wie folgt fest: \""Bei der Prüfung wird festgestellt, ob das Projekt den Vorschriften über den Schutz der Umwelt entspricht. Dazu gehören gemäss Artikel 3 Absatz 1 UVPV das USG und die Vorschriften, die den Natur- und Heimatschutz, den Landschaftsschutz, den Gewässerschutz, die Walderhaltung, die Jagd, die Fischerei und die Gentechnik betreffen\"". Diese Aufzählung ist zwar nicht abschliessend. Da das CO2-Gesetz auch Umweltrecht darstellt, ist das Klima mitgemeint und wäre ebenfalls in der UVP zu prüfen. In solchen Fällen wäre das Ausweisen der Klimawirkungen nötig, ebenso wie das Aufzeigen von Massnahmen zur Einhaltung von materiellen Vorschriften. Es gibt heute aber keine Anlagen, für die solche spezifischen Vorschriften bestehen. Entsprechend werden die Auswirkungen einer Anlage auf das Klima bis heute nicht systematisch untersucht. Dies hält der Bericht des Bundesrates: Klimatische Auswirkungen bei der UVP berücksichtigen</p><p>in Erfüllung des Postulates 20.3001 der UREK-N fest. </p><p>Der Bericht kommt zu folgendem Zwischenfazit: \""Das geltende Recht sieht heute die Prüfung von Klimawirkungen von Anlagen im Rahmen der UVP nicht vor. Auch ist die heutige Klimagesetzgebung nicht darauf ausgerichtet, dass bei der Planung und beim Bau einer Anlage schon geprüft und verlangt wird, dass die Anlage möglichst wenig Treibhausgase emittiert\"". Er hält aber fest: \""Die UVP könnte mit einer systematischen, auf das Netto-Null-Ziel ausgerichteten Betrachtung der Klimawirkungen durchaus einen Beitrag zur Reduktion der Treibhausgasemissionen leisten\"".</p><p>Das Thema Einbezug des Klimaschutzes in die Umweltverträglichkeit ist auch innerhalb der EU ein Thema. Im Jahr 2014 hat die EU ihre Bestimmungen zur UVP angepasst und das Klima in die Liste der zu untersuchenden Schutzgüter aufgenommen. Sie verlangt dort ebenfalls das Ausweisen der Klimawirkungen des Vorhabens. Diese Vorgabe haben die Mitgliedstaaten unterschiedlich in ihre nationalen Gesetzgebungen überführt. März 2023 der Nationalrat eine entsprechende Novelle des Umweltverträglichkeitsprüfungsgesetzes beschlossen, welche neben dem Klimaschutz auch den Bodenschutz stärker gewichtet.</p><p><a href=\""https://www.parlament.gv.at/gegenstand/XXVII/ME/220\"">https://www.parlament.gv.at/gegenstand/XXVII/ME/220</a></p>",NA,NA
23.333,9,2023-03-16,Verwendung der AHV-Nummer durch den Lebensversicherer,"<p>Der Bundesrat wird beauftragt, die gesetzlichen Grundlagen anzupassen, um eine systematische Verwendung der AHV-Nummer durch die Lebensversicherer zu ermöglichen. Dies ist notwendig, nachdem das Verrechnungssteuergesetz (VStG) angepasst wurde betreffend Meldungen der AHV-Nummer über Lebensversicherungsleistungen an inländische natürliche Personen.</p><p>Am 18. Juni 2021 hat das Parlament das Bundesgesetz über elektronische Verfahren im Steuerbereich angenommen. Diese Vorlage sieht insbesondere eine Anpassung des Verrechnungssteuergesetzes (VStG) vor. Gemäss neuen Art. 38 VStG ist bei Meldungen über Lebensversicherungsleistungen an inländische natürliche Personen deren AHV-Nummer anzugeben. Diese Änderung sieht ebenfalls vor, dass inländische natürliche Personen ihre AHV-Nummer bekanntgeben müssen. Februar 2023 bzw. September 2022 in Kraft getreten.</p><p>Diese gesetzlichen Bestimmungen reichen aber nicht aus, um es den Lebensversicherer zu erlauben, die AHV-Nummer systematisch zu verwenden, d.h. sie in einer Datenbank zu erfassen, damit sie dort dauerhaft gespeichert wird. Eine Anpassung von Artikel 153c AHVG ist hierzu notwendig. Die systematische Verwendung der AHV-Nummer muss nämlich in einem Spezialgesetz vorgesehen werden. Im vorliegenden Fall handelt es sich im Rahmen des VStG um einen einfachen Informationsaustausch, welcher die AHV-Nummer als Identifikator enthält.</p><p>Die Möglichkeit, die AHV-Nummer zu verwenden, würde in erster Linie eine Erleichterung für die Kunden bedeuten. Die Formulare, welche im Leistungsfall ausgefüllt werden müssen, würden entsprechend kürzer ausfallen. Zudem kann so eine bessere Koordination zwischen den Sozialversicherungen, insbesondere im Bereich der Vorsorge gewährleistet werden. Selbstverständlich sind dabei die üblichen Datenschutzmassnahmen einzuhalten.</p>",NA,NA
