bill,classification,submission_date,bill_title,bill_text,"Notes (added = title, text, date added)",Notes
23.3198,1,2023-03-16,"Sensibilisierungskampagne und Aus- und Weiterbildung zum Thema \""Umwelt und Gesundheit\""","<p>Der Bund entwickelt zusammen mit Akteur*innen des Gesundheitswesens </p><p>- eine Informationskampagne zur Sensibilisierung der Bevölkerung</p><p>- ein Aus- und Weiterbildungsmodul für Fachpersonen über den Zusammenhang zwischen Umwelt und Gesundheit bzw. menschlichem Wohlbefinden, über die gesundheitlichen Gefahren der Klimaerhitzung, der Umweltverschmutzung bzw. der Abnahme der Biodiversität sowie über die Rolle und die Möglichkeiten des Gesundheitspersonals.</p><p>Die Auswirkungen der Klimaerhitzung und der Umweltverschmutzung sind frappant. Naturkatastrophen, Erdbeben, Tsunamis oder Bergstürze machen die Erde (teilweise) unbewohnbar. Hitzesommer nehmen zu. Die Abnahme der Biodiversität gefährdet einen Grossteil unserer Lebensmittelproduktion. Dies hat Auswirkungen auf die menschliche Gesundheit: Die Klimaerhitzung, die Umweltverschmutzung und der Verlust der Biodiversität gehören heute zu den grössten gesundheitlichen Bedrohungen und stellen die öffentliche Gesundheit vor grosse Herausforderungen.</p><p>Untersuchungen zeigen, dass die Übersterblichkeit im Hitzesommer 2019 schon 3,5 Prozent betrug, bei den Menschen ab 85 gar 6,8 Prozent. Die Luftverschmutzung führt jährlich zu rund 2300 frühzeitigen Todesfällen, 12 000 Fällen von akuter Bronchitis bei Kindern, 2300 Fällen chronischer Bronchitis, 3,6 Millionen Tagen eingeschränkter Aktivität bei Erwachsenen und Kosten von bereits 7 Milliarden Franken. </p><p>Bei steigender Temperatur beginnt die Pollensaison früher, dauert länger und die Wahrscheinlichkeit für ganzjährigen Pollenflug steigt. Die Klimakrise führt zu verstärkter UV-Strahlung, die das Risiko für Hautkrebs und Grauem Star deutlich erhöht. Mit zunehmender Hitze steigt durch neue Übertragungswege auch die Gefahr neuer Krankheiten. Die Zecke, häufig verantwortlich für Borreliose und Hirnhautentzündung, überlebt besser. Pestizidangereicherte Lebensmittel können Allergien auslösen.</p><p>Dies sind einige Beispiele für die Auswirkungen der Umwelt auf die Menschen, die das Gesundheitswesen zusätzlich belasten. Bundesrat und BAG haben bereits Informationen und Verhaltenstipps zum Hitzeschutz erarbeitet. Eine Aufklärungs- und Informationskampagne und spezifische Aus- und Weiterbildungsmodule sollen die Bevölkerung nachhaltig informieren und eine bessere Vorsorge bzw. Sie ermöglichen dem Gesundheitspersonal zudem, eine aktivere Rolle in der Prävention von Krankheiten einzunehmen.</p>",NA,NA
23.3085,NA,2023-03-08,Ergreifung von Massnahmen gemäss Artikel 55 AsylG (Ausnahmesituationen) und Artikel 25 ff. Schengener Grenzkodex,"Der Bundesrat wird beauftragt, gestützt auf Artikel 55 des Asylgesetzes sowie Artikel 25 ff. des Schengener Grenzkodex, unverzüglich die erforderlichen Massnahmen zur Bremsung des Zustroms von Asylsuchenden sowie die Wiedereinführung von Grenzkontrollen an die Hand zu nehmen.
//
Der Schengener Grenzkodex hält in Artikel 29 fest, dass in Fällen, wo ""schwerwiegende Mängel bei Kontrollen an den Aussengrenzen"" festgestellt werden, die Wiedereinführung von Grenzkontrollen an den Binnengrenzen gerechtfertigt ist. Als weitere Gründe werden die ernsthafte Bedrohung der öffentlichen Ordnung oder der inneren Sicherheit festgehalten (Art. 25).
Die steigenden Asylzahlen, aber vor allem auch die hohe Anzahl illegaler Migranten haben direkt mit den Abkommen von Schengen und Dublin zu tun, aufgrund derer die Schweiz ihre Grenzen nicht mehr systematisch kontrollieren darf. Dass die illegale Zuwanderung an der Schengen-Aussengrenze abgewehrt werden kann, hat sich als gefährliche Illusion entpuppt.
Die Kontrollen an der Schengen-Aussengrenze funktionieren erwiesenermassen nicht. Zudem halten sich gewisse EU-Staaten nicht an das Dubliner Abkommen und deklarieren dies auch öffentlich. Von der vielerorts ungeschützten Schengen-Aussengrenze profitieren skrupellose Schlepper und Menschenhändler. Der massive Anstieg von Aufgriffen illegaler Ausländer an den Grenzen spricht Bände: Seit 2020 (11 043 Aufgriffe) bis Ende 2022 (52 077) hat sich diese Zahl nahezu verfünffacht. Auch die Tatsache, dass die meisten illegal Aufgegriffenen aus Afghanistan und Marokko stammen, zeigt: Der Schutz der Schengen-Aussengrenze funktioniert in keiner Weise.
Die Schweiz kommt vor diesem Hintergrund nicht umhin, den Schutz der Grenzen wieder selber an die Hand zu nehmen.",NA,added
23.317,6,2023-03-15,Abbau von Bürokratie bei der Fahrzeugzulassung,"Der Bundesrat wird beauftragt, die Zulassungsvoraussetzungen für aus dem Ausland stammende Personenwagen (PW) und Leichte Nutzfahrzeuge (LNF), die ursprünglich nicht für den Import für die Schweiz oder die EU vorgesehen waren, zu vereinfachen. Die Zulassungsvoraussetzungen bezüglich Insassenschutzes bei Front-, Seitenaufprall und Fussgängerschutz sind in allgemeingültiger Weise festzulegen und damit der Praxis teurer Einzelnachweise ein Ende zu setzen. Es soll davon ausgeangen werden, dass jeder Neuwagen diesen internationalen Richtlinien enspricht. Um die Verkehrssicherheit nicht zu gefährden, wird wie bis anhin ein staatlich beauftragter Prüfungsexperte des Strassenverkehrsamtes vor der Zulassung das Fahrzeug inspizieren. Dieser kann bei begründetem Verdacht auf Nichterfüllung der Sicherheitsvorschriften ein Prüfgutachten einer EU- oder Schweizer-Prüfstelle einverlangen.
//
Die Zulassung von aus dem Ausland stammenden PW und LNF, die nicht nach Schweizer- oder EU-Vorschriften gebaut sind, ist ein bürokratischer Hindernislauf. Die Kosten für die Prüfung eines Einzelfahrzeuges betragen regelmässig tausende von Franken. Die Prüfungen dauern regelmässig Monate. Die zeit-und kostentreibenden Prüfungen verteuern unverhältnismässig die Kosten. Die PW und LNF werden für den globalisierten Weltmarkt nach einheitlichen Standards (insbesondere Front- und Seitenaufprallschutz) produziert. Die sicherheitsrelevanten Merkmale dieser Fahrzeuge entsprechen bereits von Anfang an den EU- und Schweizer-Anforderungen. Gleichwohl verlangen die Strassenverkehrsämter von den Kunden für deren Fahrzeugzulassung systematisch kostenintensive Einzelprüfungen.
Die Weisung des Astra vom 27. Februar 2014 über die Befreiung von der Typengenehmigung betreffend Front- und Seitenaufprallschutz (Art. 104a Abs. 1 VTS) sieht vor, dass entsprechende Nachweise über die Einhaltung der US-Normen (FMVSS) oder der Japan-Normen (JSRRV) anerkannt werden. Bisher sind keine Fälle bekannt, bei denen die anerkannten Schweizer Prüfstellen den Nachweis des Insassen- und Fussgängerschutz nicht als erwiesen erachteten. Es ist empirisch belegt, dass die teuren Einzelnachweise offensichtlich unnötig sind. Gemessen an dem Anteil der durchschnittlich 240 000 Neuzulassungen können so für die zwar nur 0,9 Prozent Importe, die davon betroffen sind, die Aufwände erheblich reduziert werden.",NA,added
23.016,NA,2023-02-22,AHVG. Änderung (Anpassung der Renten an die Teuerung),"Botschaft vom 22. Februar 2023 zur Änderung des Bundesgesetzes über die Alters- und Hinterlassenenversicherung (Anpassung der Renten an die Teuerung)<p><b>Medienmitteilung des Bundesrates vom 22.02.2023</b></p><p><b>Anpassung der AHV/IV-Renten an die volle Teuerung</b></p><p><b>Die AHV/IV-Renten, die Ergänzungsleistungen und die Überbrückungsleistungen sollen zusätzlich zur bereits erfolgten Rentenanpassung erhöht werden, damit die volle Teuerung ausgeglichen wird. Februar 2023 die Botschaft zu einer Änderung des AHV-Gesetzes verabschiedet. Damit erfüllt er den Willen des Parlaments, die Kaufkraft der rentenbeziehenden Personen zu stärken.</b></p><p>Der Bundesrat passt die ordentlichen AHV/IV-Renten in der Regel alle zwei Jahre an die Preis- und Lohnentwicklung an, wobei jeweils auf das arithmetische Mittel zwischen dem Preis- und dem Lohnindex (Mischindex) abgestützt wird. Die letzte Anpassung erfolgte per 1. Januar 2023 mit einer Erhöhung der Minimalrente um 30 Franken und der Maximalrente um 60 Franken (bei voller Beitragsdauer). Weil der Preisindex im Jahr 2022 ausnahmsweise mehr anstieg als der Lohnindex, hatte die Anpassung nach dem Mischindex zur Folge, dass die Renten um 2,5 Prozent angehoben wurden, während die Teuerung in diesem Jahr 2,8 Prozent betrug. Die Rentenanpassung vermochte die Teuerung also nicht vollständig auszugleichen. In Erfüllung einer Motion hat der Bundesrat nun eine Änderung des AHV-Gesetzes zuhanden des Parlaments verabschiedet. Sie sieht eine zusätzliche, ausserordentliche Rentenanpassung vor, so dass die Teuerung vollumfänglich ausgeglichen wird.</p><p></p><p>Vorgesehene Umsetzung der Teuerungsanpassung</p><p>Die zuhanden des Parlaments verabschiedete befristete Änderung des AHV-Gesetzes sieht eine einmalige Anpassung der Alters- und Hinterlassenenrenten vor. Diese Anpassung gilt auch für die Renten der IV. Für diese ausserordentliche Erhöhung wird nur der Preisanstieg, nicht aber das Lohnwachstum berücksichtigt. So werden die Renten um die mit der ordentlichen Rentenanpassung per 1. Januar 2023 nicht ausgeglichene Teuerung erhöht. Für den Fall, dass die Gesetzesänderung in der Frühlingssession 2023 vom Parlament verabschiedet wird, könnte der Teuerungsausgleich frühestens per 1. Juli 2023 umgesetzt werden. Die zusätzliche Rentenerhöhung soll ab dann ausbezahlt werden. Sie soll so berechnet sein, dass sie auch die bereits vergangenen Monate Januar bis Juni 2023 kompensiert.</p><p></p><p>Berechnung der angepassten Renten</p><p>Für die Berechnung der neuen Renten wird auf die Teuerung des Jahres 2022 abgestellt, welche sich auf 2,8 Prozent belief. Die Differenz zur bereits vorgenommenen Rentenerhöhung um 2,5 Prozent beträgt 0,3 Prozentpunkte. Die darauf gestützten Berechnungen ergeben eine Erhöhung der monatlichen Minimalrente um 5 Franken. Für den Fall, dass die Änderung per 1. Juli 2023 in Kraft tritt, umfasst die Teuerungsanpassung eine zusätzliche Erhöhung um 2 Franken, um auch die Monate Januar bis Juni 2023 zu berücksichtigen. Insgesamt wird damit die Minimalrente um 7 Franken von 1225 auf 1232 Franken erhöht, die Maximalrente entsprechend um 14 Franken von 2450 auf 2464 Franken (Beträge bei voller Beitragsdauer). Diese ausserordentliche Anpassung der Renten an die Teuerung ändert den Rhythmus der ordentlichen Rentenanpassungen unter Berücksichtigung des Mischindexes nicht. Januar 2025 vorgenommen wird.</p><p></p><p>Anpassung auch der Ergänzungs- und Überbrückungsleistungen</p><p>Die Beträge für den allgemeinen Lebensbedarf, die bei der Berechnung der Ergänzungsleistungen und der Überbrückungsleistungen berücksichtigt werden, sollen um denselben Prozentsatz erhöht werden wie die Renten. Diese Beträge werden auf Verordnungsebene angepasst. Entsprechend angepasst werden ebenfalls weitere Leistungen der AHV und IV, die direkt auf der Basis der AHV-Minimalrente berechnet werden. Hingegen werden die Grenzbeträge in der beruflichen Vorsorge sowie die Beiträge von Selbständigerwerbenden und Nichterwerbstätigen an die AHV, IV und EO nicht verändert.</p><p></p><p>Kosten der höheren Leistungen</p><p>Die vorgesehene zusätzliche Erhöhung der Renten über die ordentliche Rentenanpassung hinaus führt in den Jahren 2023 und 2024 zu Mehrkosten für die AHV von insgesamt 418 Millionen Franken. Der Bund beteiligt sich grundsätzlich jährlich mit einem Beitrag in der Höhe von 20,2 Prozent an den Ausgaben der AHV. Diese zusätzliche Erhöhung der Renten soll jedoch ausnahmsweise nicht durch den Bund mitfinanziert werden. Die IV trägt Mehrausgaben von insgesamt 54 Millionen Franken. Die Anpassung der Ergänzungsleistungen zur AHV und IV verursacht zusätzliche Kosten von rund 2,5 Millionen Franken zulasten des Bundes und 0,9 Millionen Franken für die Kantone.</p><p>SDA-Meldung</p><p><b>Debatte im Ständerat, 02.03.2023</b></p><p><b>Parlament beerdigt vollen Teuerungsausgleich bei der AHV</b></p><p><b>AHV-Rentnerinnen und -Rentner erhalten in diesem Jahr definitiv keinen vollen Teuerungsausgleich. Nach dem National- hat es am Donnerstag auch der Ständerat abgelehnt, auf eine entsprechende Umsetzungsvorlage einzutreten.</b></p><p>Die kleine Kammer fällte ihren Entscheid äusserst knapp mit 21 zu 20 Stimmen bei einer Enthaltung. Sie folgte damit einer knappen Minderheit der Kommission für soziale Sicherheit und Gesundheit (SGK-S).</p><p>Mit dem Entscheid ist die Änderung des AHV-Gesetzes vom Tisch. Der Nationalrat hatte es bereits am Mittwoch abgelehnt, auf die Vorlage einzutreten.</p><p>Konkret ging es darum, ob zur im Januar vom Bundesrat vorgenommenen Rentenerhöhung um 2,5 Prozent weitere 0,3 Prozentpunkte dazukommen sollten. Die Mehrkosten für die Jahre 2023 und 2024 hätten 418 Millionen Franken betragen. Sie sollten nach dem Willen des Bundesrats ausnahmsweise nicht durch den Bund mitfinanziert werden.</p><p>Der vorgesehene Betrag sei für Bezügerinnen und Bezüger einer Minimalrente keineswegs unerheblich, argumentierte Kommissionssprecher Erich Ettlin (Mitte/OW) namens der Kommissionsmehrheit vergeblich.</p><p></p><p>Kritik an \""Mikrogesetzgebung\""</p><p>Auch Marina Carobbio Guscetti (SP/TI) sah Handlungsbedarf. Für Rentnerinnen und Rentner mit geringen Einkommen sei die bereits erfolgte Erhöhung angesichts steigender Krankenkassenprämien und Miet-Nebenkosten nicht ausreichend. Dies auch, weil die Teuerung im laufenden Jahr darin noch gar nicht berücksichtigt sei.</p><p>Carobbio Guscetti warnte vor einem massiven Kaufkraftverlust für Rentnerinnen und Rentner. Der Schweizerische Gewerkschaftsbund (SGB) schätzt diesen für einen durchschnittlichen Rentenhaushalt auf rund acht Prozent bis Ende 2024.</p><p>Alex Kuprecht (SVP/SZ) sprach dagegen von einer \""Mikrogesetzgebung\"". Es gehe bei der Minimalrente um gerade mal 25 Rappen pro Tag. Dafür sei der administrative Aufwand unverhältnismässig. Im Wesentlichen sei die Teuerung durch die bereits erfolgte Rentenerhöhung im Januar schon ausgeglichen.</p><p>Auch Josef Dittli (FDP/UR) wollte nicht am bestehenden System schrauben. In den vergangenen Jahren mit Negativteuerung hätten Rentnerinnen und Rentner davon profitiert. Nach einer Rentensenkung habe damals niemand gerufen.</p><p></p><p>Eine Kehrtwende</p><p>Mit der Umsetzungsvorlage erfüllte der Bundesrat einen Auftrag beider Räte - obwohl er sich ursprünglich gegen das Vorhaben gestellt hatte.</p><p>Durch die zusätzliche Rentenerhöhung hätten Bezügerinnen und Bezüger einer Minimalrente sieben Franken mehr im Monat erhalten. Bei der Maximalrente hätte es 14 Franken mehr gegeben.</p><p>Die Entscheide von National- und Ständerat bedeuten eine Kehrtwende. In Sonderdebatten zur Kaufkraft im September hatten sich beide Räte dafür ausgesprochen, die Teuerung bei AHV- und IV-Renten sowie Ergänzungsleistungen voll auszugleichen. Die Diskussion stand damals insbesondere unter dem Eindruck der wirtschaftlichen Folgen des Ukraine-Kriegs.</p><p>Damals hatte sich eine Allianz aus Mitte-Partei, SP und Grünen durchgesetzt. Als es an die Umsetzung der Idee ging, war dies nun auch im Ständerat nicht mehr der Fall. Dies, obwohl die drei Parteien dort eine Mehrheit haben.</p><p>Der volle Teuerungsausgleich bei der AHV war eine von zwei Forderungen zum Thema Kaufkraft, die SP und Mitte in den Sonderdebatten im Herbst 2022 gemeinsam in den beiden Räten eingebracht hatten.</p><p>Das zweite Vorhaben, die vorübergehende Erhöhung des Bundesbeitrags an die Verbilligung der Krankenkassenprämien um 30 Prozent, war schon in der Wintersession definitiv gescheitert, da sich im Ständerat keine Mehrheit dafür fand.</p><p>SDA-Meldung</p><p><b>Debatte im Nationalrat, 01.03.2023</b></p><p><b>Nationalrat vollzieht Kehrtwende bei AHV-Teuerungsausgleich</b></p><p><b>Der Nationalrat will nichts mehr wissen von einem vollen Teuerungsausgleich bei den AHV-Renten in diesem Jahr. Er hat es am Mittwoch abgelehnt, auf eine Umsetzungsvorlage einzutreten. In der Herbstsession hatte er einer Motion mit dem selben Anliegen noch zugestimmt.</b></p><p>Die grosse Kammer fällte ihren Entscheid mit 97 zu 92 Stimmen bei einer Enthaltung. Sie folgte damit dem Antrag einer knappen Mehrheit ihrer Kommission für soziale Sicherheit und Gesundheit (SGK-N). Das Geschäft geht an den Ständerat.</p><p>Gegen die zusätzliche Rentenerhöhung stellten sich neben FDP und SVP auch die Grünliberalen. Die AHV sei heute schon finanziell belastet, begründete Kommissionssprecher Philippe Nantermod (FDP/VS) die Haltung der Kommissionsmehrheit.</p><p>Heute orientiert sich der Bund bei der Festlegung der AHV-Renten am sogenannten Mischindex. Dieser basiert zur Hälfte auf der Teuerung und zur Hälfte auf der Lohnentwicklung.</p><p></p><p>\""Massiver Kaufkraftverlust\""</p><p>Es gehe um einen Ausgleich der Teuerung für die Ärmsten im Land, widersprach Christian Lohr (Mitte/TG). Man müsse jenen helfen, die sich nicht selbst gegen die aktuelle Entwicklung wehren könnten.</p><p>Lohr räumte aber ein, über die Finanzierung des Vorhabens müsse zu einem späteren Zeitpunkt nochmals diskutiert werden. Die zusätzliche Rentenerhöhung kostet insgesamt 418 Millionen Franken für die Jahre 2023 und 2024. Die Mehrkosten sollen nach dem Willen des Bundesrats ausnahmsweise nicht durch den Bund mitfinanziert werden.</p><p>SP-Co-Präsidentin Mattea Meyer (ZH) sagte namens ihrer Fraktion, Rentnerinnen und Rentner erlitten einen massiven Kaufkraftverlust - insbesondere wegen des Anstiegs der Krankenkassenprämien und der Miet-Nebenkosten. Dagegen untätig zu bleiben, sei volkswirtschaftlich Unsinn.</p><p></p><p>FDP sieht Wahlkampf-Manöver</p><p>Regine Sauter (FDP/ZH) kritisierte dagegen die zusätzliche Rentenerhöhung als Wahlkampf-Manöver. Zudem sei das Vorhaben unfair. Familien erhielten nichts, während auch profitiere, wer bei der AHV eine Maximalrente beziehe.</p><p>Für Nichteintreten war auch die SVP. Der Bundesrat habe mit der jüngsten Rentenerhöhung bereits auf die aktuellen Entwicklungen reagiert. Bereits im Januar hatte die Landesregierung die Renten um 2,5 Prozent erhöht. In der Debatte am Mittwoch ging es lediglich noch darum, ob weitere 0,3 Prozentpunkte dazukommen sollen.</p><p>Konkret würde dies eine Erhöhung um fünf Franken im Monat für die Minimalrente und von zwölf Franken für die Maximalrente bedeuten. Ausbezahlt werden kann die zusätzliche Rentenerhöhung frühestens per Anfang Juli. Sie würde so berechnet, dass auch die bereits vergangenen Monate Januar bis Juni kompensiert werden. Dafür würden zusätzliche zwei Franken monatlich ausbezahlt.</p><p>Melanie Mettler (GLP/BE) kritisierte das ganze Vorhaben als zu ungezielt. Gerade bei den Rentnerinnen und Rentnern sei die Ungleichheit sehr gross.</p><p>Katharina Prelicz-Huber (ZH) widersprach namens der Fraktion der Grünen, die AHV sei mit ihrem Umlageverfahren das gerechteste Sozialwerk der Schweiz. Das eigentliche Problem bestehe darin, dass selbst die Maximalrente kaum existenzsichernd sei.</p><p></p><p>Im Herbst gab es noch ein Ja</p><p>Noch im September hatte eine Fraktionsmotion der Mitte für den vollen Teuerungsausgleich im Nationalrat eine knappe Mehrheit gefunden. Damals setze sich eine Allianz von SP, Grünen und Mitte-Partei durch - während es auf der Gegnerseite Abwesenheiten gab.</p><p>Wenige Tage später hiess auch der Ständerat zwei inhaltlich gleichlautende Vorstösse gut. In der Wintersession stimmte er zudem der Motion aus dem Nationalrat zu und bekräftigte damit seine Haltung.</p><p>Nun wird sich die kleine Kammer am Donnerstag ein drittes Mal mit dem Thema befassen. Dann steht dort die Beratung der Umsetzungsvorlage des Bundesrats auf dem Programm. Anders als im Nationalrat haben im Ständerat SP, Grüne und Mitte-Partei zusammen eine Mehrheit.</p><p><b></b></p>",NA,NA
23.3069,8,2023-03-08,Digital Markets Act für die Schweiz,"<p>Der Bundesrat wird beauftragt, die nötigen Gesetzesanpassungen vorzuschlagen, um die wesentlichen Ziele des europäischen Digital Markets Act (DMA) in der Schweiz umzusetzen - und zwar in jenen Bereichen, in denen die europäische Regulierung nicht automatisch greift. Er achtet dabei auf eine möglichst grosse Kompatibilität mit dem europäischen Recht.</p><p>Das Gesetz der Europäischen Union (EU) über digitale Märkte (Digital Markets Act, DMA) ergänzt das europäische Wettbewerbsrecht, beschränkt die Macht der als \""Gatekeeper\"" bezeichneten marktbeherrschenden Digitalkonzerne im Interesse eines fairen Wettbewerbs und schafft einheitliche Rahmenbedingungen im gesamten EU-Binnenmarkt.</p><p>Diesen \""Gatekeepern\"" werden besondere Verhaltenspflichten auferlegt. Dabei geht es um Selbstbegünstigungsverbote, Regelungen zur Datennutzung und zur Dateninteroperabilität bis hin zu Diskriminierungsverboten und fairen Bedingungen. Verstösse können mit Sanktionen geahndet werden, darunter Geldbussen in Höhe von bis zu 20 Prozent des weltweiten Jahresumsatzes der Konzerne.</p><p>Damit auch die Schweizer Bevölkerung und die Schweizer Wirtschaft von den wichtigen Zielen dieser Gesetzgebung profitieren können, wird der Bundesrat beauftragt, die nötigen Gesetzesanpassungen vorzuschlagen, welche möglichst kompatibel mit dem europäischen Recht sind.</p>",NA,NA
23.3449,7,2023-04-11,Keine Schweizer Too-big-to-fail-Banken mehr,"Der Bundesrat wird beauftragt, der Bundesversammlung eine Gesetzesrevision zu unterbreiten, die sicherstellt, dass keine Schweizer Bank mehr ""zu gross ist, um unterzugehen"" (too big to fail, TBTF).
Sollte dies nicht möglich sein, sind die ""Too big to fail""-Banken zu verpflichten, ihre Bankteile, die sie ""too big to fail"" machen, zu veräussern oder stillzulegen.
//
Es liegt im Gesamtinteresse der Schweiz, dass keine Bank mehr so gross ist, dass sie der Staat und somit der Steuerzahler aufgrund ihrer Systemrelevanz im Krisenfall retten muss. ""Too big to fail""-Banken müssen zukünftig auf eine Grösse redimensioniert werden, bei denen die betroffenen Banken nicht mehr die internationalen Finanzmärkte und die Stabilität der Schweiz als solches gefährden. Zukünftig können Banken, welche in Schieflage geraten, durch andere Akteure im freien Markt gerettet werden, ohne dass dafür Steuergelder oder Staatsgarantien aufzuwenden sind.",NA,"NEW DT,  ,added"
23.7084,NA,2023-03-01,Ukraine - Krieg und Frieden,"<p>Gegenwärtig dominiert der von Russland angezettelte Krieg mit vielen Opfern und unermesslichem Leid das Geschehen in der Ukraine. Ein Frieden scheint leider in weiter Ferne.</p><p>1. Könnte die Schweiz als neutraler Staat nicht eine aktivere Rolle spielen, um den Kriegsparteien ihre guten Dienste anzubieten und Friedensverhandlungen in unserem Land durchzuführen?</p><p>2. Wäre es nicht angebracht, die im internationalen Vergleich nicht allzu grosszügige humanitäre Hilfe für die Ukraine deutlich zu erhöhen?</p>",NA,NA
23.101,NA,2023-03-15,Ungleiche Spiesse bei der Medienabgabe?,"<p>Der Bundesrat beschloss am 17. April 2020, den Anteil der SRG an der Medienabgabe dauerhaft um 50 Millionen Schweizer Franken auf 1,25 Milliarden, um den Rückgang der Werbung zu kompensieren, zu erhöhen. Er teilte damals mit, aufgrund der leicht höheren Einnahmen stünden auch den privaten Radio- und Fernsehsendern mehr Mittel aus dem Gebührentopf zur Verfügung. Auf eine vergleichbare Kompensation privaten Radio- und Fernsehveranstalter verzichtete er allerdings.</p><p>1. Wie stark haben sich die Einnahmen aus der Mediengebühr erhöht und in welchem Ausmass wurden die an die privaten Radio- und Fernsehsender ausgeschütteten Mittel angepasst? Wie sind die Aussichten für die kommenden Jahre?</p><p>2. Wofür wird der hohe Liquiditätsbestand (Ende 2022: 357 Mio CHF) verwendet? Können auch die privaten Sender Nutzniesser sein oder nur die SRG?</p><p>3. Wie beurteilt der Bundesrat die Tatsache, dass es aufgrund eines geplanten neuen Verteilschlüssels des BAKOM ab 2025 bei sehr vielen Regionalfernsehen und -radios sogar zu einer massiven Senkung der Gebührenanteile kommen dürfte?</p>",NA,NA
